listing_id,listing_title,latitude,longitude,location_name,number_reviews,average_rating,average_nightly_price,nightly,weekend_night,property_protection_fee,cleaning_fee,tax_rate,min_stay,sleeps,bedrooms,bathrooms,property_type,internet,member_since,response_time,response_rate,calendar_last_updated,type,floor,sq_footage,max_occupancy,building_type,city,state
4173029ha,"5 min Disneyland  **Pool, Large Yard, Modern Decor** 3B/2.5B NEW",33.79522082,-117.92782894,"Southwest Anaheim, Anaheim, CA, USA",24,,299,255,285,,225,15.0%,2,10,3,2,house,Yes,2015,Within an hour,100%,"June 8, 2017",house,,1800,10,,Santa Ana,CA
904880,Marriott Newport Coast Villas Weekly Rentals Available Year Round,33.5837239,-117.8438259,"Newport Coast, Newport Beach, CA, USA",1,,500,,,,,,7,8,2,2,villa,No,2016,Within an hour,100%,"June 6, 2017",villa,,,8,,Santa Ana,CA
889108,Balboa Island Bungalow 100 yards from town and only 40 yards from the beach!,33.6047966,-117.8895957,"Newport Center, Newport Beach, CA, USA",1,,239,225,250,,75,,2,4,1,1,bungalow,Yes,2016,Within 2 days,100%,"June 9, 2017",bungalow,,800,4,,Santa Ana,CA
960514,Favorite Family Vacation Beach Home (upper unit),33.612706,-117.931501,"Balboa Peninsula, Newport Beach, CA, USA",0,,235,,,,,,0,8,3,2,house,Yes,2004,Within a day,,"June 8, 2017",house,,,8,,Santa Ana,CA
1005533,Luxury Resort Style View Home - Next to Beach & Golf,,,"Laguna Niguel, CA, USA",1,,850,850,,,350,,3,7,4,3,house,No,2017,Within a few days,70%,"May 26, 2017",house,,,,,Santa Ana,CA
840823,Balboa Island 3 bed 3 bath - Just Remodeled! Luxury Home With AC!,33.605564,-117.895373,"Balboa Island, Newport Beach, CA, USA",1,,686,,,,,,3,11,3,3,house,Yes,2014,Within a day,,"June 9, 2017",house,,,11,,Santa Ana,CA
968623ha,"Newly Renovated Triplex, Ocean Front, Private Balcony, Views, BBQ ! (68166)",33.606174,-117.91957,"Balboa Peninsula, Newport Beach, CA, USA",59,4.6,431,,,,,,3,6,2,2,house,Yes,2008,Within a day,,"June 9, 2017",house,,,6,,Santa Ana,CA
414080,Resort Style Villa with Private Pool & Spa Just 10 from the Beach!,33.54456329,-117.68151855,"Laguna Niguel, CA, USA",4,,500,,,,200,2.9%,7,6,3,2,villa,Yes,2013,Within a day,90%,"June 6, 2017",villa,,,6,,Santa Ana,CA
3905376ha,"1BR Condo 1 Mile From Disneyland w /Resort Pool, Mini Golf & WiFi",33.796386,-117.913707,"Anaheim Resort, Anaheim, CA, USA",2,,171,,,,,,1,4,1,1,hotel,Yes,2014,Within an hour,,"June 9, 2017",hotel,,,4,,Santa Ana,CA
3968414ha,Beach Front Panoramic Ocean View Big Corona Beach Top Unit,33.594368,-117.875153,"Corona Del Mar, Newport Beach, CA, USA",2,,765,700,,,250,10.0%,3,6,3,2,condo,Yes,2015,Within a few days,70%,"May 26, 2017",condo,3,,6,house,Santa Ana,CA
754106,10% OFF MAY!  Sleeps 14 Whole House!  30 Seconds to Beach/Dining  Parking/WiFi,33.6210626,-117.9387815,"Balboa Peninsula, Newport Beach, CA, USA",3,4.7,435,329,354,,350,10.0%,2,14,4,3,house,Yes,2010,Within an hour,100%,"June 9, 2017",house,,1825,,,Santa Ana,CA
846268,Laguna Beach hillside ocean retreat,,,"Arch Beach Heights, Laguna Beach, CA, USA",14,,240,240,,,75,,3,2,2,1,apartment,Yes,2016,Within 12 hours,100%,"May 31, 2017",apartment,1,1000,2,house,Santa Ana,CA
4247331ha,"Heated Pool, Luxury Home, minutes from Disneyland",33.812229,-117.838721,"Orange, CA, USA",3,4.7,299,299,349,,160,,2,11,3,2,house,Yes,2016,Within an hour,100%,"June 8, 2017",house,,1950,11,,Santa Ana,CA
947976,"Sunset Beach Ohana Home - Panoramic Views, Amazing Location",,,"Sunset Beach, Huntington Beach, CA, USA",0,,571,,,,200,,5,10,3,3,house,Yes,2015,Within a few hours,100%,"June 8, 2017",house,,2300,10,,Santa Ana,CA
1041123,Newly Remodeled Beach 4plex ~ Pets Allowed ~ 2 Miles to the Beach!!,33.6381157,-117.9279911,"Westside Costa Mesa, Costa Mesa, CA, USA",1,,127,119,139,,100,9.0%,2,4,2,1,apartment,No,2017,Within a few hours,100%,"June 8, 2017",apartment,,,,,Santa Ana,CA
4500643ha,Close to the Beach - 54' Luxury Yacht - Seal Beach/Huntington Beach  - Sleeps 13,,,"Huntington Harbour (Huntington Beach, CA, USA)",0,,285,279,299,,100,,,13,2,2,yacht,No,2017,Within 12 hours,100%,"June 7, 2017",yacht,,700,,,Santa Ana,CA
1050058,"Oceanfront Boardwalk property, Newly remodeled Large patio, Steps to the sand.",33.601072,-117.89845,"Balboa Peninsula, Newport Beach, CA, USA",7,4.9,443,450,,,220,10.0%,4,8,3,2,apartment,Yes,2017,Within a few days,77%,"June 5, 2017",apartment,1,,,,Santa Ana,CA
1074016,"Newly Remodeled 2Bd Home. Quiet Area Close To Beaches, Disneyland ,",,,"Mesa Verde, Costa Mesa, CA, USA",1,,176,155,,,95,,3,6,2,1,house,Yes,2014,Within an hour,100%,"June 8, 2017",house,,900,,,Santa Ana,CA
968622ha,"Newly Remodeled Ocean Front 1st Floor Triplex, Private Patio & BBQ! (68165)",33.606174,-117.91957,"Balboa Peninsula, Newport Beach, CA, USA",90,4.3,424,,,,,,3,6,2,2,house,Yes,2008,Within a day,,"June 9, 2017",house,,,6,,Santa Ana,CA
3000640ha,"Brand New Beautiful Ocean Front Single Family, Best Beach Location (68384)",33.615048,-117.934441,"Balboa Peninsula, Newport Beach, CA, USA",15,4.5,,,,,,,7,8,4,4,house,Yes,2008,Within a day,,"June 9, 2017",house,,,8,,Santa Ana,CA
3000650ha,Style and Panache at Peninsula Point! Walking Distance to Beach! (68312),33.598732,-117.888802,"Balboa Peninsula, Newport Beach, CA, USA",13,4.8,246,,,,,,2,6,3,2,house,Yes,2008,Within a day,,"June 9, 2017",house,,,6,,Santa Ana,CA
422309,Ocean View Gem,33.7148896,-118.0682615,"Sunset Beach, Huntington Beach, CA, USA",2,,500,,,,,,7,6,2,2,townhome,Yes,2012,Within a few days,90%,"May 16, 2017",townhome,,1500,6,,Santa Ana,CA
562892,Beautiful Beach Home In Downtown Huntington Beach W/ Saltwater Pool & Spa,,,"Yorktown, Huntington Beach, CA, USA",5,4.2,,,,,400,,5,14,6,4,house,Yes,2014,Within 12 hours,100%,"June 8, 2017",house,,3000,14,,Santa Ana,CA
4054639ha,Beautiful Views Await You in this Upper Just a Short Walk From the Balboa Pier,33.6010996,-117.89862435,"Balboa Peninsula, Newport Beach, CA, USA",0,,329,,,,,,3,8,3,2,condo,Yes,2006,Within an hour,,"June 8, 2017",condo,2,1222,8,,Santa Ana,CA
792806,Beautiful Relaxing Pool/Beach Home,33.51256613,-117.70928932,"Laguna Niguel, CA, USA",3,4.7,975,975,,,300,,3,12,4,3,house,Yes,2015,,0%,"June 8, 2017",house,,3700,12,,Santa Ana,CA
845493,Luxury Park Viridian! Close to Disneyland!,33.80389148,-117.8930783,"Platinum Triangle, Anaheim, CA, USA",1,,145,140,,,,15.0%,30,4,2,2,apartment,Yes,2015,Within a few days,80%,"June 2, 2017",apartment,5,992,4,building,Santa Ana,CA
871712,***Grand Opening!**Pool**+ WiFi+Game Room!**Summer Sale!**,33.823173,-117.933579,"Southwest Anaheim, Anaheim, CA, USA",4,4.5,446,,,,,,3,13,5,2,house,Yes,2006,Within an hour,,"June 8, 2017",house,,1850,13,,Santa Ana,CA
893543,"Lux Family 3 Bed Costa Mesa - 10min beach- A/C, WiFi, Yard / Patio w BBQ -Garage",33.65754179,-117.91115632,"Costa Mesa, CA, USA",8,,295,210,230,,,,2,8,3,2,condo,Yes,2015,Within an hour,100%,"June 8, 2017",condo,1,1100,,house,Santa Ana,CA
1024818,City approved ! 10 Houses from  the Beach,33.7389283,-118.1008709,"Old Towne, Seal Beach, CA, USA",2,,200,200,,,150,12.0%,4,4,1,1,house,Yes,2008,Within 12 hours,100%,"June 7, 2017",house,,700,,,Santa Ana,CA
211095,"STEPS TO BEACH, 3 BR/2 BATH 2800 sq feet",33.5957756,-117.86846924,"Corona Del Mar, Newport Beach, CA, USA",25,4.8,666,900,,,,10.0%,4,8,3,2,house,Yes,2008,Within 12 hours,100%,"June 7, 2017",house,,2800,,,Santa Ana,CA
243838,Beautiful Nantucket Style Designer Home Near Montage Resort,33.54225,-117.78311,"Laguna Beach, CA, USA",2,,850,850,,,,,7,7,3,3,house,Yes,2009,Within a day,100%,"April 28, 2017",house,,,7,,Santa Ana,CA
278928ha,Beachfront luxury home awaits your visit.,33.6120986,-117.9315454,"Balboa Peninsula, Newport Beach, CA, USA",4,,,,,,,10.0%,7,8,3,4,house,Yes,2009,Within 12 hours,90%,"June 9, 2017",house,,3000,8,,Santa Ana,CA
318001,Newport Beach Oceanfront/Boardwalk 4 Bedroom Vacation Home,33.61290359,-117.93249512,"Balboa Peninsula, Newport Beach, CA, USA",11,4.9,447,,,,,10.0%,7,8,4,2,house,Yes,2010,Within a few days,70%,"June 2, 2017",house,,,8,,Santa Ana,CA
968667ha,NEW REMODEL Family Beach Home! Steps From a Quiet Beach on the Bay! (68215),33.606447,-117.914734,"Balboa Peninsula, Newport Beach, CA, USA",30,4.6,480,,,,,,2,11,4,3,house,Yes,2008,Within a day,,"June 9, 2017",house,,,11,,Santa Ana,CA
427127,BEACHFRONT *LAST MINUTE DISCOUNT*Seal Beach's ONLY Licensed Weekly rental:,33.73792,-118.103328,"Old Towne, Seal Beach, CA, USA",25,,500,,,,,12.0%,6,6,3,2,townhome,Yes,2012,Within a few hours,100%,"June 7, 2017",townhome,1,,6,,Santa Ana,CA
3497520ha,Enjoy Ocean Views from the Large Roof-Top Deck Adjacent to the Newport Pier!,33.6106064,-117.9295948,"Balboa Peninsula, Newport Beach, CA, USA",0,,300,,,,,,3,8,3,2,condo,Yes,2006,Within an hour,,"June 4, 2017",condo,2,1162,8,,Santa Ana,CA
3497600ha,Newly remodeled upper oceanfront unit just steps from the Balboa Pier fun!,33.6018349,-117.9002338,"Balboa Peninsula, Newport Beach, CA, USA",5,4.6,306,,,,,,3,7,2,2,condo,Yes,2006,Within an hour,,"June 8, 2017",condo,2,885,7,,Santa Ana,CA
3497542ha,Amazing location!This upper unit has amazing views & on a great part of the sand,33.61639173,-117.93565983,"Balboa Peninsula, Newport Beach, CA, USA",0,,471,,,,,,3,8,3,2,apartment,Yes,2006,Within an hour,,"June 8, 2017",apartment,2,1150,8,,Santa Ana,CA
3523856ha,Spacious and cute upper unit located just 3 houses from the beach!,33.623378,-117.943496,"Newport Beach, CA, USA",3,4.3,214,,,,,,1,10,4,2,condo,Yes,2006,Within an hour,,"June 8, 2017",condo,2,1490,10,,Santa Ana,CA
598177,ENDLESS SUMMER -- Gorgeous Laguna Beach House -- Steps To Sand,,,"Woods Cove (Laguna Beach, CA, USA)",1,,750,750,,,300,,31,7,4,3,house,No,2014,Within a few days,70%,"April 12, 2017",house,,1500,,,Santa Ana,CA
633336,"Dream Laguna House w/ Pool Room, Backyard, Fireplace, Pool & Spa",,,"Laguna Niguel, CA, USA",6,4.8,259,,,,150,,14,11,4,2,house,Yes,2012,Within an hour,100%,"May 18, 2017",house,,1900,,,Santa Ana,CA
3904848ha,ROOF TOP DECK Balboa Island 3 STORY SINGLE UNIT *2 car garage *Close to WATER,33.607575,-117.890729,"Balboa Island, Newport Beach, CA, USA",11,4.6,630,,,,,,2,10,3,2,house,Yes,2015,Within an hour,,"June 8, 2017",house,,,10,,Santa Ana,CA
3904847ha,"ONE HOUSE FROM SAND! - Upgraded 3-Level Townhouse, Ocean Views from Roofdeck!",33.6284562,-117.9541881,"Newport Beach, CA, USA",12,3.8,379,,,,,,2,10,3,3,townhome,Yes,2015,Within an hour,,"June 8, 2017",townhome,,2000,10,,Santa Ana,CA
4059428ha,BALBOA BEAUTY Large Family Oceanfront with AMAZING DECK VIEW of the BEACH,33.600859,-117.897123,"Balboa Peninsula, Newport Beach, CA, USA",5,4.8,580,,,,,,5,10,4,3,house,Yes,2015,Within an hour,,"June 8, 2017",house,,,10,,Santa Ana,CA
783190,Summertime Special until 6/15! HUGE 4Bed/3Bth/Pool /Spa! Close to Disney & ACC,33.806255,-117.939739,"Hermosa Village, Anaheim, CA, USA",3,4.7,415,515,,,,15.0%,3,11,4,3,house,Yes,2013,,,"June 8, 2017",house,,2900,11,,Santa Ana,CA
4086660ha,Best Home in Anaheim 8Beds Sleep 9- Pool,,,"Hermosa Village, Anaheim, CA, USA",2,4.5,375,369,389,,,15.0%,3,9,3,2,house,Yes,2015,Within an hour,100%,"June 8, 2017",house,,,,,Santa Ana,CA
890419,Family Friendly Summer Fun!,33.60631598,-117.89397974,"Balboa Island, Newport Beach, CA, USA",1,,286,,,,150,10.0%,7,7,3,2,house,No,2011,Within 12 hours,100%,"May 29, 2017",house,,1400,7,,Santa Ana,CA
981693,"Cozy guest house , Disney knott family friendly",33.8488339,-117.986224,"Northwest Anaheim, Anaheim, CA, USA",1,,114,130,,,30,,,4,2,1,guest house,Yes,2016,Within an hour,100%,"June 5, 2017",guest house,,,4,,Santa Ana,CA
1020581,"Beautiful house in luxury  guarded  24/7 complex, minutes from the beach",33.679837,-118.02484,"Huntington Beach, CA, USA",0,,700,700,,,200,,7,8,3,2,house,Yes,2017,Within a day,100%,"May 27, 2017",house,,3250,,,Santa Ana,CA
4476861ha,15% OFF OPEN JUNE DATES - Large Roof Top Deck W/ Private Jacuzzi and AC!,33.604535,-117.875757,"Newport Center, Newport Beach, CA, USA",0,,362,,,,,,3,10,3,3,condo,Yes,2005,Within an hour,,"June 9, 2017",condo,,1500,10,,Santa Ana,CA
271734,"Lovely 4 Bdrm/4 Bath Balboa Island Beach House, A/C, Great Location",33.60694885,-117.89739227,"Balboa Island, Newport Beach, CA, USA",6,4.8,460,500,,,300,10.3%,3,9,4,4,house,Yes,2004,Within a day,100%,"June 8, 2017",house,,2300,,,Santa Ana,CA
456171,Historic Balboa Island Cottage with Large Patio for Family Fun,33.605656,-117.895844,"Balboa Island, Newport Beach, CA, USA",4,4.5,275,275,,,150,10.0%,4,6,3,2,house,Yes,2013,Within 12 hours,100%,"June 5, 2017",house,,1400,6,,Santa Ana,CA
492481,**Casa Melinda**5-Star Game Room**Putting Green**Pool**Wi-Fi**BBQ**,33.8413929,-117.878459,"Northeast Anaheim, Anaheim, CA, USA",24,4.6,345,,,,,,3,11,4,2,house,Yes,2006,Within an hour,,"June 8, 2017",house,,2400,11,,Santa Ana,CA
590568,Three Bedroom Downstairs Getaway - Beautiful Bay Views!,33.607298,-117.924444,"Balboa Peninsula, Newport Beach, CA, USA",2,,235,,,,,,0,6,3,2,house,Yes,2004,Within a day,,"June 9, 2017",house,,,6,,Santa Ana,CA
3836055ha,Disney/ Knott's /Hollywood /Beaches Home!,,,"Southeast Anaheim, Anaheim, CA, USA",65,4.9,287,172,,,,18.0%,3,9,3,2,house,Yes,2014,Within an hour,100%,"June 8, 2017",house,,,,,Santa Ana,CA
682654,"Modern, Spacious Oceanfront - 2nd Floor Unit!",33.60707697,-117.924293,"Balboa Peninsula, Newport Beach, CA, USA",9,4.8,445,,,,,,3,10,3,2,house,Yes,2014,Within a day,,"June 9, 2017",house,,,10,,Santa Ana,CA
744007,Iris Paradise 3-Bedrooms 3.5 bath plus loft.sleeps 10,33.5978939,-117.872813,"Corona Del Mar, Newport Beach, CA, USA",5,4.4,333,375,,,150,10.0%,3,8,3,3,condo,No,2011,Within 12 hours,100%,"June 8, 2017",condo,,1800,8,building,Santa Ana,CA
801094,All New!  Walk to Conv Center & D'Land!**Pool***,33.797409,-117.9227,"Convention Center, Anaheim, CA, USA",8,4.1,267,,,,,,3,9,3,2,townhome,Yes,2006,Within an hour,,"June 8, 2017",townhome,,1350,9,,Santa Ana,CA
804448,Steps To Bay Or Beach On Peninsula Point!,33.598818,-117.886658,"Balboa Peninsula, Newport Beach, CA, USA",0,,250,,,,,,31,6,3,2,bungalow,Yes,2016,Within 12 hours,90%,"May 16, 2017",bungalow,,,6,,Santa Ana,CA
1030405,Cozy Cottage Close to Beach,,,"Huntington Beach, CA, USA",1,,260,245,,,100,8.0%,2,6,2,1,cottage,Yes,2017,Within 12 hours,100%,"June 8, 2017",cottage,,,,,Santa Ana,CA
4499534ha,Best Priced 3 bedroom Near the Beach,33.60102,-117.87356,"Corona Del Mar, Newport Beach, CA, USA",7,,280,,,,,,7,6,3,2,house,Yes,2010,Within a day,,"June 9, 2017",house,,,6,,Santa Ana,CA
1030513,Delightful Vintage Balboa Island Home,33.608275,-117.891042,"Balboa Island, Newport Beach, CA, USA",0,,500,,,,,,0,8,3,3,house,Yes,2004,Within a day,,"June 8, 2017",house,,,8,,Santa Ana,CA
970550,"Sensational ""Cape Cod"" with terrific vaulted Great Room",33.603928,-117.875797,"Corona Del Mar, Newport Beach, CA, USA",6,4.3,450,450,,,200,10.0%,3,10,5,2,condo,Yes,2016,Within a few hours,100%,"June 8, 2017",condo,2,1800,,house,Santa Ana,CA
4537621ha,"Beautiful 3b Home Near Laguna Beach, Gated Community",33.588167,-117.717735,"Aliso Viejo, CA, USA",0,,167,600,,,100,,2,6,3,3,house,No,2017,Within a day,100%,"June 8, 2017",house,,1975,,,Santa Ana,CA
169694,Exquisite L.B. House Within Walking Distance to Beach and Town,33.53828812,-117.77646637,"Laguna Beach, CA, USA",1,,200,,,,,,30,4,2,2,house,Yes,2008,Within a few days,80%,"May 28, 2017",house,,,4,,Santa Ana,CA
226445,Gorgeous Beach House - Walk to Beach & Town!,33.54153824,-117.77350616,"Laguna Beach, CA, USA",4,,534,465,,,150,12.0%,3,8,4,3,house,Yes,2009,Within 12 hours,80%,"May 9, 2017",house,,2350,8,,Santa Ana,CA
968593ha,Well Appointed Beautiful Oceanfront Single Family Home!  (68139),33.607238,-117.926792,"Balboa Peninsula, Newport Beach, CA, USA",50,4.5,962,,,,,,3,7,3,2,house,Yes,2008,Within a day,,"June 9, 2017",house,,,7,,Santa Ana,CA
3497536ha,Three stories of WOW await you!  This spectacular private home is one of a kind!,33.6101249,-117.930126,"Balboa Peninsula, Newport Beach, CA, USA",3,,786,,,,,,3,12,6,4,house,Yes,2006,Within an hour,,"June 8, 2017",house,,2184,12,,Santa Ana,CA
460066,Clean & Classy! 2 HOUSES FROM SAND!  THE BEST VALUE IN NEWPORT!,33.624024,-117.944639,"Newport Beach, CA, USA",7,,325,325,,,,10.0%,5,6,2,2,condo,Yes,2013,Within an hour,100%,"June 6, 2017",condo,2,1200,6,building,Santa Ana,CA
615592,Remodeled Pool Home! Walk To Convention Center And Disneyland,33.799302,-117.924556,"Convention Center, Anaheim, CA, USA",5,,329,329,,,185,15.0%,3,9,3,2,house,Yes,2014,Within a day,100%,"June 5, 2017",house,,,,,Santa Ana,CA
648689,Cozy 4 bedroom house**WALK to DISNEYLAND&CONVENTION CENTER! - K,33.805838,-117.934139,"Hermosa Village, Anaheim, CA, USA",12,4.8,259,245,275,,170,15.0%,3,11,4,2,house,Yes,2014,Within an hour,100%,"June 9, 2017",house,,1500,11,,Santa Ana,CA
4018029ha,"Oceanfront Beach house: steps away from beach, pier, and business district.",33.60766552,-117.92801271,"Balboa Peninsula, Newport Beach, CA, USA",11,4.8,580,690,,,,10.0%,3,10,3,2,condo,Yes,2015,Within a day,100%,"June 3, 2017",condo,1,900,10,building,Santa Ana,CA
4362050ha,Large Family Vacation House - Rare Parking for 5 Cars and AC!,33.613582,-117.930912,"Balboa Peninsula, Newport Beach, CA, USA",0,,436,,,,,,3,12,4,2,house,Yes,2005,Within an hour,,"June 9, 2017",house,,2003,12,,Santa Ana,CA
4150881ha,Resort-Style vacation home in Irvine,33.729871,-117.754092,"Northwood Point, Irvine, CA, USA",0,,244,169,,,150,10.0%,5,6,2,2,condo,No,2015,Within an hour,100%,"June 6, 2017",condo,,,,,Santa Ana,CA
1033820,Exquisite home with gourmet kitchen - less than a mile from beach,33.598107,-117.867284,"Corona Del Mar, Newport Beach, CA, USA",1,,326,,,,,,2,6,3,2,house,Yes,2001,Within an hour,,"June 9, 2017",house,,,6,,Santa Ana,CA
1056573,Paradise Pool Home in Yorba Linda!,33.89229,-117.823765,"Yorba Linda, CA, USA",0,,310,310,,,200,,3,10,4,2,house,Yes,2017,Within 12 hours,100%,"May 30, 2017",house,,1800,,,Santa Ana,CA
4531375ha,"15% OFF OPEN JUNE DATES - Rooftop Deck with Ocean View, Walk to Beach!",33.608475,-117.926502,"Balboa Peninsula, Newport Beach, CA, USA",26,4.9,350,,,,,,3,8,2,3,condo,Yes,2005,Within an hour,,"June 9, 2017",condo,,,8,,Santa Ana,CA
1034994,Newly Listed -  Summer Vacation Home with 2 balconies and Gorgeous Ocean Views!,33.617134,-117.935043,"Balboa Peninsula, Newport Beach, CA, USA",2,,450,,,,,,0,10,4,2,house,Yes,2004,Within a day,,"June 9, 2017",house,,,,,Santa Ana,CA
189076,Fantastic location 1 Block from Main St. 2 blocks from the beach and affordable!,,,"Huntington Beach, CA, USA",24,4.8,371,410,,,225,,5,10,4,2,house,Yes,2002,Within an hour,100%,"May 1, 2017",house,,2000,10,,Santa Ana,CA
283171,Starfish Bungalow August Special $225.00 per night (5 night or More),33.73706818,-118.09888458,"Old Towne, Seal Beach, CA, USA",95,,325,325,,,,12.0%,5,6,2,1,cottage,Yes,2008,Within a few days,90%,"June 5, 2017",cottage,,1200,,,Santa Ana,CA
325876ha,June & July dates still available!!!,,,"Newport Beach, CA, USA",12,4.8,280,280,,,,,3,6,3,2,bungalow,Yes,2010,Within a day,100%,"March 7, 2017",bungalow,,1150,6,,Santa Ana,CA
622271,Balboa Island Escape With Easy Access to Bay & Ocean,33.6062994,-117.8974474,"Balboa Island, Newport Beach, CA, USA",8,,283,200,250,,,,4,7,2,2,house,Yes,2005,Within 2 days,90%,"June 8, 2017",house,,1100,7,,Santa Ana,CA
698765,"Superb Villa in Village 3 Blks to Beach, 1 blk to Downtown, Priv. Res. Parking",33.544103,-117.778937,"Laguna Beach, CA, USA",28,4.9,140,,,,,,6,4,1,1,apartment,Yes,2015,Within an hour,100%,"June 6, 2017",apartment,1,800,4,villa,Santa Ana,CA
705061,"Walk to Disney, Watch fireworks front yard, Spa, Newly remolded, Super clean",33.823461,-117.913374,"Southwest Anaheim, Anaheim, CA, USA",16,4.9,273,273,279,,160,15.0%,3,11,3,2,house,No,2015,Within an hour,100%,"June 6, 2017",house,,1500,11,,Santa Ana,CA
712581,Newport Beach Surf And Sand Spanish Cottage Best Oceanview Location!!!,33.613593,-117.932821,"Balboa Peninsula, Newport Beach, CA, USA",3,,500,395,425,,150,10.0%,3,8,3,2,cottage,No,2013,Within 12 hours,90%,"June 2, 2017",cottage,,1600,8,,Santa Ana,CA
722022,YOUR SUMMER HOT SPOT !!,33.658405,-117.996833,"Huntington Beach, CA, USA",5,4.4,575,550,600,,250,10.0%,3,10,3,2,house,Yes,2015,Within a day,100%,"May 16, 2017",house,,2500,10,,Santa Ana,CA
731027,Fully-Furnished Beach Cottage With Private Backyard Oasis - 1/2 Mile from Beach,33.6623049,-117.9954474,"Huntington Beach, CA, USA",8,,365,405,,,250,,5,6,3,2,cottage,Yes,2015,Within 12 hours,100%,"June 8, 2017",cottage,,1100,6,,Santa Ana,CA
768270,"Near Anaheim Convention, Disney, Chapman University, Newport Beach, Irvine",33.819739,-117.792669,"Orange, CA, USA",3,,275,275,,,,10.0%,7,8,4,2,house,Yes,2006,Within a few hours,90%,"June 4, 2017",house,,3000,8,,Santa Ana,CA
801087,California Sunshine!**Newly Upgraded**Walk to Disneyland*Game Room!**WiFi**,33.821254,-117.92537,"Southwest Anaheim, Anaheim, CA, USA",23,4.7,325,,,,,,3,9,3,2,house,Yes,2006,Within an hour,,"June 8, 2017",house,,1550,9,,Santa Ana,CA
4209793ha,Immensely Charming Apartment on Balboa Island,33.60513299,-117.88950987,"Newport Center, Newport Beach, CA, USA",4,4.5,216,225,,,50,10.0%,2,3,1,1,apartment,Yes,2001,Within a few days,90%,"June 1, 2017",apartment,2,600,3,cottage,Santa Ana,CA
4306120ha,"Apt. on the sand, private space NO.5",33.606829,-117.923557,"Balboa Peninsula, Newport Beach, CA, USA",0,,200,,,,,,,4,2,1,apartment,Yes,2013,,,"June 8, 2017",apartment,,,4,,Santa Ana,CA
772394,Cozy Duplex Unit 1.6 Miles to The Water in Newport Beach,33.6338187,-117.9134204,"East Side Costa Mesa, Costa Mesa, CA, USA",0,,135,130,150,,100,8.75%,2,5,2,1,house,No,2017,Within a day,90%,"June 5, 2017",house,,,,,Santa Ana,CA
973738,Remodeled Beach Townhouse with Air Conditioning and Parking,33.6223012,-117.941538,"West Newport, Newport Beach, CA, USA",0,,750,650,700,,250,10.0%,2,10,4,3,townhome,Yes,2017,Within an hour,100%,"June 8, 2017",townhome,,1860,10,,Santa Ana,CA
1033024,Newly upgraded Newport Heights Neighborhood,,,"East Side Costa Mesa, Costa Mesa, CA, USA",0,,300,300,,,100,,4,8,3,2,house,Yes,2008,,,"June 8, 2017",house,,1500,8,,Santa Ana,CA
1041125,Remodel Beach 4PLEX ~  Pets Allowed!!,33.6381157,-117.9279911,"Westside Costa Mesa, Costa Mesa, CA, USA",0,,126,119,139,,100,9.0%,2,6,2,1,apartment,No,2017,Within 12 hours,100%,"June 5, 2017",apartment,,,,,Santa Ana,CA
306411,Charming & Cozy Villa with Beautiful Views of The Pacific Ocean!,33.53710938,-117.7797699,"Laguna Beach, CA, USA",6,,590,,,,,,3,4,1,1,villa,Yes,2010,Within an hour,,"June 8, 2017",villa,,900,4,,Santa Ana,CA
3497576ha,"Breathtaking, unique & highly upgraded lower unit right on the Balboa Boardwalk!",33.6024652,-117.9025773,"Balboa Peninsula, Newport Beach, CA, USA",4,,738,,,,,,3,13,4,3,condo,Yes,2006,Within an hour,,"June 8, 2017",condo,1,1920,13,,Santa Ana,CA
3624930ha,Contemporary Lower Condo Walking Distance to Beach! (68219),33.617082,-117.93304,"Balboa Peninsula, Newport Beach, CA, USA",35,4.1,299,,,,,,2,6,3,2,house,Yes,2008,Within a day,,"June 9, 2017",house,,,6,,Santa Ana,CA
3755457ha,Gorgeous Classic Beach Cottages (68369),33.6192135,-117.935668,"Balboa Peninsula, Newport Beach, CA, USA",12,4.2,463,,,,,,2,10,3,3,house,Yes,2008,Within a day,,"June 9, 2017",house,,,10,,Santa Ana,CA
3885568ha,Oceanfront Remodeled Lower Duplex - Large Patio on the Sand with BBQ! (68387),33.61644935,-117.9356922,"Balboa Peninsula, Newport Beach, CA, USA",6,,450,,,,,,2,6,2,2,house,Yes,2008,Within a day,,"June 9, 2017",house,,,6,,Santa Ana,CA
717727,!!!WINTER SPECIAL!!! 3 bedroom vacation home 1 mile from Disneyland.,33.813524,-117.949522,"Hermosa Village, Anaheim, CA, USA",4,,400,425,,,275,,3,10,3,2,house,Yes,2015,Within 2 days,100%,"June 9, 2017",house,,2100,10,,Santa Ana,CA
4022447ha,Roof Top Deck BEACH VIEW *2-Story Corner House* MOST POPULAR AREA of Newport!,33.618363,-117.935493,"Balboa Peninsula, Newport Beach, CA, USA",1,,532,,,,,,2,10,4,3,house,Yes,2015,Within an hour,,"June 8, 2017",house,,1988,10,,Santa Ana,CA
801086,Walk to Disneyland!  Steps to Convention Center!  Sunshine Sale!,33.797477,-117.924201,"Convention Center, Anaheim, CA, USA",9,4.6,298,,,,,,3,9,3,2,house,Yes,2006,Within an hour,,"June 8, 2017",house,,1200,9,,Santa Ana,CA
825374,Exquisite Penthouse Villa with Stunning Costal Views!,33.5371149,-117.7797738,"Laguna Beach, CA, USA",12,4.8,564,,,,,,3,4,1,1,villa,Yes,2010,Within an hour,,"June 8, 2017",villa,,950,4,,Santa Ana,CA
4246831ha,"Beautiful Tustin Ranch 1st Floor Villa 2 Bedroom, 2 Bath, Pool, Great For Kids",33.7346201,-117.7914249,"Lower Peters Canyon, Irvine, CA, USA",0,,199,199,,,,8.0%,7,6,2,2,condo,Yes,2016,Within a few days,100%,"June 6, 2017",condo,1,1200,6,building,Santa Ana,CA
918296,Summertime Special until 6/15! Paradise! HUGE 4Bd/2.5Bth/Pool/Spa! Disney-close!,33.841298,-117.872835,"Northeast Anaheim, Anaheim, CA, USA",3,,432,515,,,,15.0%,3,11,4,2,house,Yes,2013,,,"June 8, 2017",house,,2700,11,,Santa Ana,CA
4292578ha,3 br duplex on the beach with ocean view,33.601403,-117.899342,"Balboa Peninsula, Newport Beach, CA, USA",0,,893,,,,,,2,8,3,2,apartment,Yes,2013,,,"June 7, 2017",apartment,,1950,8,,Santa Ana,CA
962099,Peninsula Home Steps to Beach,33.747714,-118.122333,"Peninsula, Long Beach, CA, USA",0,,201,200,,,100,,3,3,1,1,apartment,Yes,2010,,,"June 8, 2017",apartment,,520,3,house,Santa Ana,CA
4465747ha,"Walk to Disney & Watch the Fireworks! Private Pool & Spa, Great for Large Groups",33.815919,-117.929078,"Hermosa Village, Anaheim, CA, USA",0,,499,499,,,310,15.0%,3,17,7,4,house,No,2017,Within a few hours,100%,"June 8, 2017",house,,,,,Santa Ana,CA
1015496,Idyllic Location for an Idyllic Destination!,33.530956,-117.770853,"Woods Cove (Laguna Beach, CA, USA)",0,,350,350,,,150,,4,6,2,2,house,No,2017,Within a few days,100%,"June 7, 2017",house,,1500,6,,Santa Ana,CA
4546715ha,"4 Blocks to Beach New Spanish Mansion Sleeps 12 Comfortably, 8 Bedrooms, 9 Beds",33.7672406,-118.1455927,"Belmont Heights, Long Beach, CA, USA",0,,585,585,,,350,,4,12,8,5,house,Yes,2015,Within 12 hours,100%,"June 2, 2017",house,,4500,,,Santa Ana,CA
