listing_id,listing_title,latitude,longitude,location_name,number_reviews,average_rating,average_nightly_price,nightly,weekend_night,property_protection_fee,cleaning_fee,tax_rate,min_stay,sleeps,bedrooms,bathrooms,property_type,internet,member_since,response_time,response_rate,calendar_last_updated,type,floor,sq_footage,max_occupancy,building_type,city,state
676311,PLEASE CONTACT OWNER BEFORE BOOKING,33.60702189,-117.8970911,"Balboa Island, Newport Beach, CA, USA",7,,339,,,,250,10.0%,5,6,3,2,house,Yes,2015,Within a few hours,90%,"May 31, 2017",house,,,6,house,Santa Ana,CA
276461,Owners unit Near end of peninsula steps to beach,33.59892273,-117.89199829,"Balboa Peninsula, Newport Beach, CA, USA",4,,271,,,,200,10.0%,14,6,2,2,apartment,Yes,2009,,,"May 20, 2017",apartment,2,,6,building,Santa Ana,CA
7040153ha,On the sand in Huntington Bch whitewater views in all rooms,33.658897,-118.00545,"Huntington Beach, CA, USA",0,,429,,,,200,,28,9,3,2,condo,No,2008,,,"May 25, 2017",condo,,,9,,Santa Ana,CA
482375,Celebrity Designer Gated View Home With All Tile Salt Water Pool,33.621898,-117.903217,"Newport Beach, CA, USA",1,,670,670,,,,,31,6,5,5,house,Yes,2013,Within an hour,100%,"June 7, 2017",house,,4200,6,,Santa Ana,CA
4200435ha,"Huge Balboa Bayfront Home - Steps to Beach, Pier, Restaurants, Park and Fun",33.601661,-117.897739,"Balboa Peninsula, Newport Beach, CA, USA",1,,,,,,,,2,18,7,7,house,Yes,2008,Within a day,,"June 9, 2017",house,,,18,,Santa Ana,CA
406064,"Luxurious Villa Panoramic Views Close to Newport, Laguna Beach",33.62648392,-117.81954956,"Turtle Ridge, Irvine, CA, USA",1,,900,800,,,500,,14,8,4,4,house,Yes,2012,Within a day,90%,"June 9, 2017",house,,4300,8,,Santa Ana,CA
4563299ha,One house from the Beach! Great Location! New Split Level Remodeled Bungalow.,33.607071,-117.922858,"Balboa Peninsula, Newport Beach, CA, USA",0,,361,,,,,,2,6,3,2,house,Yes,2008,Within a day,,"June 9, 2017",house,,,6,,Santa Ana,CA
146776,Casa de Balboa 229 - Luxury Beachfront  From $350/nt,33.60911179,-117.92628479,"Balboa Peninsula, Newport Beach, CA, USA",42,,542,392,,,200,10.0%,2,8,3,2,townhome,Yes,2005,,,"June 1, 2017",townhome,2,,8,,Santa Ana,CA
4367538ha,"7 Bedroom Compound, Sleeps 18, 2 Jacuzzi's, Rooftop deck & Ocean Views!!",33.61285,-117.931127,"Balboa Peninsula, Newport Beach, CA, USA",0,,,,,,,,4,18,7,6,condo,Yes,2005,Within an hour,,"June 9, 2017",condo,,,18,,Santa Ana,CA
1030489,Corona Del Mar / Newport Beach Home - 1.5 Miles to the Beach! 3 Bedroom Home,,,"Corona Del Mar, Newport Beach, CA, USA",0,,525,525,,,300,,30,10,3,2,house,No,2015,Within an hour,100%,"June 9, 2017",house,,,,,Santa Ana,CA
1049831,"Newport Coast Splendor! Two bedroom villas, fully equipped, amazing views!",33.5825787,-117.8427264,"Newport Coast, Newport Beach, CA, USA",0,,452,300,,,,,7,8,2,2,condo,Yes,2016,Within an hour,100%,"June 7, 2017",condo,,,,building,Santa Ana,CA
968658ha,Affordable 3 Bedroom Beach House Close to Ocean and Bay!!,33.60458713,-117.90389276,"Balboa Peninsula, Newport Beach, CA, USA",24,4.2,,,,,,,2,8,3,2,house,Yes,2008,Within a day,,"June 9, 2017",house,,,8,,Santa Ana,CA
499628,Extended Stay Rental & Pricing - Snowbirds Welcome All Year Long!,33.659625,-118.000169,"Huntington Beach, CA, USA",0,,183,,,,,,90,6,2,2,townhome,Yes,2014,Within a few days,70%,"July 5, 2016",townhome,2,1600,6,villa,Santa Ana,CA
968584ha,Beautiful Lower Oceanfront Condo! Patio & Close to Balboa Pier! (68131),33.602465,-117.903018,"Balboa Peninsula, Newport Beach, CA, USA",68,4.3,552,,,,,,3,8,2,2,house,Yes,2008,Within a day,,"June 9, 2017",house,,,8,,Santa Ana,CA
977016,2B 2B Irvine Spectrum @The Village,,,"Irvine Spectrum Center, Irvine, CA, USA",0,,400,400,,,125,,3,6,2,2,apartment,No,2016,Within an hour,100%,"May 12, 2017",apartment,,,,,Santa Ana,CA
3949762ha,"Serene 3 bedr, 2 ba midcentury house suroundded by a stunning Garden, 1 M beach",33.681612,-118.008371,"Huntington Beach, CA, USA",0,,181,,,,,10.0%,30,4,3,2,house,Yes,2015,,,"April 28, 2017",house,,2000,4,,Santa Ana,CA
1076139,Perfect Beach Cottage,,,"Balboa Peninsula, Newport Beach, CA, USA",0,,246,190,320,,175,10.0%,7,6,1,1,house,No,2017,Within a few days,83%,"June 6, 2017",house,,,,,Santa Ana,CA
355507,Beautiful 4 Bdr Townhouse. Close to Beach and Shopping.,,,"Newport Coast, Newport Beach, CA, USA",6,,267,,,,,,60,7,4,3,townhome,Yes,2011,Within a day,100%,"April 24, 2017",townhome,,,7,,Santa Ana,CA
1056870,"129 Opal Ave. Balboa Island, Newport Beach, CA",33.6061364,-117.8971936,"Balboa Island, Newport Beach, CA, USA",0,,245,300,,,120,10.0%,2,6,2,2,apartment,Yes,2014,Within a few days,60%,"May 29, 2017",apartment,1,,,,Santa Ana,CA
853162,Luxury Beach Home In Corona Del Mar,33.594178,-117.872563,"Corona Del Mar, Newport Beach, CA, USA",0,,833,,,,,,31,6,3,2,house,Yes,2016,Within a few hours,100%,"June 8, 2017",house,,2500,6,,Santa Ana,CA
3497598ha,Spacious lower oceanfront located within walking distance of the Balboa Pier fun,33.6018349,-117.9002338,"Balboa Peninsula, Newport Beach, CA, USA",2,,454,,,,,,1,8,3,2,condo,Yes,2006,Within an hour,,"June 8, 2017",condo,1,1074,8,,Santa Ana,CA
1071474,Brand New Listing!!! Beautiful 5 Bedroom Beach House With Summer Availability!,33.617527,-117.936148,"Balboa Peninsula, Newport Beach, CA, USA",0,,,750,,,375,10.0%,3,10,5,3,house,Yes,2014,Within an hour,100%,"June 5, 2017",house,,3000,,,Santa Ana,CA
3497602ha,Spacious upper rear oceanfront unit just steps from the Balboa Pier fun!,33.6018349,-117.9002338,"Balboa Peninsula, Newport Beach, CA, USA",0,,233,,,,,,1,6,2,2,condo,Yes,2006,Within an hour,,"June 8, 2017",condo,2,940,6,,Santa Ana,CA
873965,"New Home, Gorgeous 4 Bedroom-Sized House",,,"Orange County Great Park, Irvine, CA, USA",0,,,,,,,,31,8,4,3,house,Yes,2016,Within an hour,,"May 28, 2017",house,,,8,,Santa Ana,CA
303762,Balboa Island by the Bay,33.60523224,-117.89031219,"Newport Center, Newport Beach, CA, USA",3,4.7,371,350,,,125,10.0%,7,4,2,1,house,Yes,2010,Within a few days,40%,"May 17, 2017",house,,1000,,,Santa Ana,CA
331083,Adorable Beach Studio~Private and Only 1 mile to Beach/ 2 Bikes,33.66597366,-117.98013306,"Huntington Beach, CA, USA",12,4.7,137,99,,,,4.0%,2,3,Studio,1,studio,Yes,2010,Within a few days,90%,"June 5, 2017",studio,1,400,3,,Santa Ana,CA
855661,Breezy Beach-Chic Condo in Heart of Corona Del Mar,33.59617899,-117.86542264,"Corona Del Mar, Newport Beach, CA, USA",3,,267,,,,,,30,6,2,2,condo,Yes,2006,Within an hour,,"June 9, 2017",condo,,1316,6,,Santa Ana,CA
265552,Lido Isle Home just Next door to Balboa Island,33.61891,-117.92895,"Balboa Peninsula, Newport Beach, CA, USA",0,,253,,,,,10.0%,30,9,3,2,house,No,2009,,,"February 26, 2017",house,,,9,,Santa Ana,CA
794183,"650 Sq. Ft. Studio with Large Patio, Fully Furnished Executive Suite",33.66816156,-117.987756,"Huntington Beach, CA, USA",0,,93,,,,,,31,2,1,1,condo,Yes,2015,Within a few days,70%,"March 11, 2017",condo,1,750,2,building,Santa Ana,CA
876089,Blue Ocean Townhouse in Irvine,,,"Portola Springs, Irvine, CA, USA",0,,366,,,,,,31,6,3,2,house,No,2016,Within an hour,,"May 18, 2017",house,,,6,,Santa Ana,CA
4360309ha,Oceanview Condo - Steps from the beach!,33.607823,-117.927771,"Balboa Peninsula, Newport Beach, CA, USA",0,,555,350,,,,10.0%,3,7,3,2,condo,No,2015,Within a few days,66%,"June 3, 2017",condo,,,,,Santa Ana,CA
388695,Serene and Large 3bd 2BA Midcentury Modern Home,33.68162537,-118.00837708,"Huntington Beach, CA, USA",0,,178,,,,,10.0%,31,4,3,2,house,Yes,2011,,,"April 28, 2017",house,,2000,4,,Santa Ana,CA
3497525ha,Cute and whimsy lower unit just a few skips away from the Boardwalk and shops!,33.612026,-117.930566,"Balboa Peninsula, Newport Beach, CA, USA",0,,,,,,,,1,4,1,1,condo,Yes,2006,Within an hour,,"June 4, 2017",condo,1,627,4,,Santa Ana,CA
1067037,1600 Square Foot Bottom Unit In Duplex Only 3 Houses From Sand With Ac & Parking,,,"West Newport, Newport Beach, CA, USA",0,,610,500,,,225,10.0%,2,8,3,3,condo,No,2017,Within an hour,100%,"June 8, 2017",condo,,,,,Santa Ana,CA
185065ha,Waterfront on the Grand Canal,33.6071609,-117.8894433,"Newport Center, Newport Beach, CA, USA",2,,242,,,,,10.0%,7,4,2,1,apartment,Yes,2005,Within a few days,70%,"June 6, 2017",apartment,2,,4,house,Santa Ana,CA
4360308ha,The Heart of Newport Beach!,33.6078364,-117.92778441,"Balboa Peninsula, Newport Beach, CA, USA",0,,610,400,,,,10.0%,3,10,4,2,condo,Yes,2015,Within a few days,85%,"June 3, 2017",condo,2,1200,10,building,Santa Ana,CA
1073981,"Yorba Linda 12000 Sqft Mansion, 16+, Disneyland",,,"Yorba Linda, CA, USA",0,,,1,1,,500,,2,16,5,4,house,Yes,2017,Within a few hours,100%,"June 4, 2017",house,,12063,,,Santa Ana,CA
760334,"Luxurious, Fully Furnished 2br Unit In Secure Resort Community In Orange County!",33.65399967,-117.7503964,"Irvine Spectrum Center, Irvine, CA, USA",0,,419,,,,,,30,5,2,2,apartment,Yes,2015,Within a few days,100%,"January 16, 2017",apartment,3,1100,5,building,Santa Ana,CA
899615,"Family Friendly Beach Bungalow, Located Upstairs On Our Property.  1 Blk To Bch",33.62025946,-117.93685238,"Balboa Peninsula, Newport Beach, CA, USA",0,,195,200,220,,90,,,4,Studio,1,bungalow,Yes,2016,Within an hour,100%,"June 2, 2017",bungalow,,700,4,house,Santa Ana,CA
97158,Location! Location! Location! Awesome 4-Bdr Beach House!,,,"Huntington Beach, CA, USA",11,4.6,700,,,,300,,30,10,4,4,house,Yes,2006,Within a few hours,100%,"June 6, 2017",house,,,,,Santa Ana,CA
1067750,Huntington Beach Family Home,33.683947,-118.010947,"Huntington Beach, CA, USA",0,,500,500,,,,,30,8,4,3,house,Yes,2017,,,"May 15, 2017",house,,3800,,,Santa Ana,CA
998158,Beautiful Mediterranean house in the Heart of Downtown Huntington Beach,,,"Huntington Beach, CA, USA",0,,600,,,,200,7.75%,5,5,2,2,house,No,2017,,,"January 14, 2017",house,,,,,Santa Ana,CA
1011810,"Luxury Ocean Front Home, Stunning Amenities And Walking Distance To Pacific City",33.65666709,-117.99136124,"Huntington Beach, CA, USA",0,,400,400,,,,,30,4,2,2,apartment,Yes,2017,,,"February 27, 2017",apartment,2,1266,4,building,Santa Ana,CA
1093605,Resort luxury living . Fully furnished one bedroom Loft at the Spectrum,33.6524212,-117.7542288,"Irvine Spectrum Center, Irvine, CA, USA",0,,140,140,,,100,,14,4,1,1,apartment,Yes,2017,,,"June 4, 2017",apartment,,,,,Santa Ana,CA
1072693,BACKYARD COZY  PRIVATE ENTRY ROOM,,,"Westminster, CA, USA",0,,79,79,,,40,9.0%,5,2,1,1,house,Yes,2015,Within an hour,100%,"June 7, 2017",house,,350,,,Santa Ana,CA
421670,"Disney Area Home, Prv. Pool, free WiFi, cable TV",33.873351,-117.949985,"Fullerton, CA, USA",8,,171,200,,,,,3,7,3,1,house,Yes,2012,Within a few days,80%,"February 14, 2017",house,,,7,,Santa Ana,CA
4344604ha,Newport Beach Luxury Ocean Front Home in the Sand  **SAVINGS ON SELECT WEEKS**,33.61764832,-117.93690388,"Balboa Peninsula, Newport Beach, CA, USA",0,,,,,,375,10.0%,3,8,3,2,house,Yes,2017,Within 12 hours,100%,"June 3, 2017",house,,2247,,,Santa Ana,CA
489298,Waterfront 4 Br/4 Ba Luxury Home-bikes-w/d-a/ C- BBQ- Privacy- Garage- Wifi,33.6209985,-117.9360652,"Newport Beach, CA, USA",0,,430,,,,300,,31,8,4,4,house,Yes,2011,Within a few days,60%,"May 11, 2017",house,,2700,8,,Santa Ana,CA
640377,Newport Beach Luxurious Balboa Peninsula Bay Front Home,33.599692,-117.887866,"Balboa Peninsula, Newport Beach, CA, USA",1,,,,,,,,31,10,4,4,house,Yes,2006,Within 2 days,90%,"June 8, 2017",house,,,10,,Santa Ana,CA
4316244ha,Newport Harbor Condo,33.6088585,-117.8867257,"Newport Center, Newport Beach, CA, USA",0,,755,599,,,1,10.5%,31,6,3,3,condo,Yes,2016,Within an hour,100%,"June 5, 2017",condo,1,,6,building,Santa Ana,CA
4361358ha,2B/2B Coastal Home Nearby Beach--Across The Street From Golf Course,,,"Huntington Beach, CA, USA",0,,175,175,,,150,,29,4,2,2,townhome,Yes,2016,Within an hour,100%,"May 31, 2017",townhome,,,4,house,Santa Ana,CA
995160,CLOSE TO BEACH AND PARKS AND THE FAMOUS SURF CITY MAIN STREET,,,"Yorktown, Huntington Beach, CA, USA",0,,200,200,,,,8.0%,3,4,2,2,house,Yes,2017,,,"February 19, 2017",house,,,4,,Santa Ana,CA
4527446ha,Modern 3 bedroom 3.5 bathroom Home in Corona del Mar,33.60296,-117.87548,"Corona Del Mar, Newport Beach, CA, USA",0,,,,,,,,7,8,3,3,farmhouse,Yes,2010,Within a day,,"June 9, 2017",farmhouse,,,8,,Santa Ana,CA
1021307,HUNTINGTON BEACH PRIVATE BEDROOM FOR 2 (+) PRIVATE BATHROOM WITHIN VIEW CONDO,33.659291,-117.997764,"Huntington Beach, CA, USA",0,,150,110,,,200,,14,2,1,1,condo,No,2017,Within 12 hours,90%,"February 20, 2017",condo,2,,,,Santa Ana,CA
253953,Charming Beach house- booking Summer 2017,33.59715652,-117.88541412,"Balboa Peninsula, Newport Beach, CA, USA",5,4.8,533,,,,,,31,8,3,2,house,Yes,2009,Within a few days,30%,"April 15, 2017",house,,,8,,Santa Ana,CA
968579ha,Sweet Newport Lower Unit Duplex! 1 House to Sand! Spacious Patio! (68126),33.619281,-117.938201,"Balboa Peninsula, Newport Beach, CA, USA",31,4.6,342,,,,,,2,4,2,2,house,Yes,2008,Within a day,,"June 9, 2017",house,,,4,,Santa Ana,CA
4499536ha,Gorgeous Home - Walk to the Beach,33.6038,-117.87592,"Corona Del Mar, Newport Beach, CA, USA",5,,500,,,,,,7,6,3,2,house,Yes,2010,Within a day,,"June 9, 2017",house,,,6,,Santa Ana,CA
865914,"Marriott Newport Coast Villa-Resort Aug 12 To Aug 19, 2017",33.583874,-117.8414109,"Newport Coast, Newport Beach, CA, USA",0,,371,,,,,,7,8,2,2,villa,Yes,2016,Within a day,100%,"June 7, 2017",villa,,1500,,,Santa Ana,CA
1090536,Newport Beach Getaway - Enjoy a Prime Location without the hassle!,,,"Newport Shores, Newport Beach, CA, USA",0,,292,286,,,400,10.0%,30,6,3,2,house,Yes,2017,,,"May 31, 2017",house,,1573,,,Santa Ana,CA
978712,BEACH HOUSE WITH CHARM,,,"Balboa Peninsula, Newport Beach, CA, USA",4,,967,695,,,350,,31,8,4,3,house,Yes,2016,Within a few hours,90%,"May 3, 2017",house,,,8,,Santa Ana,CA
8272158ha,At Dolphin Cove Disney Land Is At Your Doorstep!,,,"Anaheim Resort, Anaheim, CA, USA",0,,172,,,,,,,4,1,1,apartment,Yes,2013,Within an hour,,"June 8, 2017",apartment,,,,,Santa Ana,CA
70310,Balboa Island Best Rates for Rare 4 Bdrm/3 Bath Island Home-View also #622271,33.60630798,-117.89748383,"Balboa Island, Newport Beach, CA, USA",8,4.8,313,275,325,,,,4,10,4,3,house,Yes,2005,Within 2 days,100%,"June 8, 2017",house,,1500,10,,Santa Ana,CA
745278,"NEW LISTING. BE THE FIRST TO ENJOY ""Your Dream Vacation By The Pacific Coast""",33.641364,-117.943119,"Westside Costa Mesa, Costa Mesa, CA, USA",1,,350,,,,,,14,6,3,2,house,Yes,2015,Within a few days,30%,"August 12, 2016",house,,2100,6,,Santa Ana,CA
1089891,Two-Story Single-Family Beachside Vacation Retreat,33.629428,-117.955537,"Newport Beach, CA, USA",0,,479,,,,,,0,8,3,2,house,No,2004,Within a day,,"June 8, 2017",house,,,,,Santa Ana,CA
1003688,Very Spacious 34' Class A Motorhome Sleeps 8,,,"Newport Beach, CA, USA",0,,261,225,,,115,8.0%,4,8,1,1,recreational vehicle,No,2017,,,"May 18, 2017",recreational vehicle,,,8,,Santa Ana,CA
605596,A Little Bit Of Paradise. Great Location.,33.72881,-118.051173,"Huntington Beach, CA, USA",0,,,,,,,,180,4,2,1,condo,Yes,2015,Within a few days,30%,"September 11, 2016",condo,2,1042,4,building,Santa Ana,CA
971952,"Surf’s Up! 4BR, 4.5BA Upscale Newport Beach House w/ Pool and Roof Deck",33.597414,-117.885003,"Balboa Peninsula, Newport Beach, CA, USA",0,,,,,,,,30,10,4,5,house,Yes,2006,Within an hour,,"June 9, 2017",house,,7000,10,,Santa Ana,CA
4499531ha,Beautiful Home Blocks to the Beach,33.59991,-117.87591,"Corona Del Mar, Newport Beach, CA, USA",6,,482,,,,,,7,7,2,2,house,Yes,2010,Within a day,,"June 9, 2017",house,,,7,,Santa Ana,CA
1037742,Bottom Unit In Duplex One House From Sand!,,,"Newport Beach, CA, USA",0,,390,325,,,200,10.0%,2,6,2,2,condo,No,2017,,,"June 8, 2017",condo,,,,,Santa Ana,CA
1083199,Chic Designer Beach House,33.602958,-117.875479,"Corona Del Mar, Newport Beach, CA, USA",0,,,,,,500,,7,6,3,3,house,No,2016,,,"June 1, 2017",house,,,,,Santa Ana,CA
1081759,"Fantastic House, Fantastic Deal For The Right Family or Couple",,,"Newport Shores, Newport Beach, CA, USA",0,,350,350,,,,10.0%,31,8,3,4,house,Yes,2017,,,"May 24, 2017",house,,2000,,,Santa Ana,CA
1061066,Completely renovated cottage in beautiful Corona del Mar,,,"Corona Del Mar, Newport Beach, CA, USA",0,,,,,,,,180,5,3,2,cottage,Yes,2017,Within 12 hours,100%,"May 7, 2017",cottage,,,,,Santa Ana,CA
963415,A LARGE ROOM  LIVING SHARING .,,,"Westminster, CA, USA",0,,90,90,,,45,,4,1,Studio,1,house,Yes,2015,,,"June 7, 2017",house,,1,,,Santa Ana,CA
1037687,Top Unit in Duplex One House From The Sand!,,,"Newport Beach, CA, USA",0,,750,650,750,,250,10.0%,2,10,4,3,condo,No,2017,,,"June 8, 2017",condo,,,,,Santa Ana,CA
4499535ha,3 Bedroom Very Close to the Beach,33.60102,-117.87356,"Corona Del Mar, Newport Beach, CA, USA",12,4.5,358,,,,,,7,6,3,2,house,Yes,2010,Within a day,,"June 9, 2017",house,,,6,,Santa Ana,CA
8272166ha,Anaheim Resort Near Disney  Land!,,,"Anaheim Resort, Anaheim, CA, USA",0,,244,,,,,,,4,1,1,apartment,Yes,2013,Within an hour,,"June 8, 2017",apartment,,,,,Santa Ana,CA
1045459,Fully furnished apartment just 2 blocks from the beach,,,"Huntington Beach, CA, USA",0,,172,,,,150,8.0%,30,4,1,1,apartment,No,2017,,,"April 3, 2017",apartment,,,,,Santa Ana,CA
648953,Marriott's Newport Coast Villas Vacation Week,33.584108,-117.843567,"Newport Coast, Newport Beach, CA, USA",0,,,,,,,,7,8,2,2,condo,Yes,2014,Within 12 hours,100%,"April 23, 2017",condo,,,8,,Santa Ana,CA
903844,3 Bedroom 2 Bath Top Unit with Bayviews,33.60489214,-117.89474349,"Balboa Island, Newport Beach, CA, USA",0,,405,,,,,10.0%,7,8,3,2,house,Yes,2009,Within a few days,55%,"May 14, 2017",house,,,8,,Santa Ana,CA
1091081,Prime Newport Rear Vacation Studio - Year Round Availability and AC!,33.617134,-117.935043,"Balboa Peninsula, Newport Beach, CA, USA",0,,184,,,,,,0,2,Studio,1,studio,No,2004,Within a day,,"June 8, 2017",studio,,,,,Santa Ana,CA
704425,Best house in Newport Beach!!! (Monthly Rentals only),33.5967393,-117.8877282,"Balboa Peninsula, Newport Beach, CA, USA",1,,,,,,,,31,6,4,5,house,No,2014,Within a few days,90%,"April 3, 2017",house,,,6,,Santa Ana,CA
718630,Breezy Beach Front Luxury Living Newport beach,33.621936,-117.942274,"Newport Beach, CA, USA",0,,,,,,400,10.0%,7,10,4,3,house,Yes,2006,Within a day,90%,"June 8, 2017",house,,,10,,Santa Ana,CA
420163,Charming Little Balboa Island Cottage,33.60656,-117.888285,"Newport Center, Newport Beach, CA, USA",2,,,,,,,,1,4,2,2,cottage,Yes,2012,Within a few days,10%,"May 21, 2017",cottage,,,4,,Santa Ana,CA
1779233ha,"Contemporary house for rent, near the beaches of Huntington Beach, California",33.681612,-118.008371,"Huntington Beach, CA, USA",0,,212,,,,,,31,4,3,2,house,Yes,2015,,,"April 28, 2017",house,,2000,4,,Santa Ana,CA
4538101ha,Brand New Luxurious 4 bedroom 3.5 bathroom Home,33.60469,-117.87633,"Newport Center, Newport Beach, CA, USA",0,,,,,,,,7,10,4,3,house,Yes,2010,Within a day,,"June 9, 2017",house,,,10,,Santa Ana,CA
3497584ha,Spectacular oceanfront upper unit with amazing views from awesome roof top deck!,33.622853,-117.943913,"Newport Beach, CA, USA",1,,600,,,,,,1,8,3,2,condo,Yes,2006,Within an hour,,"June 8, 2017",condo,2,1224,8,,Santa Ana,CA
1069204,Newport Beach's Finest (2 blocks from sand)!,33.6290724,-117.9528322,"Newport Shores, Newport Beach, CA, USA",0,,475,350,,,150,,3,8,3,2,house,No,2017,,,"May 11, 2017",house,,,,,Santa Ana,CA
4108442ha,Awesome 1.5 Mile Beach Home--Across The Street From Golf Course,33.717135,-118.033178,"Huntington Beach, CA, USA",1,,145,145,,,125,,29,2,1,1,townhome,Yes,2016,Within an hour,100%,"May 31, 2017",townhome,2,1200,2,building,Santa Ana,CA
8272165ha,Spacious 2 Bedroom At Anehim Near Disney!,,,"Anaheim Resort, Anaheim, CA, USA",0,,293,,,,,,,6,2,2,apartment,Yes,2013,Within an hour,,"June 8, 2017",apartment,,,,,Santa Ana,CA
3497516ha,Lovely newly-remodeled upper unit with amazing balcony for grilling & chilling,33.616024,-117.934763,"Balboa Peninsula, Newport Beach, CA, USA",3,,443,,,,,,1,10,4,2,condo,Yes,2006,Within an hour,,"June 8, 2017",condo,2,1474,10,,Santa Ana,CA
982152,Fully Remodeled Beach House,,,"Balboa Peninsula, Newport Beach, CA, USA",0,,500,500,,,200,10.0%,7,8,3,2,house,No,2016,,,"December 24, 2016",house,,,,,Santa Ana,CA
4554818ha,"Village Luxury, a Fabulous 4 Bedroom, 4 Bathroom Home in Cor del Mar",33.60177,-117.8754,"Corona Del Mar, Newport Beach, CA, USA",0,,950,,,,,,31,8,4,4,house,Yes,2010,Within a day,,"June 9, 2017",house,,,8,,Santa Ana,CA
458489,Luxurious Villa Red Diamond-Best Value -- available from January 2017,33.719184,-118.068747,"Gilbert Island, Huntington Beach, CA, USA",6,,,,,,250,,180,8,3,2,house,Yes,2006,Within a few hours,100%,"June 7, 2017",house,,1800,8,,Santa Ana,CA
1014764,Newport Beach Oceanfront Duplex - Will rent just half,,,"Balboa Peninsula, Newport Beach, CA, USA",0,,,750,800,,700,10.0%,3,16,6,4,house,Yes,2011,Within 12 hours,100%,"June 8, 2017",house,,,16,,Santa Ana,CA
996962,Brand New 2 Bedroom Luxury Beach Apartment!,33.6563456,-117.9971119,"Huntington Beach, CA, USA",0,,325,325,,,,,31,5,2,2,apartment,Yes,2017,Within a few days,20%,"February 27, 2017",apartment,1,1291,5,building,Santa Ana,CA
1033126,Summer Special Pricing Lower Unit - Walk to Beach/Pier/Fun Zone/Restaurants!,33.61043,-117.929543,"Balboa Peninsula, Newport Beach, CA, USA",1,,427,350,,,175,10.0%,4,4,2,1,house,Yes,2011,Within a few days,50%,"June 3, 2017",house,,,,,Santa Ana,CA
3005608ha,"Oceanside Upper Unit - Balcony - Near Balboa Pier, Ferry, & Fun Zone! (68336)",33.601212,-117.898064,"Balboa Peninsula, Newport Beach, CA, USA",8,,,,,,,,2,8,3,2,house,Yes,2008,Within a day,,"June 9, 2017",house,,,8,,Santa Ana,CA
3624967ha,Newport Beach Tuscan Style Family Home! 1 House from Beach w/ Views! (68244),33.610414,-117.93011,"Balboa Peninsula, Newport Beach, CA, USA",24,4.5,837,,,,,,3,8,3,4,house,Yes,2008,Within a day,,"June 9, 2017",house,,2100,8,,Santa Ana,CA
1081743,Affordable 3 Bedroom Beach House Close to Ocean and Bay!,33.6045867,-117.9039058,"Balboa Peninsula, Newport Beach, CA, USA",0,,323,,,,,,0,8,3,2,house,No,2004,Within a day,,"June 8, 2017",house,,,,,Santa Ana,CA
4499541ha,Fabulous Contemporary Home next to the Beach,33.59596,-117.87217,"Corona Del Mar, Newport Beach, CA, USA",0,,551,,,,,,7,8,3,3,house,Yes,2010,Within a day,,"June 9, 2017",house,,2000,8,,Santa Ana,CA
4499540ha,New Ocean View Contemporary Home,33.60269,-117.8719,"Corona Del Mar, Newport Beach, CA, USA",1,,,,,,,,7,8,4,4,house,Yes,2010,Within a day,,"June 9, 2017",house,,2500,8,,Santa Ana,CA
4499538ha,Stunning Single Family Home in the Village,33.59754,-117.867,"Corona Del Mar, Newport Beach, CA, USA",3,,554,,,,,,7,6,3,2,house,Yes,2010,Within a day,,"June 9, 2017",house,,,6,,Santa Ana,CA
1011789,"Luxury Ocean Front Home, Stunning Amenities And Walking Distance To Pacific City",33.65638132,-117.99713336,"Huntington Beach, CA, USA",0,,400,400,,,,,30,5,2,2,apartment,Yes,2017,,,"February 27, 2017",apartment,1,1266,5,building,Santa Ana,CA
4558048ha,Oceanfront Bliss! 3 Bedroom/ 2 Bathroom Newport Beachfront Upper Unit,33.618709,-117.937926,"Balboa Peninsula, Newport Beach, CA, USA",0,,467,,,,,,3,8,3,2,house,Yes,2005,Within an hour,,"June 9, 2017",house,,1100,8,,Santa Ana,CA
597059,Designer Home on Quiet End of the Island,33.6073584,-117.8970207,"Balboa Island, Newport Beach, CA, USA",0,,550,,,,300,10.0%,7,6,3,3,house,Yes,2014,Within 2 days,100%,"May 17, 2017",house,,,6,,Santa Ana,CA
968632ha,"Ocean Front Upper Unit, Amazing View of Balboa Pier, Private Balcony (68300)",33.600461,-117.896446,"Balboa Peninsula, Newport Beach, CA, USA",30,4.7,807,,,,,,7,6,3,2,house,Yes,2008,Within a day,,"June 9, 2017",house,,,6,,Santa Ana,CA
4499530ha,Charming Harbor View,33.59991,-117.87591,"Corona Del Mar, Newport Beach, CA, USA",0,,482,,,,,,7,8,2,2,house,Yes,2010,Within a day,,"June 9, 2017",house,,,8,,Santa Ana,CA
4517846ha,Historical Newport Beach home in the heart of Balboa Village,,,"Balboa Peninsula, Newport Beach, CA, USA",0,,525,525,,,250,10.0%,31,6,2,2,house,No,2016,,,"April 18, 2017",house,,,,,Santa Ana,CA
865895,"Marriott's Newport Coast Villas, California",33.5837239,-117.8438259,"Newport Coast, Newport Beach, CA, USA",0,,500,,,,,,7,8,2,2,villa,No,2016,Within a few hours,100%,"May 18, 2017",villa,,,8,,Santa Ana,CA
4509705ha,Adorable Beach Cottage with Beautiful Ocean Views!,33.602813,-117.903534,"Balboa Peninsula, Newport Beach, CA, USA",0,,314,,,,,,3,4,2,1,house,Yes,2008,Within a day,,"June 9, 2017",house,,,4,,Santa Ana,CA
4476830ha,"Large Oceanfront Home - Beach Front Patio with Hot Tub, Panoramic Views!",33.620947,-117.940592,"Balboa Peninsula, Newport Beach, CA, USA",0,,,,,,,,7,10,4,5,house,Yes,2008,Within a day,,"June 9, 2017",house,,,10,,Santa Ana,CA
968595ha,Beautiful Renovated Beach House! Just 9 Houses from Sand! (68278),33.613133,-117.931468,"Balboa Peninsula, Newport Beach, CA, USA",14,4.6,422,,,,,,2,7,3,2,house,Yes,2008,Within a day,,"June 9, 2017",house,,,7,,Santa Ana,CA
4331677ha,Corona del Mar - Harbor Front Condo,33.6097929,-117.8882695,"Newport Center, Newport Beach, CA, USA",0,,450,450,,,300,10.5%,31,4,2,2,condo,Yes,2016,,,"June 5, 2017",condo,2,,4,building,Santa Ana,CA
282225,"Newport Beach Vacation Home on the Sand. You rent the entire home, one of a kind",33.6233902,-117.94490051,"Newport Beach, CA, USA",0,,989,,,,,,30,9,3,3,house,Yes,2010,Within a few days,60%,"May 10, 2017",house,,1500,9,,Santa Ana,CA
792858,,,,,0,,,,,,,,,,,,,No,,,,,,,,,,Santa Ana,CA
4586028ha,Roof Deck Rendezvous has the BEST OCEAN VIEW Modern Luxury 2 BDR 2.5 BA CDM,33.600932,-117.878421,"Corona Del Mar, Newport Beach, CA, USA",0,,814,,,,,,3,4,2,2,condo,Yes,2015,Within an hour,,"June 8, 2017",condo,,2300,4,,Santa Ana,CA
4499523ha,4 bedroom Single Family home near the sand,33.59559,-117.87453,"Corona Del Mar, Newport Beach, CA, USA",9,4.9,670,,,,,,31,8,4,2,house,Yes,2010,Within a day,,"June 9, 2017",house,,4000,8,,Santa Ana,CA
4558047ha,Oceanfront Bliss! 4 Bedroom/ 2 Bathroom Newport Beachfront Lower unit,33.618709,-117.937926,"Balboa Peninsula, Newport Beach, CA, USA",0,,667,,,,,,3,10,4,2,house,Yes,2005,Within an hour,,"June 9, 2017",house,,1200,10,,Santa Ana,CA
