listing_id,listing_title,latitude,longitude,location_name,number_reviews,average_rating,average_nightly_price,nightly,weekend_night,property_protection_fee,cleaning_fee,tax_rate,min_stay,sleeps,bedrooms,bathrooms,property_type,internet,member_since,response_time,response_rate,calendar_last_updated,type,floor,sq_footage,max_occupancy,building_type,city
573177,"-Beautiful Ocean Front Condo, Ocean View From Every Room, Pool+Roof Top Sundeck-",36.832403,-75.970355,"Northeast Virginia Beach, Virginia Beach, VA, USA",38,4.9,197,,,,,14.0%,3,6,2,2,condo,Yes,2014,Within 2 days,100%,"June 6, 2017",condo,8,,6,,Virginia Beach
406824,"Beautiful Luxury Condo, Best Location at Va Beach Oceanfront",36.8557663,-75.97957611,"Northeast Virginia Beach, Virginia Beach, VA, USA",30,4.7,151,,,,,14.0%,7,6,2,2,condo,Yes,2012,Within a day,100%,"June 6, 2017",condo,2,,,building,Virginia Beach
424783,"Luxury Condo, Prime location 1.5 Blocks From Ocean, Handicap Access",36.85630897,-75.97911792,"Northeast Virginia Beach, Virginia Beach, VA, USA",32,4.7,139,,,,,14.0%,7,6,2,2,condo,Yes,2012,Within a day,100%,"June 5, 2017",condo,3,,,building,Virginia Beach
729906,"Ocean View Luxury Penthouse Style Condo, Top Floor",36.85601794,-75.97903586,"Northeast Virginia Beach, Virginia Beach, VA, USA",13,4.8,173,,,,,14.0%,7,6,1,2,condo,Yes,2012,Within a few hours,100%,"June 6, 2017",condo,3,1000,,building,Virginia Beach
568748,"Cozy, Dog-friendly Duplex At The North End Short Walk To The Beach!",36.909439,-75.993602,"Northeast Virginia Beach, Virginia Beach, VA, USA",71,4.9,143,,,,100,8.0%,3,4,2,1,condo,Yes,2014,Within an hour,100%,"June 6, 2017",condo,1,950,4,,Virginia Beach
619834,This Condo Is Located 5 Minutes From The Virgina Beach Board Walk And Beach,36.8327545,-75.9740791,"Northeast Virginia Beach, Virginia Beach, VA, USA",21,4.9,102,,,,,14.0%,7,6,2,1,condo,Yes,2014,Within 2 days,90%,"June 3, 2017",condo,1,,6,building,Virginia Beach
780420,Luxury Two Bedroom Cottage,36.8495519,-75.9793288,"Northeast Virginia Beach, Virginia Beach, VA, USA",8,4.9,263,250,,,150,8.3%,2,4,2,2,cottage,Yes,2015,Within a few hours,100%,"June 6, 2017",cottage,,1300,4,,Virginia Beach
4216224ha,Dog Friendly North End Beach Cottage - Private Walkway To The Beach!,36.910607,-75.99265,"Northeast Virginia Beach, Virginia Beach, VA, USA",21,,295,275,,,,14.0%,3,10,4,3,cottage,Yes,2016,Within a few hours,100%,"June 7, 2017",cottage,,1750,10,,Virginia Beach
98786,"Resort/Beach/Boardwalk/Convention Center Area, 3 short blocks to Beach, Con. Cen",36.84353256,-75.97938538,"Northeast Virginia Beach, Virginia Beach, VA, USA",26,4.7,211,95,,,100,10.0%,1,5,2,2,house,Yes,2006,Within an hour,100%,"June 1, 2017",house,,1800,5,,Virginia Beach
165005ha,"4 Bedroom, Cape Cod with Pool, 100 yds to beach/ A 100 metres de la plage",36.725164,-75.9379697,"Sandbridge Beach, Virginia Beach, VA, USA",59,4.8,242,195,,,,15.5%,3,8,4,2,house,Yes,2007,Within a day,100%,"June 6, 2017",house,,1500,8,,Virginia Beach
903196,"Home at the VB Oceanfront! Walk to the Beach, Convention Center, Dining, Markets",36.852483,-75.983621,"Northeast Virginia Beach, Virginia Beach, VA, USA",20,4.8,300,300,,,,14.0%,2,10,3,3,house,Yes,2016,Within an hour,100%,"June 6, 2017",house,,2600,10,,Virginia Beach
4089378ha,Lovely Original Sandbridge Beach Cottage-Sleeps 14,36.752474,-75.948693,"Sandbridge Beach, Virginia Beach, VA, USA",27,4.9,365,225,,,,15.5%,3,14,6,4,house,Yes,2007,Within a day,100%,"June 6, 2017",house,,2500,14,,Virginia Beach
570381,Resort Style Condo on the Beach!,36.697275,-75.925477,"Sandbridge Beach, Virginia Beach, VA, USA",12,4.9,114,125,,,,,4,7,2,2,condo,Yes,2014,Within a few hours,100%,"June 6, 2017",condo,4,1500,7,building,Virginia Beach
985848ha,Remodeled Surfside Ave Virginia Beach 1 Block from Beach,36.8202039,-75.969874,"Dam Neck, Virginia Beach, VA, USA",33,4.5,239,,,,,10.0%,2,16,5,3,house,Yes,2012,Within a few hours,100%,"June 6, 2017",house,,3000,,,Virginia Beach
3528871ha,"Oceanfront Complex, Modern Studio on VA Beach's Famous Boardwalk",36.868258,-75.980175,"Northeast Virginia Beach, Virginia Beach, VA, USA",32,4.8,128,,,,,14.0%,3,4,Studio,1,studio,Yes,2013,Within 12 hours,100%,"June 6, 2017",studio,2,400,4,,Virginia Beach
948790,"Walk to beach! Rooftop deck for entertaining, elevator, completely remodeled!!",36.903959,-75.993376,"Northeast Virginia Beach, Virginia Beach, VA, USA",18,4.8,224,,,,100,9.0%,2,8,3,3,condo,Yes,2016,Within a day,90%,"June 6, 2017",condo,3,1625,8,house,Virginia Beach
999782ha,"Best Deal- Beautiful 100 Year old Beach House, 2 Blocks from Oceanfront!  18yrs+",36.8498291,-75.9788704,"Northeast Virginia Beach, Virginia Beach, VA, USA",30,4.5,202,115,125,,,13.5%,1,6,3,1,house,Yes,2012,Within a few hours,100%,"June 7, 2017",house,,1500,6,,Virginia Beach
863447,Beautiful Bay Front Property/ 2BR/2BA,36.914268,-76.065785,"Northeast Virginia Beach, Virginia Beach, VA, USA",8,,304,,,,100,8.0%,7,6,2,2,townhome,Yes,2016,Within 12 hours,100%,"June 3, 2017",townhome,1,1800,6,house,Virginia Beach
761863,Charming Chic's Nest,36.9163407,-76.1268987,"Chic's Beach, Virginia Beach, VA, USA",15,4.9,207,125,125,,,14.0%,3,6,2,1,townhome,Yes,2015,Within 2 days,100%,"June 1, 2017",townhome,,1200,6,,Virginia Beach
138778ha,Kaelee's Kastle: NON-SMOKING. 12th Great Season!  Reserve  early. Many thanks!!!,,,"Sandbridge Beach, Virginia Beach, VA, USA",25,4.8,234,,,,,15.0%,3,8,3,2,condo,Yes,2006,Within an hour,100%,"June 6, 2017",condo,1,1600,8,building,Virginia Beach
7097804ha,Great Location !  1 Short Block To The Boardwalk,36.8375765,-75.9734091,"Northeast Virginia Beach, Virginia Beach, VA, USA",40,4.8,129,85,,,60,14.0%,3,5,2,1,condo,Yes,2012,Within 12 hours,100%,"May 26, 2017",condo,1,,5,,Virginia Beach
871736,Beautiful Original Old Beach Charm! 5 min walk to the beach! Available 7/2 -7/8,36.8538791,-75.98157,"Northeast Virginia Beach, Virginia Beach, VA, USA",10,,357,,,,175,14.0%,6,8,3,2,house,Yes,2016,Within an hour,100%,"June 7, 2017",house,,2300,8,,Virginia Beach
391482,Architectural Ocean Front Gem on Widest most Private Beach in Virginia Beach,36.90873337,-75.99240875,"Northeast Virginia Beach, Virginia Beach, VA, USA",40,,429,,,,,14.0%,4,16,5,2,house,Yes,2011,Within a few hours,100%,"June 5, 2017",house,,3200,16,,Virginia Beach
3469983ha,"Start of Summer Sale! Charming Condo 1 block to Beach JUNE SALE!  2Q cable, WiFi",36.83770808,-75.9729343,"Northeast Virginia Beach, Virginia Beach, VA, USA",13,4.4,127,185,200,,81,12.0%,4,5,2,1,condo,Yes,2006,Within 12 hours,100%,"June 2, 2017",condo,1,,5,building,Virginia Beach
595335,Cozy private family beach house,36.8941977,-75.9911935,"Northeast Virginia Beach, Virginia Beach, VA, USA",18,4.4,201,152,,,,8.0%,2,6,3,1,cottage,Yes,2014,Within a day,100%,"June 6, 2017",cottage,,,6,,Virginia Beach
873241,Mid century modern 1 bedroom apartment,36.893982,-75.988299,"Northeast Virginia Beach, Virginia Beach, VA, USA",8,4.9,200,200,,,80,8.0%,2,4,Studio,1,apartment,Yes,2014,Within 12 hours,90%,"June 6, 2017",apartment,1,,,house,Virginia Beach
4230593ha,The Retreat at Sandbridge Beach – Charming RV Cottage On The Bay,36.69869739,-75.93244059,"Sandbridge Beach, Virginia Beach, VA, USA",6,4.7,149,115,,,75,16.6%,3,4,1,1,recreational vehicle,Yes,2016,Within 12 hours,100%,"June 3, 2017",recreational vehicle,,400,4,,Virginia Beach
403818,Va. Beach Paradise 2 Br 2 Ba Condo 1 Block to Beach and on Golden Pond,36.83776093,-75.9748764,"Northeast Virginia Beach, Virginia Beach, VA, USA",39,4.7,96,125,,,,,2,4,2,2,condo,Yes,2012,Within a day,100%,"June 6, 2017",condo,1,1000,4,building,Virginia Beach
588170,New Construction Just Completely Renovated Handicap Friendly,36.893982,-75.988299,"Northeast Virginia Beach, Virginia Beach, VA, USA",21,,450,450,,,190,8.0%,2,9,4,3,house,Yes,2014,Within a few days,80%,"June 6, 2017",house,,3000,9,,Virginia Beach
870516,fireplace; two bedroom;two bath  walk to amenities - Very spacious,36.8378798,-75.9754386,"Northeast Virginia Beach, Virginia Beach, VA, USA",7,,236,285,,,100,8.0%,5,6,2,2,condo,Yes,2016,Within 2 days,90%,"May 25, 2017",condo,1,1150,6,building,Virginia Beach
462437,Bike to the Beach...Avoid Expensive and Hectic Parking! Also see listing 701927!,36.836827,-75.995795,"Northeast Virginia Beach, Virginia Beach, VA, USA",32,4.7,193,179,229,,,8.0%,2,9,4,2,house,Yes,2013,Within an hour,100%,"June 6, 2017",house,,1400,9,,Virginia Beach
3649599ha,Resort Living at the Beach!,36.826002,-75.970209,"Dam Neck, Virginia Beach, VA, USA",16,4.8,319,,,,,,7,9,3,2,house,Yes,2013,Within a few hours,100%,"June 1, 2017",house,,,9,,Virginia Beach
246304,Pristine Home Just One Half Block from Beach. Sleeps 8.,,,"Northeast Virginia Beach, Virginia Beach, VA, USA",23,4.9,450,325,,,,14.0%,2,8,4,3,house,Yes,2009,Within a few hours,100%,"June 2, 2017",house,,2400,8,,Virginia Beach
740705,Cottage on Back Bay Wild Life Refuge at Sandbridge Beach,36.6976135,-75.9277199,"Sandbridge Beach, Virginia Beach, VA, USA",10,,121,125,150,,50,11.0%,2,5,2,1,recreational vehicle,Yes,2014,Within 12 hours,100%,"June 6, 2017",recreational vehicle,,400,,,Virginia Beach
4198434ha,"New, Upscale, Family-Friendly House only 2 Blocks to the Beach and Boardwalk.",36.853783,-75.97937,"Northeast Virginia Beach, Virginia Beach, VA, USA",24,,400,,,,150,14.0%,1,10,3,3,house,Yes,2015,Within an hour,100%,"June 7, 2017",house,,1600,10,,Virginia Beach
953067,Waterfront House with Docking -Boaters Paradise- Walk or Ride Your Bike to Beach,36.903367,-76.063548,"Cape Story by the Sea, Virginia Beach, VA, USA",13,4.8,302,275,,,120,14.0%,2,10,4,3,house,Yes,2012,Within a few hours,100%,"June 7, 2017",house,,2100,,,Virginia Beach
420470,Luxurious Beachfront Retreat - Many upgrades and million dollar views,36.917246,-76.125206,"Chic's Beach, Virginia Beach, VA, USA",20,4.7,300,350,,,150,14.0%,3,8,3,2,townhome,Yes,2012,Within an hour,100%,"June 5, 2017",townhome,,1500,8,,Virginia Beach
187889ha,"KELLYE'S VILLA: CONDO, BEACH FRONT, Ocean View, NO Smoking, Children Welcome",36.697275,-75.925477,"Sandbridge Beach, Virginia Beach, VA, USA",22,4.8,243,165,,,,15.5%,4,6,2,2,condo,Yes,2008,Within 12 hours,100%,"June 5, 2017",condo,1,1485,,building,Virginia Beach
598512,Cottage on Back Bay Wild Life Refuge at Sandbridge Beach,36.70276669,-75.93116937,"Sandbridge Beach, Virginia Beach, VA, USA",21,4.9,120,120,135,,50,11.0%,2,6,1,1,recreational vehicle,Yes,2014,Within an hour,100%,"June 6, 2017",recreational vehicle,,400,,,Virginia Beach
721511,Newly remodeled!   A block and a half walk to the ocean.,36.8376231,-75.9745407,"Northeast Virginia Beach, Virginia Beach, VA, USA",27,4.9,162,140,,,,11.0%,2,6,2,2,condo,Yes,2015,Within an hour,100%,"June 5, 2017",condo,2,1050,6,building,Virginia Beach
890182,"Condo, Prime Location 1.5 Blocks From Beach",36.85596926,-75.97933262,"Northeast Virginia Beach, Virginia Beach, VA, USA",0,,153,,,,,14.0%,7,6,2,2,condo,Yes,2016,Within a few hours,100%,"June 7, 2017",condo,,,6,,Virginia Beach
40007,Placebo: Ocean views Pool Hot Tub Walking Distance to Market,36.74424744,-75.94374084,"Sandbridge Beach, Virginia Beach, VA, USA",35,3.8,350,,,,145,9.5%,7,11,5,2,house,Yes,2002,Within 2 days,80%,"June 4, 2017",house,,,11,,Virginia Beach
566739,"The Beachcomber - Cozy, Courtyard Setting ax Street from Beach - GREAT location!",36.8825918,-75.986054,"Northeast Virginia Beach, Virginia Beach, VA, USA",31,4.8,180,,,,50,14.0%,7,7,2,2,condo,Yes,2014,Within an hour,100%,"May 27, 2017",condo,1,900,7,,Virginia Beach
242928,Sandbridge Beach...'Great Escape'....Clean and Comfortable!,36.73232269,-75.94130707,"Sandbridge Beach, Virginia Beach, VA, USA",24,4.8,440,,,,,9.5%,3,18,6,4,house,Yes,2009,Within a few days,50%,"June 6, 2017",house,,,18,,Virginia Beach
503304,Wonderful Ocean Front Duplex.,36.903343,-75.990604,"Northeast Virginia Beach, Virginia Beach, VA, USA",13,4.5,400,400,,,200,14.0%,2,10,4,3,house,Yes,2009,Within 12 hours,100%,"May 27, 2017",house,,,10,,Virginia Beach
3011065ha,Best Price and Best Deal in Virginia Beach & 2 blocks from beach! 18yrs+,36.8499902,-75.979832,"Northeast Virginia Beach, Virginia Beach, VA, USA",25,4.4,152,99,109,,,13.5%,1,6,2,1,bungalow,Yes,2012,Within 12 hours,100%,"June 7, 2017",bungalow,,750,,,Virginia Beach
644640,Want to get away in June? Call for special rates for weeks 6/3 and 6/17 2017,36.721621,-75.937896,"Sandbridge Beach, Virginia Beach, VA, USA",25,,536,857,,,,15.5%,3,18,7,3,house,Yes,2014,Within a few days,90%,"June 6, 2017",house,,3500,18,,Virginia Beach
878494,Beach Condo Steps Away From The Beach,36.9094857,-76.0845491,"Northeast Virginia Beach, Virginia Beach, VA, USA",6,4.5,201,150,,,99,10.0%,2,8,2,1,condo,Yes,2011,Within a few hours,100%,"June 4, 2017",condo,,1600,8,,Virginia Beach
253895,"'He Crab She Crab' Coastal Home with Beach,  Bay &Backyard Fun.Perfect for Kids!",36.72137451,-75.93771362,"Sandbridge Beach, Virginia Beach, VA, USA",69,4.8,387,250,,,,15.5%,3,12,5,3,house,Yes,2009,Within an hour,100%,"June 7, 2017",house,,3200,,,Virginia Beach
3664078ha,Sleeps 12 in six bedrooms,36.903477,-75.990641,"Northeast Virginia Beach, Virginia Beach, VA, USA",5,3.8,600,600,,,200,14.0%,2,12,6,4,house,Yes,2009,Within a day,100%,"June 4, 2017",house,,,12,,Virginia Beach
4225474ha,"Beautiful 3 story condo short walk from the Beach, famous Boardwalk and ....",36.8452678,-75.9794746,"Northeast Virginia Beach, Virginia Beach, VA, USA",3,,52,,,,100,,3,6,2,2,condo,Yes,2016,Within an hour,100%,"June 7, 2017",condo,,1205,6,building,Virginia Beach
4089265ha,Beautiful Waterfront Home with Boat Slip on Rudee Inlet,36.8325434,-75.9790912,"Northeast Virginia Beach, Virginia Beach, VA, USA",3,,136,100,,,195,14.0%,27,8,3,2,townhome,Yes,2014,Within 12 hours,90%,"June 6, 2017",townhome,,1600,,,Virginia Beach
3597058ha,"""The Modena"" - Virginia Beach's Most Luxurious Vacation Rental!",36.8551379,-75.979321,"Northeast Virginia Beach, Virginia Beach, VA, USA",8,,296,159,179,,100,14.0%,3,8,2,1,apartment,Yes,2013,Within an hour,100%,"June 4, 2017",apartment,,,8,,Virginia Beach
895328,Ocean Front North End More Amenities Recently Added,36.910607,-75.99265,"Northeast Virginia Beach, Virginia Beach, VA, USA",5,4.8,747,550,,,250,14.0%,4,20,7,5,house,Yes,2016,Within a few hours,100%,"May 26, 2017",house,,3400,20,,Virginia Beach
4092152ha,"Ocean View 4 Bedroom, Open Sunny Updated Home With 3:00 Saturday checkin",36.7116832,-75.9315458,"Sandbridge Beach, Virginia Beach, VA, USA",5,4.8,355,,,,,,7,10,4,2,house,Yes,2015,Within 12 hours,100%,"June 2, 2017",house,,1850,10,,Virginia Beach
3932554ha,"Best Deal- 1947 Built Beach House, 1.5 Blocks from the Oceanfront - 18 yrs books",36.84787414,-75.97805577,"Northeast Virginia Beach, Virginia Beach, VA, USA",13,4.8,158,99,,,,13.5%,1,6,2,1,house,Yes,2012,Within a day,90%,"June 7, 2017",house,,1000,6,,Virginia Beach
3723213ha,Luxurious 5-star 3br 3.5 Bath Elite Location,36.85685793,-75.97955135,"Northeast Virginia Beach, Virginia Beach, VA, USA",11,4.6,376,,,,,15.0%,2,10,3,3,house,Yes,2014,Within a day,100%,"June 2, 2017",house,,2470,10,,Virginia Beach
701927,Bike to the Oceanfront ll,36.836717,-75.995143,"Northeast Virginia Beach, Virginia Beach, VA, USA",21,4.7,159,150,170,,,8.0%,1,6,3,1,cottage,No,2013,Within an hour,100%,"June 6, 2017",cottage,,1000,6,,Virginia Beach
837229,NEW! The Dunes at First Landing,36.915476,-76.058193,"Northeast Virginia Beach, Virginia Beach, VA, USA",10,,300,,,,125,8.0%,7,8,3,3,condo,Yes,2016,Within a few hours,100%,"June 5, 2017",condo,1,2000,8,house,Virginia Beach
3723066ha,Croatan Beach With Pool,36.8218249,-75.970247,"Dam Neck, Virginia Beach, VA, USA",15,4.9,,600,,,,14.0%,3,14,4,3,house,Yes,2013,Within an hour,100%,"June 6, 2017",house,,3715,14,,Virginia Beach
4113474ha,A Little Piece Of Heaven In Virginia Beach,36.8681096,-75.97959964,"Northeast Virginia Beach, Virginia Beach, VA, USA",4,4.8,171,,,,,,7,4,Studio,1,studio,Yes,2016,Within a few hours,100%,"June 7, 2017",studio,1,400,,building,Virginia Beach
836656,Va. Beach Resort Area - Beautiful Home W/large Deck & Hot Tub,36.8565449,-76.019602,"Northeast Virginia Beach, Virginia Beach, VA, USA",9,4.7,95,95,,,,14.0%,2,6,1,1,house,Yes,2016,Within an hour,100%,"June 6, 2017",house,,800,,,Virginia Beach
741786,Shep's Quarters in Virginia Beach,36.8229645,-75.9701225,"Dam Neck, Virginia Beach, VA, USA",7,4.7,583,750,,,,6.0%,4,12,5,3,house,Yes,2016,Within a day,100%,"June 5, 2017",house,,3024,12,,Virginia Beach
208250,"Luxury Beach Condo, The BEST location at the Oceanfront!",36.85565567,-75.97925568,"Northeast Virginia Beach, Virginia Beach, VA, USA",69,4.9,175,,,,,14.0%,7,5,2,2,condo,Yes,2008,Within a few hours,100%,"June 5, 2017",condo,2,,5,,Virginia Beach
349449,"PRIME N/END Location,Golf cart to Beach, ALL 5 STAR REVIEWS, On PACC 16th hole!",36.87223053,-75.9872818,"Northeast Virginia Beach, Virginia Beach, VA, USA",17,4.9,550,550,,,,13.0%,4,8,4,3,house,Yes,2011,Within 12 hours,100%,"May 23, 2017",house,,3200,8,,Virginia Beach
462064,Beautiful Home-Ideal Location,36.8215549,-75.970181,"Dam Neck, Virginia Beach, VA, USA",2,,462,550,,,,14.0%,6,12,4,3,house,Yes,2013,Within a few hours,100%,"May 2, 2017",house,,,12,,Virginia Beach
4223362ha,AAA 5***** OceanFront Resort One Bedroom Villa,36.8630763,-75.9787632,"Northeast Virginia Beach, Virginia Beach, VA, USA",2,,,159,199,,,14.0%,1,4,1,1,condo,Yes,2016,Within an hour,100%,"June 6, 2017",condo,,400,,villa,Virginia Beach
723554,"Chillaxin' At The Sanctuary On Sandbridge Beach (Virginia Beach, VA)",36.69673839,-75.92547699,"Sandbridge Beach, Virginia Beach, VA, USA",3,4.7,260,200,,,,15.5%,3,10,3,2,condo,Yes,2015,Within an hour,100%,"June 5, 2017",condo,2,,10,building,Virginia Beach
4247297ha,"Adorable Cottage In The Heart Of The Old Beach Area, Close To The Boardwalk.",36.851646,-75.981525,"Northeast Virginia Beach, Virginia Beach, VA, USA",17,4.9,200,250,,,,,2,5,2,1,cottage,Yes,2016,Within a few hours,100%,"June 7, 2017",cottage,,800,5,,Virginia Beach
7102220ha,Penthouse in Sandbridge Beach,36.74652046,-75.9449575,"Sandbridge Beach, Virginia Beach, VA, USA",35,4.9,295,,,,100,10.0%,2,10,3,3,condo,Yes,2012,Within a day,100%,"June 5, 2017",condo,4,,10,building,Virginia Beach
434435,Change your Latitude!!,36.855767,-75.979577,"Northeast Virginia Beach, Virginia Beach, VA, USA",13,4.6,186,200,,,,,2,6,2,2,condo,Yes,2012,Within a few days,70%,"June 6, 2017",condo,,,6,,Virginia Beach
393314,"Sandbridge ""Sea~Esta"" - Family Friendly Beach House with Salt Water POOL (N.End)",36.75210571,-75.94826508,"Sandbridge Beach, Virginia Beach, VA, USA",29,4.8,637,,,,150,9.5%,3,10,4,3,house,Yes,2011,Within an hour,100%,"June 5, 2017",house,,2592,10,,Virginia Beach
686321,Beautiful Oceanfront Condo  - 2 short Blocks to Beach,36.85594351,-75.9797725,"Northeast Virginia Beach, Virginia Beach, VA, USA",14,4.9,229,,,,,14.0%,2,7,2,2,condo,Yes,2015,Within a few hours,100%,"June 4, 2017",condo,1,950,7,building,Virginia Beach
3603474ha,"North End, Virginia Beach: Charming Flamingo Cottage!",36.91241,-75.995273,"Northeast Virginia Beach, Virginia Beach, VA, USA",50,,210,,,,,8.0%,2,6,3,1,cottage,Yes,2013,Within a few hours,100%,"June 3, 2017",cottage,,,,,Virginia Beach
714018,"Bring the Kayak, the dog and the Kids, only 1 block from the Chesapeake Bay",36.9162161,-76.1269066,"Chic's Beach, Virginia Beach, VA, USA",12,4.8,200,125,,,,14.0%,4,6,2,1,townhome,Yes,2015,Within 12 hours,90%,"June 6, 2017",townhome,,1200,,house,Virginia Beach
281200,Sandbridge Beach...'Makin Memories'...Great for Large Groups,36.72198105,-75.94007111,"Sandbridge Beach, Virginia Beach, VA, USA",29,4.6,887,,,,,9.5%,3,32,8,5,house,Yes,2009,Within a few days,80%,"June 6, 2017",house,,,32,,Virginia Beach
588704,"Croatan Beach, Family Friendly Rustic beach house. 1 BLOCK TO BEACH",36.825222,-75.97032,"Dam Neck, Virginia Beach, VA, USA",23,4.3,420,420,,,,8.0%,3,12,5,3,house,Yes,2014,Within an hour,100%,"May 16, 2017",house,,2310,12,,Virginia Beach
665384,Home From The Sea (Beach get away),36.697015,-75.9260095,"Sandbridge Beach, Virginia Beach, VA, USA",2,,253,,,,,5.3%,4,6,3,2,condo,Yes,2015,Within 12 hours,90%,"May 19, 2017",condo,3,,6,building,Virginia Beach
4118408ha,Cozy Chick's Beach Cottage just steps from the surf on Chesapeake Bay,36.9196581,-76.1341179,"Chic's Beach, Virginia Beach, VA, USA",10,4.8,150,,,,,,3,5,2,1,cottage,Yes,2016,Within 12 hours,100%,"June 2, 2017",cottage,,,5,,Virginia Beach
862186,Beautiful Chicks Beach Living,36.914644,-76.121286,"Chic's Beach, Virginia Beach, VA, USA",18,4.9,320,300,,,125,8.0%,3,6,3,2,apartment,Yes,2016,Within an hour,100%,"June 5, 2017",apartment,1,1700,6,house,Virginia Beach
4477931ha,DUN e NUF COTTAGE @ SANDBRIDGE BEACH ENJOY THE AMAZING SUNSETS IN PARADISE,36.69916622,-75.92962963,"Sandbridge Beach, Virginia Beach, VA, USA",3,4.3,195,195,,,,9.5%,2,4,1,1,cottage,Yes,2017,Within an hour,100%,"June 5, 2017",cottage,,750,4,,Virginia Beach
1020251,Cottage on Back Bay Wild Life Refuge at Sandbridge Beach,,,"Sandbridge Beach, Virginia Beach, VA, USA",2,,120,140,160,,60,11.0%,2,5,2,1,recreational vehicle,Yes,2014,Within an hour,100%,"June 6, 2017",recreational vehicle,,400,,,Virginia Beach
1025047,Luxury In An Original 1935 Beach Home 3 Minutes From The Beach!,36.8548368,-75.9797615,"Northeast Virginia Beach, Virginia Beach, VA, USA",4,,274,199,,,100,14.0%,2,6,2,3,house,Yes,2016,Within a few hours,90%,"June 7, 2017",house,,1700,6,,Virginia Beach
440311,Luxury Northend Home just 1 Short Block From Beach,36.895161,-75.9901869,"Northeast Virginia Beach, Virginia Beach, VA, USA",30,4.6,350,350,,,175,14.0%,2,12,4,2,house,Yes,2012,Within 12 hours,100%,"June 1, 2017",house,,2100,12,,Virginia Beach
1044912,Gorgeous Home Just 400 Ft To The Beach!!,36.9149184,-76.1234128,"Chic's Beach, Virginia Beach, VA, USA",3,,180,180,,,150,14.0%,3,12,4,2,townhome,Yes,2016,Within a few hours,100%,"June 6, 2017",townhome,,1800,12,,Virginia Beach
345956,"Virginia Beach, 28th Street",36.855892,-75.97963303,"Northeast Virginia Beach, Virginia Beach, VA, USA",8,4.6,195,120,,,75,11.0%,3,6,2,2,condo,Yes,2011,Within 12 hours,100%,"June 1, 2017",condo,2,,6,building,Virginia Beach
3938885ha,Kick back and relax on a private deck overlooking the Bay in Sandbridge.,36.69899255,-75.92930535,"Sandbridge Beach, Virginia Beach, VA, USA",20,4.8,150,,,,,9.5%,2,5,2,1,cottage,Yes,2015,Within 12 hours,100%,"June 5, 2017",cottage,,400,,,Virginia Beach
4282015ha,Short Walk to the Beach. Great Area Of Town!,36.8533378,-75.9786691,"Northeast Virginia Beach, Virginia Beach, VA, USA",5,,200,250,,,120,14.0%,3,5,2,2,condo,Yes,2016,Within an hour,100%,"June 7, 2017",condo,,1300,5,building,Virginia Beach
7024760ha,"Beachfront, INDOOR POOL, 10br,7ba,gameroom,sleeps 28",36.744446,-75.943273,"Sandbridge Beach, Virginia Beach, VA, USA",28,4.6,816,,,,195,15.5%,3,30,10,7,house,Yes,2005,Within an hour,100%,"June 5, 2017",house,,4500,30,,Virginia Beach
3597061ha,"""The Rimini"" - Your luxurious home away from home awaits!",36.8551166,-75.9793153,"Northeast Virginia Beach, Virginia Beach, VA, USA",8,4.4,265,139,159,,100,14.0%,3,8,2,1,apartment,Yes,2013,Within 12 hours,100%,"May 31, 2017",apartment,2,1000,8,,Virginia Beach
3817834ha,"Beachfront, Indoor Pool, Hot Tub 10 Br, 7 Ba, Sleeps 28, Gameroom",36.744446,-75.943273,"Sandbridge Beach, Virginia Beach, VA, USA",28,4.6,809,,,,195,15.5%,3,30,10,7,house,Yes,2005,Within an hour,100%,"June 5, 2017",house,,4500,30,,Virginia Beach
738516,"Fabulous North End Home - 1.5 blocks off the beach, free wifi, private deck!",36.89089613,-75.99057046,"Northeast Virginia Beach, Virginia Beach, VA, USA",21,4.8,240,300,,,,8.0%,3,8,3,2,house,Yes,2015,Within a day,100%,"May 21, 2017",house,,1500,8,,Virginia Beach
880963,*Brand New* Luxury* One Block To The Oceanfront* 4 Stories* Elevator And Garage,36.8443471,-75.9742301,"Northeast Virginia Beach, Virginia Beach, VA, USA",0,,421,,,,150,8.0%,7,12,3,3,townhome,Yes,2016,Within 12 hours,100%,"June 2, 2017",townhome,,2500,,building,Virginia Beach
7051417ha,"Aloha Beach Retreat, 6 bedroom, semi-oceanfront w/pool w/game room, sleeps 18",36.725319,-75.936599,"Sandbridge Beach, Virginia Beach, VA, USA",12,4.9,755,450,500,,125,5.0%,1,18,6,3,house,Yes,2009,Within a day,100%,"June 3, 2017",house,,,18,,Virginia Beach
920714,"Home VB Oceanfront: sleeps 10  walk to convention center, oceanfront, stores",,,"Northeast Virginia Beach, Virginia Beach, VA, USA",1,,320,320,,,150,14.0%,2,10,3,3,house,Yes,2016,Within an hour,100%,"June 6, 2017",house,,1700,10,,Virginia Beach
3670938ha,Waterfront In Sandbridge Beach,,,"Sandbridge Beach, Virginia Beach, VA, USA",17,,385,385,,,,15.5%,3,8,3,2,house,Yes,2013,Within 12 hours,100%,"June 7, 2017",house,,2000,8,,Virginia Beach
741332,"SemiOcean Front 7+ Bedroom House w/Pool, Hot Tub, Wrap Around Decks, Beds for 22",36.70126782,-75.92711068,"Sandbridge Beach, Virginia Beach, VA, USA",19,4.6,493,,,,,15.5%,3,22,7,5,house,Yes,2015,Within an hour,100%,"June 5, 2017",house,,3300,,,Virginia Beach
340629ha,"10Bd/10Ba Large Beach Home with Ocean View, Heated Indoor Pool in Virginia Beach",36.826766,-75.970016,"Dam Neck, Virginia Beach, VA, USA",8,4.8,,,,,,14.0%,3,28,10,10,house,Yes,2009,Within an hour,100%,"May 22, 2017",house,,,28,,Virginia Beach
990472,"Luxury Four Bedroom, Three Story Single Family Townhome",,,"Northeast Virginia Beach, Virginia Beach, VA, USA",3,,400,500,,,200,8.2%,2,8,4,3,townhome,Yes,2015,Within an hour,100%,"June 6, 2017",townhome,,,8,,Virginia Beach
4257515ha,Oh the Places You'll Go,36.744139,-75.943896,"Sandbridge Beach, Virginia Beach, VA, USA",1,,596,,,,,,3,26,9,8,house,Yes,2011,Within a few hours,,"June 7, 2017",house,,,,,Virginia Beach
