listing_id,listing_title,latitude,longitude,location_name,number_reviews,average_rating,average_nightly_price,nightly,weekend_night,property_protection_fee,cleaning_fee,tax_rate,min_stay,sleeps,bedrooms,bathrooms,property_type,internet,member_since,response_time,response_rate,calendar_last_updated,type,floor,sq_footage,max_occupancy,building_type,city
589454,Ground Floor Apartment In The Heart Of Hawthorne District,45.511506,-122.627267,"Hawthorne, Portland, OR, USA",7,4.9,67,,,,150,,30,4,1,1,apartment,Yes,2014,Within 12 hours,100%,"May 23, 2017",apartment,1,800,4,,Portland
7070464ha,Newly Renovated and Waterfront Condo in the Pearl District,45.5289956,-122.6743268,"Old Town Chinatown, Portland, OR, USA",14,4.7,71,,,,,,21,4,1,1,condo,Yes,2010,Within a few days,70%,"May 12, 2017",condo,1,690,4,,Portland
630452,Beautifully Updated 1883 Sellwood Bungalow,45.464041,-122.655298,"Sellwood - Moreland, Portland, OR, USA",18,4.9,100,,,,100,,30,5,2,1,house,Yes,2014,Within a day,90%,"May 22, 2017",house,,1175,5,,Portland
802672,#28 Urban Retreat In The Trees,45.4898346,-122.6784839,"Homestead, Portland, OR, USA",16,4.9,125,125,150,,60,12.5%,2,6,2,1,apartment,Yes,2015,Within 12 hours,100%,"June 5, 2017",apartment,2,800,6,building,Portland
473801,Northwest  Nob Hill  2 bedroom Pied-à-terre,45.5307899,-122.7024304,"Uptown, Portland, OR, USA",57,4.8,198,185,,,,,3,4,2,1,apartment,Yes,2008,Within a few hours,100%,"June 6, 2017",apartment,2,1000,4,building,Portland
4082409ha,Attractive 9th Avenue Apartment,45.5184279,-122.6804518,"Downtown, Portland, OR, USA",49,4.7,293,,,,,,1,5,2,2,apartment,Yes,2011,Within an hour,,"June 6, 2017",apartment,,1000,5,,Portland
439210,Historic Vista Cottage- Portland Heights -Featured in the Oregonian,45.5098239,-122.6985525,"Portland Heights, Portland, OR, USA",88,4.9,145,155,,,85,13.3%,3,3,1,1,cottage,Yes,2012,Within an hour,100%,"May 20, 2017",cottage,,660,3,,Portland
801545,"Nob Hill Historic Victorian Pied-à-Terre, Location and Off-Street Parking!",45.53465266,-122.70741775,"Uptown, Portland, OR, USA",53,4.8,,,,,35,13.5%,30,2,1,1,house,Yes,2015,Within a day,90%,"May 28, 2017",house,,480,2,,Portland
354752,"Location, Location, Location, Northwest Portland Classic",45.53079224,-122.7024231,"Uptown, Portland, OR, USA",84,4.9,125,125,,,,,14,5,2,1,apartment,Yes,2008,Within a few hours,100%,"June 6, 2017",apartment,1,1000,5,building,Portland
120133,Garden View Hideway In Irvington Neighborhood,45.5395546,-122.65076447,"Irvington, Portland, OR, USA",97,4.8,90,85,100,,65,12.5%,,4,1,1,apartment,Yes,2006,Within an hour,100%,"June 2, 2017",apartment,1,550,4,,Portland
478874,A Feathered Nest. Your Home Away from Home,,,"Slabtown, Portland, OR, USA",79,,245,245,,,,12.5%,3,4,2,2,apartment,Yes,2013,Within a few hours,100%,"June 4, 2017",apartment,1,1100,4,,Portland
907710,Historic Springs Cottage- Portland Heights- featured in The Oregonian,45.5098178,-122.6986455,"Portland Heights, Portland, OR, USA",18,,145,155,,,,13.3%,3,6,2,2,house,Yes,2012,Within an hour,100%,"June 6, 2017",house,,1320,6,,Portland
485443,Panoramic MT Hood And Willamette River View Minutes From City Center,45.47343,-122.676657,"Corbett - Terwilliger - Lair Hill, Portland, OR, USA",76,4.5,124,124,,,,11.5%,2,2,1,1,apartment,Yes,2013,Within a day,100%,"June 2, 2017",apartment,1,500,2,,Portland
626450,2 Fun Location! Spacious Newer condo Close To It All!,45.5363206,-122.7018322,"Uptown, Portland, OR, USA",39,4.9,173,135,145,,100,11.5%,2,4,1,1,condo,Yes,2013,Within an hour,100%,"June 6, 2017",condo,2,968,4,,Portland
881382,"Spacious 4,000 Sq Ft House In Quiet Neighborhood",45.524993,-122.765412,"West Haven-Sylvan, Portland, OR, USA",19,4.7,333,350,400,,,,2,20,6,3,house,Yes,2015,Within an hour,100%,"June 6, 2017",house,,4000,20,,Portland
7106185ha,Portland Monthly Rentals Million Dollar View Condo,45.5253715,-122.7017092,"Hillside, Portland, OR, USA",10,,68,,,,100,,31,2,1,1,condo,Yes,2012,Within an hour,100%,"May 26, 2017",condo,2,670,2,building,Portland
924257,"Clean, Colorful and Comfortable -Private Home 2 Blocks From N Williams Ave.",45.551571,-122.664991,"Boise, Portland, OR, USA",1,,72,72,,,75,,30,2,1,1,house,Yes,2016,Within a few hours,100%,"March 29, 2017",house,,750,2,,Portland
566559,"Beautiful 1920's Home ~Your Gateway To Hollywood, Downtown Portland, Everything!",,,"Roseway, Portland, OR, USA",12,4.8,113,,,,100,,30,8,3,1,house,Yes,2011,Within a few hours,100%,"June 6, 2017",house,,2000,8,,Portland
818052,"Sellwood Guest Home, 2BR/2ba Guest Home, stunning design, close to downtown.",45.465976,-122.656349,"Sellwood - Moreland, Portland, OR, USA",31,4.9,165,145,,,85,11.5%,2,4,2,2,house,Yes,2016,Within an hour,100%,"June 6, 2017",house,,750,,,Portland
3785775ha,"Lovely Art-Filled Home, Very Close In & Walkable, 2 Br/2Ba, Authentic Portland!",45.499544,-122.656628,"Brooklyn, Portland, OR, USA",46,4.8,164,165,,,150,13.3%,3,8,2,2,house,Yes,2014,Within a few hours,100%,"June 6, 2017",house,,1300,8,,Portland
747214,Charming one bedroom vintage apartment in Nob Hill,45.5341689,-122.7052051,"Uptown, Portland, OR, USA",7,4.6,142,130,,,120,,5,2,1,1,condo,Yes,2015,Within an hour,100%,"June 5, 2017",condo,,,2,building,Portland
729178,"Beautiful University Park Art House In N. Portland, Near U. Of P.",45.5769475,-122.7205401,"University Park (Portland, OR, USA)",54,4.9,140,130,,,75,11.5%,2,5,2,1,house,Yes,2015,Within an hour,100%,"June 7, 2017",house,,1200,5,,Portland
344349,"That Blue Cottage: Fully Updated 1bd, Heart of NE Alberta Arts",,,"Alberta Arts District, Portland, OR, USA",79,4.8,150,150,,,50,11.5%,2,4,1,1,house,Yes,2011,Within a few hours,100%,"June 4, 2017",house,,650,4,,Portland
746486,Stunning Modern Home In Trendy & Hip Mississippi District,45.5563405,-122.6749561,"Mississippi District, Portland, OR, USA",23,4.9,407,310,335,,115,12.5%,1,12,5,3,house,Yes,2011,Within a few hours,100%,"June 1, 2017",house,,2000,12,,Portland
740612,Mid Century Neighborhood 3 blks to Reed 1 BD/1BA With PINBALL & OUTDOOR BBQ!!,45.488919,-122.631709,"Reed, Portland, OR, USA",33,4.8,119,119,,,30,10.0%,1,4,1,1,apartment,Yes,2015,Within an hour,100%,"June 6, 2017",apartment,1,800,4,house,Portland
802618,"22 Close in, Tree Views, Cumfy",45.4898346,-122.6784839,"Homestead, Portland, OR, USA",28,4.8,128,125,150,,60,12.5%,2,6,2,1,apartment,Yes,2015,Within 12 hours,100%,"June 6, 2017",apartment,1,800,6,building,Portland
638526,Craft European Pacific Northwest Portland Inspired Guest Inn,45.52013,-122.589724,"Mount Tabor, Portland, OR, USA",38,,146,155,,,,11.5%,3,4,1,1,house,Yes,2014,Within an hour,100%,"June 7, 2017",house,,650,4,,Portland
566301,HISTORIC GEM in Premiere NW Location!,45.5315732,-122.7010223,"Uptown, Portland, OR, USA",52,4.7,132,115,135,,,11.0%,3,3,1,1,apartment,Yes,2014,Within 12 hours,100%,"June 5, 2017",apartment,1,524,3,house,Portland
821977,Lovely Urban Getaway; Close to Everything in Portland Oregon,45.4820281,-122.6093673,"Woodstock, Portland, OR, USA",3,,137,160,,,100,12.5%,2,5,2,1,cottage,Yes,2016,Within a few hours,100%,"June 5, 2017",cottage,,498,5,,Portland
655777,Boutique-Hotel Style Apt. in the Sunnyside/Laurelhurst area,45.5180999,-122.631895,"Sunnyside, Portland, OR, USA",81,4.9,125,125,,,35,11.5%,,4,1,1,house,Yes,2014,Within an hour,90%,"June 7, 2017",house,,900,4,,Portland
512525,Best Walking Location In PDX,,,"Slabtown, Portland, OR, USA",62,,347,345,,,130,12.5%,3,6,3,2,apartment,Yes,2013,Within a few hours,100%,"June 4, 2017",apartment,2,2200,6,,Portland
4118596ha,"Portland One Bedroom in Arbor Lodge, new construction",45.5716638,-122.6993071,"Arbor Lodge (Portland, OR, USA)",41,,123,99,125,,75,11.5%,2,3,1,1,house,Yes,2016,Within an hour,100%,"June 4, 2017",house,,700,,,Portland
814764,NEW YEAR SPECIAL in Historic Urban Villa,45.5337891,-122.6414789,"Sullivan's Gulch, Portland, OR, USA",37,4.8,179,179,,,,,,6,2,1,condo,Yes,2015,Within a few hours,100%,"June 5, 2017",condo,1,1100,6,villa,Portland
510761,"Volcano/Water View LARGE, almost-new, two-story townhouse with driveway parking",45.5880751,-122.7761899,"St. Johns, Portland, OR, USA",37,4.8,130,,,,100,,3,4,2,2,condo,Yes,2013,Within a few hours,100%,"June 6, 2017",condo,,1400,4,,Portland
3787986ha,Designer Owned House on Vibrant Williams Avenue near Mississippi,45.552934,-122.666421,"Boise, Portland, OR, USA",54,4.9,203,185,,,90,11.5%,3,8,2,1,house,Yes,2014,Within a few hours,100%,"June 5, 2017",house,,1800,8,,Portland
724477,NEW YEAR SPECIAL in Historic Urban Villa,45.53380575,-122.64097381,"Sullivan's Gulch, Portland, OR, USA",72,4.9,164,179,,,,,,6,2,1,condo,Yes,2015,Within an hour,100%,"June 6, 2017",condo,1,1100,6,villa,Portland
574324,Classic Restored Bungalow in Historic Sellwood,45.466282,-122.6500178,"Sellwood - Moreland, Portland, OR, USA",46,4.8,143,150,,,100,13.3%,3,5,2,2,house,Yes,2014,Within a few hours,100%,"June 4, 2017",house,,1700,5,,Portland
590359,A Beauty in Nob Hill  **check out last minute discounts**,45.531538,-122.701017,"Uptown, Portland, OR, USA",40,4.9,128,115,135,,75,11.0%,3,2,1,1,apartment,Yes,2014,Within a day,90%,"June 5, 2017",apartment,1,600,2,house,Portland
625682,A block from Washington Park and near shops/restaurants NW 23rd Ave. & Downtown,45.520735,-122.699481,"Goose Hollow, Portland, OR, USA",63,4.7,85,85,,,75,13.3%,,2,1,1,apartment,Yes,2014,Within an hour,100%,"June 7, 2017",apartment,1,,2,house,Portland
286937ha,"Architect Designed - Peaceful, Quiet & 5 mins to Downtown.",45.50181,-122.767468,"Cedar Hills, Beaverton, OR, USA",35,4.9,185,185,,,100,,3,8,3,2,house,Yes,2010,Within a few hours,90%,"June 6, 2017",house,,1800,8,,Portland
652634,Quick Access To The Best Of Portland,45.57653456,-122.67302482,"Piedmont, Portland, OR, USA",67,4.8,193,190,200,,,11.5%,1,8,2,2,house,Yes,2013,Within a few hours,100%,"June 7, 2017",house,,1800,8,,Portland
727415,MODA Ctr / N Williams / Emanuel Hospital / Lloyd District / Close to Downtown,45.54273907,-122.665497,"Eliot, Portland, OR, USA",13,4.8,104,125,,,35,13.3%,2,2,1,1,studio,Yes,2015,Within a few hours,100%,"May 23, 2017",studio,1,500,2,house,Portland
713815,Cottage like gem in NW Portland,45.53419774,-122.70382725,"Uptown, Portland, OR, USA",61,4.7,130,110,,,50,,2,2,Studio,1,condo,Yes,2015,Within a day,100%,"June 5, 2017",condo,1,438,2,,Portland
827806,Perfect for the Long Term Business person or Traveling Nurse,45.482387,-122.722867,"Hayhurst, Portland, OR, USA",1,,57,70,,,,8.0%,6,2,1,1,house,Yes,2016,Within a day,100%,"May 31, 2017",house,,4000,2,,Portland
669375,Cozy Condo in Heart of Multnomah Village,45.4674039,-122.7118181,"Multnomah Village (Portland, OR, USA)",9,4.6,205,215,,,,,3,8,3,2,condo,Yes,2015,Within a few hours,90%,"June 4, 2017",condo,,1500,8,building,Portland
779912,Ladd's Addition Is One Of Portlands Most Desireable Neighborhoods,45.5066535,-122.6467238,"Ladd's Addition, Portland, OR, USA",37,4.9,108,115,,,15,16.0%,3,2,1,1,house,Yes,2015,Within an hour,100%,"June 6, 2017",house,,,2,,Portland
826580,Alberta Arts Tiny Gem,45.56338071,-122.63436291,"Concordia, Portland, OR, USA",26,4.6,95,95,,,50,14.0%,,3,1,1,cottage,Yes,2014,Within an hour,100%,"June 6, 2017",cottage,,450,3,cottage,Portland
917690,Spacious Loft in Pearl District +Parking,45.5297239,-122.686102,"Pearl District, Portland, OR, USA",4,4.8,168,124,,,80,,7,2,1,1,condo,Yes,2016,Within a few days,60%,"May 11, 2017",condo,4,750,2,building,Portland
592621,Nob Hill/Alphabet District/NW Portland Lovely 2 Bed/1.5 Bath W Attached Garage,45.5298734,-122.6933818,"Nob Hill Alphabet District, Portland, OR, USA",52,4.8,205,205,,,110,,3,5,2,1,townhome,Yes,2011,Within a few days,70%,"June 7, 2017",townhome,1,800,5,,Portland
729468,"Belmont And Buckman's Best Rental ""Walkers Paradise""",45.51616757,-122.65296167,"Buckman, Portland, OR, USA",34,4.4,171,115,140,,35,11.5%,2,8,2,1,house,Yes,2014,Within 2 days,100%,"June 6, 2017",house,,950,8,,Portland
746850,"Hot & Chic Mississippi District -Fresh, Bright & Modern Bungalow",45.5563209,-122.67526,"Mississippi District, Portland, OR, USA",18,4.8,345,250,275,,115,12.5%,1,10,4,2,house,Yes,2011,Within a few hours,100%,"June 4, 2017",house,,1600,10,,Portland
615822,Zen Modern in the N. Mississippi District,45.5641193,-122.6750991,"Mississippi District, Portland, OR, USA",69,,349,349,,,,12.5%,2,6,3,2,house,Yes,2014,Within an hour,100%,"June 7, 2017",house,,2500,6,,Portland
632825,Victorian Studio in Prime Fun Location! Fully Equipped!,45.53618974,-122.70191452,"Uptown, Portland, OR, USA",46,4.6,123,100,110,,,11.5%,2,4,Studio,1,apartment,Yes,2013,Within an hour,100%,"June 6, 2017",apartment,1,560,4,,Portland
701061,Great Location! Spacious ground level Condo!,45.5360499,-122.70200376,"Uptown, Portland, OR, USA",41,4.8,200,160,170,,100,11.5%,2,6,2,1,condo,Yes,2013,Within a few hours,90%,"June 6, 2017",condo,1,1027,6,building,Portland
436629,"Family-friendly Home Walkable To Park, Restaurants & Transit, Pets Ok",45.5837753,-122.692855,"Kenton, Portland, OR, USA",22,,239,200,250,,,,2,6,3,2,house,Yes,2012,Within an hour,100%,"June 5, 2017",house,,,6,,Portland
579714,Spacious newer condo! Fun Location! Close to it all in Popular NW 23rd area!,45.5363505,-122.7018321,"Uptown, Portland, OR, USA",65,4.7,194,160,170,,125,11.5%,2,5,2,1,condo,Yes,2013,Within an hour,100%,"June 6, 2017",condo,2,1028,5,building,Portland
438808,"Quiet Retreat at the Heart of Inner SE Portland, Near Downtown",45.5173017,-122.6370994,"Sunnyside, Portland, OR, USA",34,4.9,150,,,,,11.5%,7,6,3,1,house,Yes,2012,Within a few hours,100%,"June 4, 2017",house,,1500,6,,Portland
612198,Stylish And Modern 2 Br Townhome In The Heart Of Vibrant Alberta Arts District,,,"Alberta Arts District, Portland, OR, USA",53,4.9,214,210,,,210,13.3%,3,5,2,2,townhome,Yes,2014,Within a few hours,100%,"June 6, 2017",townhome,,1350,5,house,Portland
919681,"Stanhope Cottage in Portland Heights - 5 minutes to downtown, NW 23rd & Pearl",45.506292,-122.6944725,"Portland Heights, Portland, OR, USA",12,,155,140,,,75,11.5%,2,5,2,1,house,Yes,2016,Within a day,100%,"June 2, 2017",house,,1400,5,,Portland
478812,Spacious Victorian Home in Prime NW Location!,45.536369,-122.701593,"Uptown, Portland, OR, USA",67,4.7,350,290,300,,150,11.5%,2,8,3,2,house,Yes,2013,Within an hour,100%,"June 6, 2017",house,,1970,8,,Portland
7111525ha,"Serene Studio, covered parking, rec.center, views! AC Quiet, close to everything",45.5080256,-122.7553482,"West Haven-Sylvan, Portland, OR, USA",11,4.8,63,63,,,,,,2,Studio,1,studio,Yes,2008,Within a few hours,100%,"June 3, 2017",studio,,450,2,,Portland
617083,"Beautiful Family Home. Large Yard, View, Parks, Shops, Dining, Downtown in Minut",45.51511,-122.59155458,"Mount Tabor, Portland, OR, USA",19,4.7,248,200,250,,145,11.5%,2,8,3,2,house,Yes,2014,Within a day,100%,"June 6, 2017",house,,2800,,,Portland
285987,Peaceful Garden Apt. Close to Mt. Tabor Park & Downtown Bus,45.52162552,-122.59931946,"North Tabor, Portland, OR, USA",100,,110,110,,,,11.5%,3,4,1,1,apartment,Yes,2010,Within a few hours,90%,"June 2, 2017",apartment,,650,4,,Portland
438775,Modern & New Home Close in SE & Close to Downtown/Many Features/ 2 & 1/2 Bath,45.495797,-122.630135,"Creston - Kenilworth, Portland, OR, USA",43,4.7,185,175,225,,100,,2,6,2,2,townhome,Yes,2011,Within 12 hours,90%,"June 7, 2017",townhome,,1100,6,,Portland
489016,3-Level Spacious and bright Cape Cod - Recently remodeled with midcentury charm,45.528808,-122.581674,"Montavilla, Portland, OR, USA",15,4.9,100,100,,,,,30,6,3,1,house,Yes,2013,Within a few hours,100%,"May 25, 2017",house,,2400,6,,Portland
701162,Close to downtown and the Pearl.,45.54026,-122.657243,"Irvington, Portland, OR, USA",34,4.9,171,175,,,,,2,4,2,1,condo,Yes,2015,Within a day,90%,"June 6, 2017",condo,,875,4,,Portland
428191,"Charming home, lovely quiet street. Walk to best restaurants shops etc.",45.507744,-122.652292,"Ladd's Addition, Portland, OR, USA",61,4.6,184,,,,100,11.5%,2,6,2,2,cottage,Yes,2012,Within 12 hours,100%,"June 7, 2017",cottage,,,6,,Portland
425714,Beautiful Detached Cottage in Mississippi Neighborhood,45.558528,-122.674091,"Mississippi District, Portland, OR, USA",41,4.9,130,120,,,50,13.5%,2,4,1,1,guest house,Yes,2012,Within an hour,100%,"June 5, 2017",guest house,,342,4,,Portland
4253265ha,Amazing 9th Avenue Apartment,45.5194205,-122.6813299,"Downtown, Portland, OR, USA",14,4.9,240,,,,,,1,4,1,1,apartment,No,2011,Within an hour,,"June 6, 2017",apartment,,,4,,Portland
980084,1795 Sqft Townhouse: Pearl District/NW Portland,45.5373006,-122.6866983,"Pearl District, Portland, OR, USA",1,,133,133,,,125,,30,4,2,2,townhome,Yes,2016,Within 12 hours,100%,"June 6, 2017",townhome,,1795,,,Portland
758825,NW Downtown Studio with Parking,45.5257091,-122.6771868,"Old Town Chinatown, Portland, OR, USA",29,4.1,150,100,,,,12.5%,,2,1,1,apartment,Yes,2015,Within an hour,100%,"June 5, 2017",apartment,2,500,2,building,Portland
704856,Brand New 1BD/1 BA Across From Sellwood Park,45.4683909,-122.658732,"Sellwood - Moreland, Portland, OR, USA",17,4.9,108,120,,,50,,3,4,1,1,apartment,Yes,2015,Within 12 hours,100%,"May 15, 2017",apartment,2,550,4,house,Portland
993876,Enjoy the Heart of the Trendy South Waterfront nearby Downtown Portland Oregon,45.496611,-122.6697317,"South Waterfront, Portland, OR, USA",1,,65,63,,,,,30,2,1,1,condo,Yes,2017,Within 12 hours,100%,"May 19, 2017",condo,4,775,,building,Portland
263725,River Front Pearl...How Can You Resist...!!!,45.52860641,-122.67359924,"Old Town Chinatown, Portland, OR, USA",14,4.8,129,,,,,,25,2,1,1,condo,Yes,2009,Within 12 hours,90%,"May 18, 2017",condo,1,690,2,,Portland
381329,Portland: Business/Pleasure Butternut Condos: Saffron Condo,45.5121541,-122.6109374,"Mount Tabor, Portland, OR, USA",19,4.9,100,,,,,,31,4,1,1,condo,Yes,2011,Within 12 hours,100%,"May 30, 2017",condo,1,600,4,,Portland
496637,1. Like New Condo In Great Fun Northwest Location! Close to it all!,45.5363206,-122.7018322,"Uptown, Portland, OR, USA",30,4.6,170,125,135,,100,11.5%,2,4,1,1,condo,Yes,2013,Within an hour,100%,"June 6, 2017",condo,1,968,4,,Portland
707823,Modern Alberta Arts Studio,45.56018405,-122.63510417,"Alberta Arts District, Portland, OR, USA",50,4.9,100,95,100,,50,,2,4,1,1,studio,Yes,2015,Within a few hours,100%,"May 28, 2017",studio,2,525,4,cottage,Portland
462894,Vintage Hawthorne Restored 1BD/1BA,45.5110263,-122.6247506,"Hawthorne, Portland, OR, USA",10,,73,,,,100,,30,3,1,1,apartment,Yes,2012,Within 2 days,90%,"May 24, 2017",apartment,1,850,3,,Portland
220161,Beautiful Forested Loft in Nw Hills Secluded Yet Close to Town,45.57806778,-122.80286407,"Forest Park, Portland, OR, USA",144,4.8,136,109,119,,60,13.3%,2,4,1,1,guest house,Yes,2008,Within an hour,100%,"June 7, 2017",guest house,,1500,4,,Portland
580053,Cottage In The 'Hoods' In Central Ne Portland Near Alberta Arts District,45.554722,-122.625832,"Beaumont - Wilshire, Portland, OR, USA",53,,196,225,,,75,,2,4,2,1,house,Yes,2007,Within a few hours,100%,"June 6, 2017",house,,900,4,,Portland
4082414ha,Amazing Park Avenue Apartment,45.5154031,-122.6827212,"Downtown, Portland, OR, USA",19,4.8,269,,,,,,1,5,2,2,apartment,Yes,2011,Within an hour,,"June 6, 2017",apartment,,,5,,Portland
353730,Luxury 2-BR Apartment in Northwest District,,,"Nob Hill Alphabet District, Portland, OR, USA",103,4.9,169,190,,,,,3,4,2,1,apartment,Yes,2011,Within 12 hours,100%,"June 5, 2017",apartment,1,1400,4,house,Portland
741918,Spacious Portland home in the heart of the east side- family and Pet Friendly,45.5236859,-122.6465061,"Kerns, Portland, OR, USA",1,,120,,,,,,30,8,3,2,house,Yes,2015,Within a day,90%,"May 26, 2017",house,,2100,8,,Portland
991763,"Modern Comfort, Vintage Charm",45.562045,-122.631401,"Alberta Arts District, Portland, OR, USA",5,,295,295,,,125,11.5%,2,6,3,2,house,Yes,2017,Within a day,100%,"June 5, 2017",house,,2200,6,,Portland
235163,"Stunning Portland Vacation Flat, Prime SE Location, Huge Private Patio",45.49275208,-122.63531494,"Creston - Kenilworth, Portland, OR, USA",51,4.6,239,239,279,,105,3.7%,1,7,2,2,house,Yes,2009,Within a few hours,100%,"June 5, 2017",house,,1250,7,,Portland
993787ha,"TROPICAL OASIS- SW Portland, Bull Mt -  Hot Tub - Fire Pit - Gateway to Wineries",,,"Bull Mountain, Tigard, OR, USA",33,,120,120,,,,,3,2,1,1,house,Yes,2012,Within 12 hours,100%,"June 6, 2017",house,,800,2,,Portland
80998,Beautiful Irvington Apartment near City Center!,45.5395546,-122.65076447,"Irvington, Portland, OR, USA",87,4.9,170,155,170,,95,12.5%,,7,3,1,apartment,Yes,2006,Within a few hours,100%,"June 2, 2017",apartment,2,1350,7,,Portland
419134,Walk Everywhere in the Best of Portland's Neighborhoods,,,"Alberta Arts District, Portland, OR, USA",41,4.8,218,169,179,,,,1,6,2,1,apartment,Yes,2012,Within an hour,100%,"June 7, 2017",apartment,,800,6,house,Portland
596681,Portland Riverfront Penthouse 3BR/2BA Suite - on the Willamette River,45.4176689,-122.65354,"Oak Grove, OR, USA",25,4.9,307,259,299,,,1.8%,3,6,3,2,chateau / country house,Yes,2014,Within an hour,100%,"June 7, 2017",chateau / country house,,,,,Portland
881709,Upscale condo w/ gorgeous city views & prime downtown location! Dogs ok!,45.519421,-122.68133,"Downtown, Portland, OR, USA",30,4.6,335,,,,,,1,6,2,2,condo,Yes,2001,Within an hour,,"June 7, 2017",condo,,,6,,Portland
881704,Beautiful & dog-friendly downtown Portland condo w/ panoramic views!,45.519421,-122.68133,"Downtown, Portland, OR, USA",27,4.7,270,,,,,,1,4,1,1,condo,Yes,2001,Within an hour,,"June 7, 2017",condo,,,4,,Portland
889979,"Sleek, dog-friendly condo w/ sweeping city views - great location!",45.519421,-122.68133,"Downtown, Portland, OR, USA",23,4.5,273,,,,,,1,4,1,1,condo,Yes,2001,Within an hour,,"June 7, 2017",condo,,,4,,Portland
882496,Bring your dog to downtown Portland and amazing highrise views!,45.519421,-122.68133,"Downtown, Portland, OR, USA",25,4.6,274,,,,,,1,4,1,1,apartment,Yes,2001,Within an hour,,"June 7, 2017",apartment,,,4,,Portland
881708,Luxury downtown condo w/ floor-to-ceiling windows & great views - dog friendly!,45.519421,-122.68133,"Downtown, Portland, OR, USA",33,4.2,330,,,,,,1,6,2,2,condo,Yes,2001,Within an hour,,"June 7, 2017",condo,,,6,,Portland
889975,Swanky dog-friendly condo w/ great city views & ideal downtown location!,45.519421,-122.68133,"Downtown, Portland, OR, USA",23,4.8,315,,,,,,1,6,1,1,condo,Yes,2001,Within an hour,,"June 7, 2017",condo,,,6,,Portland
889973,"Upscale, dog-friendly downtown condo w/ great views & new furnishings!",45.519421,-122.68133,"Downtown, Portland, OR, USA",21,,260,,,,,,1,4,1,1,condo,Yes,2001,Within an hour,,"June 7, 2017",condo,,,4,,Portland
881706,Downtown Portland condo welcomes dogs with beautiful city views!,45.519421,-122.68133,"Downtown, Portland, OR, USA",22,4.5,262,,,,,,1,4,1,1,condo,Yes,2001,Within an hour,,"June 7, 2017",condo,,,4,,Portland
137893,AVAILABLE SUMMER 2017-  QUALITY Apartment in IRVINGTON NEIGHBORHOOD-1100 Sq.Ft.,45.53761673,-122.65421295,"Irvington, Portland, OR, USA",33,4.9,90,,,,50,,31,3,1,1,apartment,Yes,2003,Within a day,90%,"April 13, 2017",apartment,,,3,,Portland
889974,"Modern condo w/ downtown views, close to shopping/dining, dog-friendly!",45.519421,-122.68133,"Downtown, Portland, OR, USA",25,4.7,268,,,,,,1,4,1,1,condo,Yes,2001,Within an hour,,"June 7, 2017",condo,,,4,,Portland
428521,"Perfectly Stylish Portland  (3 bedrms, 3 baths)",45.56174524,-122.6337964,"Alberta Arts District, Portland, OR, USA",44,4.8,373,349,369,,,13.3%,1,8,3,3,townhome,Yes,2012,Within an hour,100%,"June 6, 2017",townhome,2,1800,8,house,Portland
