listing_id,listing_title,latitude,longitude,location_name,number_reviews,average_rating,average_nightly_price,nightly,weekend_night,property_protection_fee,cleaning_fee,tax_rate,min_stay,sleeps,bedrooms,bathrooms,property_type,internet,member_since,response_time,response_rate,calendar_last_updated,type,floor,sq_footage,max_occupancy,building_type,city
961627,Private Zen Oasis Awaits,34.249572,-118.81697,"Simi Valley, CA, USA",3,,225,225,,,90,8.5%,,4,2,3,house,Yes,2016,Within a day,100%,"June 5, 2017",house,,,4,,Thousand Oaks
901204,"Perfect Family Home Close to LA, Malibu And Santa Barbara",34.170744,-118.826925,"Thousand Oaks, CA, USA",1,,214,235,,,,,5,8,4,2,house,Yes,2016,Within 12 hours,100%,"June 5, 2017",house,,2013,8,,Thousand Oaks
588250,Modern Rustic Retreat,34.1810666,-118.9470422,"Casa Conejo, Newbury Park, CA, USA",20,4.9,308,300,,,,,2,6,3,2,house,Yes,2014,Within 12 hours,100%,"June 4, 2017",house,,1400,6,,Thousand Oaks
660018,"Executive Retreat Newly Remodeled located in quiet, private setting",34.17562699,-118.911865,"Newbury Park, Thousand Oaks, CA, USA",15,4.8,149,165,,,45,,2,4,2,1,house,Yes,2014,Within an hour,100%,"May 31, 2017",house,,600,4,,Thousand Oaks
761691,"A hilltop alfresco retreat with pool, outside firestone, nr  Malibu, LA, SB",34.190609,-118.871721,"Thousand Oaks, CA, USA",13,4.5,150,150,,,130,6.0%,2,5,2,1,house,Yes,2015,Within 12 hours,100%,"May 24, 2017",house,,700,5,,Thousand Oaks
4264690ha,Vacation Home Near Malibu - Fully Furnished,,,"Agoura Hills, CA, USA",5,4.8,351,345,355,,250,14.0%,4,12,4,3,house,Yes,2016,Within an hour,100%,"June 6, 2017",house,,3000,12,,Thousand Oaks
922278,WANNA GET AWAY?  ENTERTAIN UNTIL YOUR HEART IS CONTENT.,34.1744045,-118.7905203,"Thousand Oaks, CA, USA",10,,495,495,,,150,9.0%,1,10,4,3,house,Yes,2016,Within 2 days,100%,"June 5, 2017",house,,3300,10,,Thousand Oaks
7086613ha,Avocado Orchard View Guest House,34.245484,-118.824911,"Simi Valley, CA, USA",6,,400,450,500,,250,,3,6,3,2,villa,Yes,2011,Within a few days,90%,"May 25, 2017",villa,,1900,6,,Thousand Oaks
729346,Sprawling Ranch House With Pool,,,"Thousand Oaks, CA, USA",7,4.7,360,350,400,,200,10.0%,4,9,4,2,house,Yes,2015,Within a few hours,100%,"June 6, 2017",house,,3000,9,,Thousand Oaks
693815,A home with all the perks of a resort! Perfect for your stay in So Cal,34.179474,-118.927137,"Newbury Park, Thousand Oaks, CA, USA",3,,150,,,,,,31,4,2,2,house,Yes,2015,Within a few hours,100%,"May 18, 2017",house,,1400,4,,Thousand Oaks
984180,"3BR, 2BA Agoura Hills House w/Landscaped Patio On Edge of Lake Lindero",34.150253,-118.790894,"Agoura Hills, CA, USA",1,,282,,,,,,4,7,3,2,house,Yes,2006,Within an hour,,"June 7, 2017",house,,,7,,Thousand Oaks
725382,Executive Ranch Home with a VIEW!!!,,,"Thousand Oaks, CA, USA",1,,514,,,,,8.0%,7,6,3,2,house,Yes,2015,Within 12 hours,90%,"May 22, 2017",house,,2100,6,,Thousand Oaks
429289,Private Villa Surrounded by Avocado Ranch in Simi,34.245484,-118.824911,"Simi Valley, CA, USA",7,4.4,446,450,500,,,,3,6,3,,house,Yes,2012,Within a few days,90%,"May 23, 2017",house,,2000,6,,Thousand Oaks
603040,"5 Star Upgraded Home In Prime Location. Close To Malibu, LA and Santa Barbara",34.227049,-118.843577,"Thousand Oaks, CA, USA",8,,299,,,,,,7,6,3,2,house,Yes,2014,Within 12 hours,90%,"May 21, 2017",house,,2200,6,,Thousand Oaks
646318,Indoor/Outdoor Executive Home,34.174135,-118.956805,"Newbury Park, Thousand Oaks, CA, USA",6,,325,,,,195,,7,6,3,2,house,Yes,2014,Within an hour,100%,"June 2, 2017",house,,1378,6,,Thousand Oaks
649656,Perfect Artist Retreat or Holiday Stay,34.169332,-118.824615,"Thousand Oaks, CA, USA",4,4.5,205,220,,,,10.0%,6,4,2,2,house,Yes,2014,Within an hour,100%,"April 22, 2017",house,,1400,4,,Thousand Oaks
7043298ha,"""Morning View"" Amazing Mountains View",34.135176,-118.815124,"Westlake Village, CA, USA",0,,,1,1,,175,,,12,4,3,house,Yes,2005,Within a few days,70%,"June 6, 2017",house,,3400,,,Thousand Oaks
476024,Cheerful home! 3-pool area in beautiful hill setting.,34.174146,-118.786279,"Thousand Oaks, CA, USA",2,,290,350,,,95,,3,8,3,3,house,Yes,2013,Within a day,100%,"May 7, 2017",house,,1910,8,,Thousand Oaks
568585,Golf Course & Mountain View,34.2026919,-118.9956797,"Camarillo, CA, USA",0,,150,,,,,,3,4,1,2,bungalow,Yes,2014,,,"April 27, 2017",bungalow,,1820,4,,Thousand Oaks
4432206ha,"Charming Guest House in a Canyon, Beautiful Views",,,"Newbury Park, Thousand Oaks, CA, USA",0,,189,189,,,55,7.5%,,2,1,1,guest house,No,2017,,,"May 16, 2017",guest house,,,,,Thousand Oaks
926112,Dream Lake Front House,,,"Thousand Oaks, CA, USA",0,,,2,,,250,10.0%,3,8,5,7,house,Yes,2016,Within a few days,70%,"May 24, 2017",house,,,,,Thousand Oaks
187365ha,"Romantic Malibu Celebrity Retreat, 180º ocean views, spa, 8 acres, gat",34.037766,-118.855616,"Western Malibu, Malibu, CA, USA",57,4.9,805,300,,,,12.0%,3,8,4,2,house,Yes,2007,Within an hour,100%,"June 5, 2017",house,,2000,8,,Thousand Oaks
363653ha,Charming Oceanfront Get-Away on Dry Sandy Carbon Beach - Stingray,34.038245,-118.673871,"Eastern Malibu, Malibu, CA, USA",41,4.9,325,275,,,,12.0%,3,4,1,1,apartment,Yes,2009,Within a day,90%,"June 4, 2017",apartment,1,800,4,,Thousand Oaks
457388,New Beachfront Modern Home on Secluded Beach w/hot tub + custom bthrms,34.039057,-118.588637,"Eastern Malibu, Malibu, CA, USA",43,4.8,900,900,,,350,,3,16,5,4,house,Yes,2013,Within an hour,100%,"June 6, 2017",house,,3100,16,,Thousand Oaks
178923ha,Lovely Casita Walking Distance to Zuma Beach,34.0262596,-118.8317616,"Western Malibu, Malibu, CA, USA",58,4.9,321,350,,,150,12.0%,3,8,3,2,house,Yes,2007,Within 2 days,80%,"June 6, 2017",house,,1150,8,,Thousand Oaks
369960ha,Malibu. Live the Dream. Beachfront Resort Condo,34.029502,-118.753688,"Central Malibu, Malibu, CA, USA",6,4.3,116,,,,75,,31,4,1,1,condo,Yes,2011,Within a few days,70%,"May 3, 2017",condo,,,4,,Thousand Oaks
4190947ha,"A villa with one bedroom, one bath and kitchen.  Sleeps 2 adults and 2 children.",34.1611997,-118.571892,"Tarzana, Los Angeles, CA, USA",13,4.9,121,130,,,,9.0%,3,4,1,1,villa,Yes,2016,Within 12 hours,100%,"June 1, 2017",villa,,600,4,,Thousand Oaks
757149,"Resort Style, Tuscan Home Close to Shops, 45min to L.a. & 45min to Santa Barbara",34.24261,-119.044659,"Camarillo, CA, USA",21,4.9,325,325,,,,10.0%,3,6,3,2,house,Yes,2015,Within 12 hours,100%,"June 2, 2017",house,,2000,6,,Thousand Oaks
763211,Oceanfront Malibu Modern Luxury,34.037906,-118.623453,"Eastern Malibu, Malibu, CA, USA",22,,850,750,,,250,12.0%,3,7,3,3,house,Yes,2015,Within an hour,100%,"June 5, 2017",house,,,7,,Thousand Oaks
907112ha,Extraordinary Retreat in Malibu,34.080788,-118.9205,"Malibu, CA, USA",47,4.9,200,220,,,,,1,4,1,1,cottage,Yes,2011,Within 12 hours,90%,"June 4, 2017",cottage,,700,4,,Thousand Oaks
363759ha,Exclusive Oceanfront Cottage on Dry Sandy Carbon Beach - Seal,34.038245,-118.673871,"Eastern Malibu, Malibu, CA, USA",24,4.8,325,275,,,,12.0%,3,4,1,1,apartment,Yes,2009,Within 2 days,80%,"June 6, 2017",apartment,1,800,4,,Thousand Oaks
4134527ha,"Adorable 1 BD 1BA - Private Fenced Front Yard, Pets, Kids, Walk To All, Historic",34.402071,-118.91369,"Fillmore, CA, USA",26,4.7,68,70,,,,8.0%,2,4,1,1,house,Yes,2016,Within 2 days,90%,"June 6, 2017",house,,,4,,Thousand Oaks
336602ha,"Incredible view, location, with your own swimming pool/jacuzzi, exclusive..",34.151217,-118.52874,"Tarzana, Los Angeles, CA, USA",47,4.9,340,275,325,,,14.0%,4,0,3,3,house,Yes,2010,Within an hour,100%,"June 6, 2017",house,,2350,,,Thousand Oaks
3530707ha,Fabulous Oceanfront Cottage On Dry Sandy Carbon Beach – Pelican,34.038272,-118.673804,"Eastern Malibu, Malibu, CA, USA",18,4.9,380,300,,,150,12.0%,3,4,1,1,apartment,Yes,2009,Within a day,90%,"May 31, 2017",apartment,1,800,4,,Thousand Oaks
664740,"Resort Style Living! A Tropical Paradise Pool Home, Golf Courses",34.244457,-119.084556,"Camarillo, CA, USA",15,4.9,545,545,,,200,,4,12,5,3,house,Yes,2015,Within 12 hours,100%,"June 5, 2017",house,,2400,12,,Thousand Oaks
270164,Malibu Cottage in an Olive Grove,,,"Central Malibu, Malibu, CA, USA",29,,300,300,,,,,,5,1,1,cottage,Yes,2009,Within a few days,50%,"June 6, 2017",cottage,,,5,,Thousand Oaks
3565549ha,"SET IN NATURE YET WITHIN MINUTES TO CIVILIZATION, FAMILY FRIENDLY",34.081238,-118.598998,"Fernwood, Topanga, CA, USA",12,4.9,200,220,,,175,,3,4,2,1,house,Yes,2013,Within an hour,100%,"June 4, 2017",house,,800,4,,Thousand Oaks
591545,Architecturally Stunning Home in Perfect Malibu Location,34.0384293,-118.639966,"Eastern Malibu, Malibu, CA, USA",19,,,1,1,,,12.0%,3,8,3,3,villa,Yes,2014,Within a day,90%,"June 7, 2017",villa,,3000,8,,Thousand Oaks
962477,Spectacular View Home in San Fernado Valley,,,"Northridge, Los Angeles, CA, USA",4,,286,325,,,150,9.0%,5,6,3,2,house,No,2016,Within a few hours,100%,"June 4, 2017",house,,2000,6,,Thousand Oaks
3595457ha,"3 BR, 2.5 BA, Modern & Luxurious, Spacious, Sleeps 8, Privet Garage",34.17269463,-118.52975598,"Tarzana, Los Angeles, CA, USA",27,4.8,209,199,,,150,14.0%,2,8,3,2,townhome,Yes,2013,Within a few hours,100%,"June 6, 2017",townhome,,2200,8,,Thousand Oaks
874405,OCEANFRONT BEACH HOUSE,34.037904,-118.623521,"Eastern Malibu, Malibu, CA, USA",8,,786,900,,,300,,3,6,3,3,house,Yes,2016,Within a day,100%,"May 23, 2017",house,,,6,,Thousand Oaks
341805ha,Malibu Hideaway Cottage in the Santa Monica Mountains,34.0876779,-118.599174,"Topanga, CA, USA",50,4.9,297,250,,,,,2,5,2,1,cottage,Yes,2011,Within 12 hours,100%,"June 6, 2017",cottage,,1100,5,,Thousand Oaks
602697,Oceanfront: Largest Entertaining Deck on Private Beach,34.037175,-118.632219,"Eastern Malibu, Malibu, CA, USA",17,4.9,,2,,,250,12.0%,4,10,3,3,house,Yes,2012,Within an hour,90%,"May 18, 2017",house,,,10,,Thousand Oaks
791817,Sweet 2 BdRm cabin w/MOUNTAIN VIEWS adj to 40 acres of wilderness,,,"Topanga, CA, USA",5,4.8,207,199,245,,145,,2,4,2,1,bungalow,Yes,2015,Within 12 hours,100%,"June 7, 2017",bungalow,,,,,Thousand Oaks
426786,Charming Ocean View Malibu Home,,,"Central Malibu, Malibu, CA, USA",10,4.9,605,595,,,,12.0%,7,8,3,2,house,Yes,2009,Within a few days,50%,"May 30, 2017",house,,1700,8,,Thousand Oaks
443983,Stunning Malibu Beachfront Home,34.037135,-118.629888,"Eastern Malibu, Malibu, CA, USA",20,4.9,,1,1,,,15.0%,4,6,2,2,house,Yes,2012,Within 12 hours,90%,"June 5, 2017",house,,3600,6,,Thousand Oaks
250787,10 minutes to Zuma Beach,,,"Western Malibu, Malibu, CA, USA",18,4.6,167,195,,,,12.0%,2,3,Studio,1,studio,Yes,2006,Within 12 hours,100%,"May 30, 2017",studio,1,400,3,cottage,Thousand Oaks
988533,"Amazing Getaway - Luxury, European Designed Condo, Pool, 3 Spas, Tennis Courts",,,"Winnetka, Los Angeles, CA, USA",2,,162,162,,,50,,3,6,2,2,condo,Yes,2013,Within a few hours,100%,"June 7, 2017",condo,3,900,,building,Thousand Oaks
368462,Stunning Beachfront Home on Magnificent West Malibu Cove,34.0410881,-118.90065002,"Western Malibu, Malibu, CA, USA",38,4.9,,900,1,,300,12.0%,2,9,3,3,house,Yes,2011,Within an hour,100%,"June 1, 2017",house,,,9,,Thousand Oaks
255976ha,Beautiful Cottage w/ pool and Jacuzzi right out side your door,34.089418,-118.596276,"Topanga, CA, USA",57,4.7,191,200,,,60,,2,3,1,1,cottage,Yes,2009,Within a few hours,100%,"June 5, 2017",cottage,,800,3,,Thousand Oaks
781973,2BR Guesthouse Located On Beautiful Northridge Estate/Swimming Pool,34.246028,-118.560713,"Northridge, Los Angeles, CA, USA",13,3.8,160,160,,,60,14.0%,,6,2,1,house,Yes,2015,Within a few hours,90%,"June 6, 2017",house,,1000,6,,Thousand Oaks
258216ha,"Panoramic Views. Light, Airy, Private.",34.042815,-118.892099,"Western Malibu, Malibu, CA, USA",30,4.6,575,475,750,,,,3,8,4,3,house,Yes,2009,Within a few days,80%,"June 7, 2017",house,,2800,8,,Thousand Oaks
591594,NEW 2bd Cozy Early California House,34.17217,-118.625706,"Woodland Hills, Los Angeles, CA, USA",11,4.9,147,140,,,60,,3,5,2,1,house,Yes,2014,Within a few hours,100%,"June 6, 2017",house,,,5,,Thousand Oaks
899231,Live The Malibu Dream!!! Gorgeous Ocean Views In A Brand New Top Of The Line Apt,34.0375741,-118.6267433,"Eastern Malibu, Malibu, CA, USA",5,4.4,250,250,,,90,12.0%,,2,1,1,apartment,Yes,2016,Within an hour,80%,"June 5, 2017",apartment,1,800,2,building,Thousand Oaks
483046,Beautiful 2 Bdrm Designer Beach House With A Garden On The Pt. Dume Bluffs,34.0040114,-118.8083157,"Central Malibu, Malibu, CA, USA",11,4.8,775,850,,,150,12.0%,3,5,2,1,bungalow,Yes,2013,Within an hour,100%,"May 30, 2017",bungalow,,1000,5,,Thousand Oaks
3943995ha,"Paraiso Del Mar Malibu - 4 Bedrooms, 3.5 Bath Beachhouse - Great Location!!",34.037676,-118.620257,"Eastern Malibu, Malibu, CA, USA",20,4.3,911,799,999,,,12.0%,3,10,4,3,house,Yes,2015,Within 12 hours,90%,"June 2, 2017",house,,2500,10,,Thousand Oaks
852555,Oceanfront Private 2 Bedroom 2 Bath Beach House on Sandy Off-Highway Malibu Road,34.032328,-118.726506,"Central Malibu, Malibu, CA, USA",6,,750,500,575,,150,12.0%,2,5,2,2,townhome,Yes,2016,Within an hour,100%,"June 7, 2017",townhome,1,1100,,building,Thousand Oaks
907448,"Chef-Owned Encino Duplex – Shop, Sunbathe and See the Hollywood Sights",34.170693,-118.523477,"Encino Village, Los Angeles, CA, USA",0,,206,,,,,,2,4,2,2,condo,Yes,2006,Within an hour,,"June 7, 2017",condo,,,4,,Thousand Oaks
419137,"TOTALLY REMODELED, HEATED POOL, & 5 MINUTE WALK TO ZUMA BEACH",34.033189,-118.841485,"Western Malibu, Malibu, CA, USA",46,,900,900,,,225,12.0%,4,8,4,3,house,Yes,2012,Within an hour,100%,"June 6, 2017",house,,2315,8,,Thousand Oaks
634697,"LUXURY European-pools, spas, tennis",34.2032676,-118.5724937,"Winnetka, Los Angeles, CA, USA",15,4.8,245,259,,,,,3,6,3,2,condo,Yes,2013,Within an hour,100%,"June 7, 2017",condo,3,1300,6,building,Thousand Oaks
896731,Brand New Modern Malibu,34.039195,-118.589381,"Eastern Malibu, Malibu, CA, USA",12,,,3,,,,12.0%,3,8,4,4,house,Yes,2016,Within an hour,100%,"June 5, 2017",house,,2900,8,,Thousand Oaks
3016235ha,Paradise View Guest House,34.024006,-118.795638,"Central Malibu, Malibu, CA, USA",9,,141,,,,,,30,4,1,1,apartment,Yes,2012,Within 2 days,90%,"March 26, 2017",apartment,2,750,4,,Thousand Oaks
3967348ha,Eagles Nest! Formally called honeymoon cottage! Amazing Views!,34.256873,-118.964463,"Camarillo, CA, USA",5,4.6,135,135,,,,,4,4,2,1,cottage,Yes,2015,Within 12 hours,100%,"June 6, 2017",cottage,,,4,,Thousand Oaks
457817,Charming Beachfront Bungalow,34.0329283,-118.7288281,"Central Malibu, Malibu, CA, USA",43,4.8,643,,,,200,12.0%,3,5,2,1,apartment,Yes,2013,Within 12 hours,100%,"June 6, 2017",apartment,2,950,5,,Thousand Oaks
476015,Georgous Spanish Casita 10 Minutes From Beach and very close to Pepperdine.,34.062343,-118.751621,"Malibu, CA, USA",36,4.9,414,400,450,,150,12.0%,4,8,2,2,estate,Yes,2013,Within an hour,100%,"June 6, 2017",estate,,1800,8,,Thousand Oaks
395407ha,"Summer SALE on the sunny, warm sands of Malibu Beach at your doorstep",34.0385077,-118.58576274,"Eastern Malibu, Malibu, CA, USA",42,,,975,,,,12.0%,3,7,3,3,house,Yes,2011,Within 12 hours,100%,"June 6, 2017",house,,1800,7,,Thousand Oaks
422162,'Walls of Glass on the Sand' Malibu oceanfront beach house,34.036865,-118.611713,"Eastern Malibu, Malibu, CA, USA",35,,460,400,,,175,12.0%,6,4,2,1,townhome,Yes,2008,Within 12 hours,80%,"June 6, 2017",townhome,,800,4,,Thousand Oaks
476383,Fabulous Ocean Views at Malibu Dream Getaway,34.042882,-118.886419,"Western Malibu, Malibu, CA, USA",42,4.8,223,195,220,,,12.0%,2,4,1,1,apartment,Yes,2013,Within an hour,100%,"May 27, 2017",apartment,1,500,4,house,Thousand Oaks
3956972ha,Watch dolphins from sofa! Glamorous Malibu Octagon w/Amazing Ocean view,34.038684,-118.647379,"Eastern Malibu, Malibu, CA, USA",19,4.8,571,550,750,,185,12.0%,2,6,3,2,house,Yes,2008,Within a day,100%,"June 4, 2017",house,,,6,,Thousand Oaks
3877721ha,4Bed 3 Bath Home with Pool,,,"Northridge, Los Angeles, CA, USA",7,3.6,259,249,299,,125,9.0%,,16,4,3,house,Yes,2014,Within a few days,60%,"June 6, 2017",house,,3200,16,,Thousand Oaks
639637,Stunning and  Peaceful Malibu Beachfront with Full Views and Beach Access,34.039024,-118.667832,"Eastern Malibu, Malibu, CA, USA",28,4.9,750,750,,,,12.0%,2,5,2,2,condo,Yes,2014,Within an hour,100%,"June 5, 2017",condo,2,,5,,Thousand Oaks
762207,Gated Resort style condominium,34.17190778,-118.59832839,"Warner Center, Los Angeles, CA, USA",0,,190,190,,,,,7,6,2,2,condo,Yes,2015,Within 2 days,100%,"April 29, 2017",condo,1,1100,6,building,Thousand Oaks
898666,6 Bed * Elegant Estate * Pool & Hot-Tub *,34.168728,-118.539219,"Tarzana, Los Angeles, CA, USA",4,,808,800,,,400,,3,12,6,5,house,Yes,2015,Within a few hours,100%,"June 6, 2017",house,,5000,,,Thousand Oaks
741140,Beautiful Calabasas/Malibu Cyn Home Spectacular Views 10 Min To Malibu,34.16407,-118.697891,"Malibu Canyon, Calabasas, CA, USA",9,,357,,,,150,,4,6,3,2,house,Yes,2012,Within a few days,90%,"June 6, 2017",house,,1800,6,,Thousand Oaks
241932,Malibu on the Sand! Walk down the stairs and your in the ocean! On the ocean!,34.05464554,-118.96633911,"Malibu, CA, USA",70,,959,899,1,,325,10.0%,2,8,3,3,house,Yes,2009,Within a few hours,90%,"June 6, 2017",house,,3000,8,,Thousand Oaks
990319,Rare Ocean View Gem by the Beach,34.04125749,-118.5613765,"Pacific Palisades, Los Angeles, CA, USA",6,4.7,642,545,595,,250,14.0%,2,6,3,3,house,No,2017,Within 12 hours,100%,"June 5, 2017",house,,,,,Thousand Oaks
595184,"Beautiful Views, 4 Bedroom South Facing Pool Home",34.147114,-118.548535,"Tarzana, Los Angeles, CA, USA",10,4.5,500,525,,,250,,3,8,4,3,house,Yes,2014,Within 12 hours,100%,"June 4, 2017",house,,2850,,,Thousand Oaks
601981,Malibu Oceanfront 3bd/2ba On The Sand! No public access!,34.0369979,-118.627695,"Eastern Malibu, Malibu, CA, USA",29,4.9,,1,,,250,12.0%,3,6,3,2,house,Yes,2014,Within a day,90%,"June 6, 2017",house,,1200,,,Thousand Oaks
13036,Oceanfront one bedroom.  Perfect Getaway.,34.02698517,-118.75543976,"Central Malibu, Malibu, CA, USA",16,,250,250,,,100,12.0%,7,2,1,1,house,Yes,2002,Within 12 hours,80%,"May 16, 2017",house,,,2,,Thousand Oaks
722650,Best LA Vacation Home,34.283161,-118.556433,"Porter Ranch, Los Angeles, CA, USA",9,4.6,343,359,369,,220,14.0%,4,8,4,3,house,Yes,2015,Within an hour,100%,"June 6, 2017",house,,2400,8,,Thousand Oaks
742842,Sophisticated elegance! Views! Top floor Condo! Close to University & Beaches,34.244191,-119.024741,"Camarillo, CA, USA",7,,125,125,,,100,,14,3,1,1,condo,Yes,2015,Within 12 hours,100%,"May 26, 2017",condo,3,,,building,Thousand Oaks
878926,Gated Luxury Resort Living,34.1702282,-118.5992154,"Warner Center, Los Angeles, CA, USA",1,,195,195,,,150,,7,6,2,2,condo,Yes,2016,Within a day,100%,"May 17, 2017",condo,1,1100,6,building,Thousand Oaks
966091ha,Soak up the sunshine in your private pool side garden or jacuzzi under stars...,34.164563,-118.6077,"Woodland Hills, Los Angeles, CA, USA",24,4.8,531,475,,,,2.5%,3,8,3,2,house,Yes,2012,Within 12 hours,100%,"June 3, 2017",house,,2100,8,,Thousand Oaks
407852,Ocean Front Condo in Downtown Malibu on Billionaire's Beach,34.03902435,-118.66783142,"Eastern Malibu, Malibu, CA, USA",6,4.7,464,,,,,12.0%,7,6,2,2,condo,Yes,2012,Within 12 hours,90%,"May 23, 2017",condo,,,6,,Thousand Oaks
105828,Luxurious 4 Bedroom House on Private Beach,34.03791046,-118.62312317,"Eastern Malibu, Malibu, CA, USA",7,4.9,850,850,,,,12.0%,2,10,4,3,house,Yes,2006,Within 2 days,80%,"June 6, 2017",house,,2600,10,,Thousand Oaks
198220,'Walls of Glass' Malibu Oceanfront Beach House,34.036865,-118.611713,"Eastern Malibu, Malibu, CA, USA",127,,430,,,,175,12.0%,6,4,2,1,house,Yes,2008,Within 12 hours,100%,"April 15, 2017",house,,,4,,Thousand Oaks
462256,Sweeping Ocean Views from Malibu Home w/Privacy! Close to Beach! Super Reviews,34.043491,-118.740324,"Malibu, CA, USA",49,4.9,500,500,,,175,,2,6,3,2,house,Yes,2013,Within 12 hours,100%,"June 6, 2017",house,,1600,6,,Thousand Oaks
599151,CASA de los Conquistadores Truly your Home away from Home,34.17217,-118.625706,"Woodland Hills, Los Angeles, CA, USA",26,4.5,172,150,,,60,,3,6,3,2,house,Yes,2014,Within an hour,100%,"June 3, 2017",house,,2200,6,,Thousand Oaks
972879,Malibu Modern Pool House,,,"Malibu, CA, USA",66,,279,200,,,150,,1,2,1,1,house,Yes,2016,Within 12 hours,100%,"June 6, 2017",house,,800,2,,Thousand Oaks
3975449ha,"Beautiful 2 Bedroom Condo, Family Friendly, 15min drive to Universal Studios",34.17551715,-118.53022276,"Tarzana, Los Angeles, CA, USA",7,4.6,86,,100,,80,,12,6,2,1,condo,Yes,2015,Within a few hours,100%,"May 18, 2017",condo,2,855,6,building,Thousand Oaks
599800,Oceanfront Suite on Carbon Beach in Central Malibu,34.03895585,-118.67203581,"Eastern Malibu, Malibu, CA, USA",28,4.9,500,375,450,,150,12.0%,2,4,1,1,apartment,Yes,2013,Within a day,100%,"May 14, 2017",apartment,2,,4,building,Thousand Oaks
425649,A Cozy Get-away For Two In Topanga Canyon. We are Pet Friendly.,34.074058,-118.601863,"Fernwood, Topanga, CA, USA",37,4.9,125,125,135,,,,3,3,1,1,studio,Yes,2012,Within a few days,80%,"April 7, 2017",studio,,425,3,building,Thousand Oaks
697684,Oceanfront Bungalow on Carbon Beach in Central Malibu,34.03792821,-118.67381779,"Eastern Malibu, Malibu, CA, USA",14,4.9,509,375,450,,150,12.0%,2,4,1,1,bungalow,Yes,2013,Within 12 hours,90%,"May 26, 2017",bungalow,,,4,,Thousand Oaks
813322,Shabby Chic Malibu Beach House - Ocean Level *Winter Specials*,34.037211,-118.63175,"Eastern Malibu, Malibu, CA, USA",9,,,958,,,,,2,7,2,2,bungalow,Yes,2016,Within a few hours,80%,"May 30, 2017",bungalow,,1100,7,,Thousand Oaks
755564,Magical Cottage across from the beach. Perfect for a romantic getaway/solo trip,34.017685,-118.817031,"Western Malibu, Malibu, CA, USA",25,,254,225,250,,75,12.0%,2,2,1,1,cottage,Yes,2015,Within a few hours,100%,"June 5, 2017",cottage,,500,2,,Thousand Oaks
4047141ha,2+2+A/C+Enclosed Garage Upper Unit -Stairs,34.28128816,-118.7291968,"Simi Valley, CA, USA",3,4.3,100,102,,,,,2,6,2,2,condo,No,2015,Within a few hours,100%,"March 11, 2017",condo,,,6,,Thousand Oaks
4247680ha,Malibu Beach Bungalow On A Private Beach,34.037199,-118.631912,"Eastern Malibu, Malibu, CA, USA",10,4.5,550,550,,,,12.0%,3,4,2,1,bungalow,Yes,2016,Within 2 days,90%,"May 30, 2017",bungalow,,,4,,Thousand Oaks
567862,"Malibu Spectacular Oceanfront, 360 Views, 4 Decks, easy walking distance to town",,,"Eastern Malibu, Malibu, CA, USA",31,4.9,,,,,500,12.0%,1,9,3,4,house,Yes,2014,Within a few hours,100%,"June 1, 2017",house,,2900,,,Thousand Oaks
4446521ha,Beautiful Remodeled Home,,,"West Hills, Los Angeles, CA, USA",7,4.6,214,214,,,100,7.5%,2,8,3,2,house,Yes,2017,Within a few hours,100%,"June 6, 2017",house,,1358,8,,Thousand Oaks
617882,Newly listed Medeterainian Cozy 2Bd Cottage House,34.171197,-118.632613,"Woodland Hills, Los Angeles, CA, USA",17,4.6,148,135,,,60,,3,5,2,1,house,Yes,2014,Within 12 hours,80%,"May 23, 2017",house,,900,,,Thousand Oaks
