listing_id,listing_title,latitude,longitude,location_name,number_reviews,average_rating,average_nightly_price,nightly,weekend_night,property_protection_fee,cleaning_fee,tax_rate,min_stay,sleeps,bedrooms,bathrooms,property_type,internet,member_since,response_time,response_rate,calendar_last_updated,type,floor,sq_footage,max_occupancy,building_type,city,state
1050610,Inner NE Charm and Convenience,,,"Lloyd District, Portland, OR, USA",1,,226,150,,,100,11.5%,,5,2,1,condo,Yes,2017,Within 2 days,100%,"June 9, 2017",condo,2,,,,Concord,SC
1059032,Solar Powered 1912 Vintage Portland Home,45.5479514,-122.6194858,"Beaumont - Wilshire, Portland, OR, USA",0,,175,175,,,,,7,8,4,3,house,No,2017,,,"May 24, 2017",house,,,,,Concord,SC
744315,Oasis in the Heart of Wine Country Yet 20 Minutes from Portland,45.309796,-122.906311,"Newberg, OR, USA",2,,950,1,,,,8.0%,2,14,4,3,house,Yes,2015,Within 2 days,80%,"June 4, 2017",house,,3000,14,,Concord,SC
954132,"Charming and bright tiny house near shopping, restaurants, and more!",45.55476,-122.664366,"King, Portland, OR, USA",9,4.4,174,,,,,,2,4,1,1,house,Yes,2001,Within an hour,,"June 9, 2017",house,,,4,,Concord,SC
1023645,Cozy Forest Retreat near Downtown,45.458585,-122.734179,"Portland, OR, USA",1,,85,85,,,50,,1,4,1,1,apartment,Yes,2017,Within an hour,100%,"May 31, 2017",apartment,,800,4,house,Concord,SC
1042593,Private Cottage in the Woods Minutes from Downtown Portland,,,"West Haven-Sylvan, Portland, OR, USA",1,,125,125,,,25,11.5%,,5,2,1,cottage,Yes,2017,Within 12 hours,100%,"June 9, 2017",cottage,,,5,,Concord,SC
432273,New Pet Friendly Apartment Steps From NW 23rd and Street Car,45.5277576,-122.700367,"Nob Hill, Portland, OR, USA",34,4.2,121,125,135,,,,,3,1,1,apartment,Yes,2012,Within an hour,100%,"June 5, 2017",apartment,,,3,,Concord,SC
757291,A Tiny House on a lavender farm In Oregon's Wine Country,45.3914007,-122.9494807,"Hillsboro, OR, USA",3,,113,125,,,20,10.0%,2,2,1,1,cottage,Yes,2015,Within a few hours,100%,"June 3, 2017",cottage,,198,2,,Concord,SC
750923,Relocation temporary home; vacation; naturalist's retreat Portland metro area,45.689574,-122.856245,"Portland, OR, USA",3,,350,300,,,250,13.3%,2,8,4,2,house,Yes,2016,Within an hour,100%,"June 9, 2017",house,,2000,,,Concord,SC
883647,Two spacious downtown condos w/ gorgeous views - dogs okay!,45.519421,-122.68133,"Downtown, Portland, OR, USA",9,4.4,531,,,,,,1,10,3,3,condo,Yes,2001,Within an hour,,"June 9, 2017",condo,,,10,,Concord,SC
923867,Laurelhurst Living In Grandeur Neighbourhood,,,"Laurelhurst, Portland, OR, USA",3,2.3,233,,,,150,,30,11,4,2,house,No,2016,Within 2 days,90%,"May 6, 2017",house,,,,,Concord,SC
958144,2 BR apartment blocks from Alberta St,,,"Concordia, Portland, OR, USA",2,4.5,125,125,,,50,13.3%,2,5,2,1,apartment,No,2016,Within a day,100%,"June 8, 2017",apartment,,,,house,Concord,SC
4358711ha,Fabulous Apartment in Alphabet District!,,,"Nob Hill Alphabet District, Portland, OR, USA",0,,200,200,,,8,,2,3,1,1,apartment,No,2016,Within a day,80%,"June 8, 2017",apartment,,,,,Concord,SC
3808070ha,PDX Eco Cottage Guesthouse,45.5068159,-122.6500855,"Ladd's Addition, Portland, OR, USA",17,4.9,168,165,175,,,13.3%,2,3,1,1,house,Yes,2014,Within an hour,100%,"June 8, 2017",house,,450,3,,Concord,SC
830894,Modern downtown Portland condo with sweeping city views - dogs OK!,45.5194205,-122.6813299,"Downtown, Portland, OR, USA",28,4.6,249,,,,,,1,4,1,1,apartment,Yes,2001,Within an hour,,"June 9, 2017",apartment,,,4,,Concord,SC
881707,"Hip, dog-friendly elegance in the heart of downtown Portland!",45.519421,-122.68133,"Downtown, Portland, OR, USA",34,4.6,323,,,,,,1,6,2,2,condo,Yes,2001,Within an hour,,"June 9, 2017",condo,,,6,,Concord,SC
410696,Charming Woodstock 4 Bedroom Home in SE Portland,45.48218918,-122.61511993,"Woodstock, Portland, OR, USA",39,,100,,,,,,28,8,4,1,house,Yes,2012,Within 12 hours,100%,"June 7, 2017",house,,1230,8,,Concord,SC
4101960ha,"Beautifully Decorated 1907 Victorian Farmhouse. Close To downtown Adidas, UOP.",45.566956,-122.69831,"Arbor Lodge (Portland, OR, USA)",13,4.8,207,135,145,,75,12.5%,1,5,2,1,house,Yes,2015,Within an hour,100%,"June 9, 2017",house,,1700,5,,Concord,SC
889977,Hip & modern downtown elegance w/ spectacular views of the city - dogs okay!,45.519421,-122.68133,"Downtown, Portland, OR, USA",17,4.6,268,,,,,,1,4,1,1,condo,Yes,2001,Within an hour,,"June 9, 2017",condo,,,4,,Concord,SC
4254240ha,Two Artist's Modern & Serene Home,45.55657888,-122.6573059,"King, Portland, OR, USA",1,,145,145,,,100,11.5%,3,2,Studio,1,house,Yes,2016,Within a day,90%,"May 23, 2017",house,,,2,,Concord,SC
910755,Cottage in Historic Irvington neighborhood near Convention Center and shops!,45.538444,-122.655225,"Irvington, Portland, OR, USA",3,,130,130,,,,11.5%,2,4,1,1,cottage,Yes,2016,Within 2 days,100%,"June 8, 2017",cottage,,535,4,,Concord,SC
4197263ha,Christmas special: Celebrate Christmas in an old Portland home,45.497833,-122.691619,"Homestead, Portland, OR, USA",2,,204,199,215,,80,13.3%,3,5,3,2,house,Yes,2016,Within a few hours,100%,"January 28, 2017",house,,2018,5,,Concord,SC
830895,Dog-friendly studio w/ skyline views near Pioneer Square!,45.5194205,-122.6813299,"Downtown, Portland, OR, USA",44,4.3,218,,,,,,1,2,1,1,studio,Yes,2001,Within an hour,,"June 9, 2017",studio,,,2,,Concord,SC
832936,Sunny and Comfy Tabor 2 Bedrooms - Over 1100 Sq Ft,45.523725,-122.603615,"North Tabor, Portland, OR, USA",1,,235,175,200,,60,13.3%,4,5,2,1,house,Yes,2016,Within an hour,100%,"June 9, 2017",house,,1100,5,,Concord,SC
4258385ha,Gateway To The Gorge-private-perfect Location. Family & Business Friendly.,45.604399,-122.435933,"Camas, WA, USA",1,,75,75,99,,35,8.0%,,5,1,1,house,Yes,2016,Within a few hours,100%,"February 26, 2017",house,,1400,5,,Concord,SC
620931,AC—The Italian Manor——The VILLA——,,,"North Tabor, Portland, OR, USA",7,3.7,149,129,139,,19,11.5%,4,3,Studio,1,villa,Yes,2014,Within an hour,100%,"May 4, 2017",villa,,,3,,Concord,SC
843293,Comfy & stylish large studio apt,45.5230676,-122.635155,"Kerns, Portland, OR, USA",4,4.8,108,105,125,,50,10.5%,,3,1,1,studio,Yes,2016,Within an hour,100%,"March 23, 2017",studio,1,400,3,house,Concord,SC
886887,Classy & Hip 3BR - NE Portland - Near PDX Airport!,45.5347327,-122.5737973,"Montavilla, Portland, OR, USA",4,,327,139,149,,70,11.5%,2,7,3,1,house,Yes,2016,Within an hour,100%,"April 15, 2017",house,,1000,7,,Concord,SC
913391,The Tuscan Chateau —— The VILLA ——,45.522855,-122.5951,"North Tabor, Portland, OR, USA",0,,133,109,119,,19,11.5%,3,2,Studio,1,villa,Yes,2014,Within an hour,100%,"March 3, 2017",villa,,,2,,Concord,SC
961040,Great home in fantastic location!,,,"Beaumont - Wilshire, Portland, OR, USA",1,,215,215,,,75,13.3%,2,5,2,2,house,Yes,2016,Within 12 hours,100%,"April 29, 2017",house,,2000,5,,Concord,SC
4358385ha,Country Paradise in the City!,,,"Washougal, WA, USA",0,,389,375,,,125,8.9%,3,12,3,2,house,No,2017,Within a few hours,87%,"June 9, 2017",house,,3800,,,Concord,SC
4318472ha,Lovely 2BR Portland House - Close to Downtown!,45.51605,-122.62462,"Sunnyside, Portland, OR, USA",7,4.6,,,,,,,2,4,2,1,house,Yes,1999,Within an hour,,"June 9, 2017",house,,2000,4,,Concord,SC
4328434ha,"Excellent Orenco Location! Near Intel, Nike.",,,"Hillsboro, OR, USA",3,,199,199,,,150,,2,10,4,2,townhome,Yes,2016,Within 12 hours,90%,"May 21, 2017",townhome,,1725,10,,Concord,SC
993850,Open floor plan and outdoor living  in beautiful neighborhood 15 min to downtown,,,"West Hills, Portland, OR, USA",0,,450,350,,,250,10.8%,1,8,4,2,house,Yes,2017,Within a few hours,100%,"June 8, 2017",house,,2800,,,Concord,SC
474108,"Charming Vintage Guest House! Central, Near Arts Districts",45.576088,-122.672461,"Piedmont, Portland, OR, USA",7,4.6,125,125,,,80,11.5%,2,7,3,1,house,Yes,2013,,,"February 21, 2017",house,,1500,7,,Concord,SC
483407,NW 23rd/Nob Hill Boutique,45.5249425,-122.699627,"Nob Hill, Portland, OR, USA",35,4.6,120,95,,,60,13.5%,1,4,1,1,apartment,Yes,2009,Within a few days,70%,"June 8, 2017",apartment,1,750,4,,Concord,SC
692576,The Roman Room ——— The VILLA ———,45.52270086,-122.59428759,"North Tabor, Portland, OR, USA",2,,164,129,139,,19,11.5%,4,3,Studio,1,villa,Yes,2014,Within a few hours,90%,"June 6, 2017",villa,,,3,,Concord,SC
754510,Pretty SW Garden Apartment With Hot tub,45.482355,-122.719699,"Hayhurst, Portland, OR, USA",6,4.8,67,,,,,12.5%,31,4,1,1,apartment,Yes,2012,Within 12 hours,100%,"June 8, 2017",apartment,2,1000,4,house,Concord,SC
4306810ha,PDX Urban Barn Guesthouse near culinary rich Division St.,45.502673,-122.6449426,"Hosford - Abernethy, Portland, OR, USA",5,,205,200,220,,,13.3%,2,4,2,1,house,Yes,2014,Within an hour,100%,"June 4, 2017",house,,,,,Concord,SC
975580,"2+ bedroom, 2.5 bath, 2,536 sq ft home  close to downtown in quiet neighborhood",45.490107,-122.705555,"Hillsdale, Portland, OR, USA",1,,114,,,,,13.3%,7,6,2,2,house,Yes,2016,Within a few days,100%,"May 2, 2017",house,,2536,6,,Concord,SC
989314,Private Mid Century Modern Retreat | Glass House,45.53548,-122.802461,"Cedar Mill, Portland, OR, USA",0,,300,325,,,100,9.0%,2,6,3,2,house,Yes,2016,Within 12 hours,100%,"June 8, 2017",house,,,,,Concord,SC
984492,1 BD / 1 BTH URBAN LOFT  - ORENCO STATION,45.5345953,-122.9162504,"Orenco Station, Hillsboro, OR, USA",0,,198,198,,,,11.5%,7,4,1,1,apartment,No,2017,Within a few days,87%,"May 26, 2017",apartment,,,,,Concord,SC
798609,A Classic Bungalow in the Heart of SE Portland,45.505026,-122.636096,"Hawthorne, Portland, OR, USA",3,,186,215,255,,125,,3,6,3,1,bungalow,Yes,2015,Within a few days,70%,"February 26, 2017",bungalow,,1700,6,,Concord,SC
808384,"Portland home in SE Portland, City explorers,Travelers, Corporate Rent",45.48685186,-122.57656803,"Powellhurst - Gilbert, Portland, OR, USA",4,3.8,112,95,,,125,,5,5,2,1,bungalow,Yes,2014,Within a day,100%,"June 9, 2017",bungalow,,1200,5,,Concord,SC
845600,6 BDRM  IMMACULATE PRIVATE SECLUDED HOME IN HEART OF CITY,45.446283,-122.720806,"West Portland Park, Portland, OR, USA",5,4.6,414,300,350,,250,3.0%,10,14,6,3,house,Yes,2016,Within an hour,100%,"June 9, 2017",house,,3600,14,,Concord,SC
904899,"Wake up in the best location in town, with cafes, restaurants, galleries nearby!",45.5244179,-122.6986804,"Nob Hill Alphabet District, Portland, OR, USA",2,,344,350,,,160,13.0%,2,8,3,1,apartment,Yes,2016,Within a few hours,100%,"June 9, 2017",apartment,2,1800,8,building,Concord,SC
1026036,Beautiful and Quiet Downtown/Nob Hill Condo,,,"Goose Hollow, Portland, OR, USA",1,,320,320,,,90,,2,6,3,1,condo,No,2017,Within a day,100%,"June 6, 2017",condo,,,,,Concord,SC
1041731,"Deb's Paradise, is a home away from home! Clean quiet place of comfort.",,,"Humboldt, Portland, OR, USA",4,,95,65,,,25,,3,3,1,1,apartment,Yes,2017,Within 12 hours,100%,"June 8, 2017",apartment,1,200,,building,Concord,SC
1071812,"Forest Hideaway Close To Airport, Downtown",45.373902,-122.632757,"Rosemont Summit, West Linn, OR, USA",4,,184,185,,,25,7.8%,2,5,2,1,apartment,Yes,2017,Within an hour,100%,"June 8, 2017",apartment,2,1200,,house,Concord,SC
783956,Brand New 1000 Sq Ft. Apartment In Centrally Located Area Of Portland,45.5397419,-122.622656,"Hollywood, Portland, OR, USA",1,,100,100,,,20,13.3%,,2,1,1,apartment,Yes,2016,Within a few hours,100%,"June 6, 2017",apartment,1,1000,2,house,Concord,SC
935752,Cozy house near popular hiking trails,45.5407282,-122.780722,"Northwest Heights, Portland, OR, USA",0,,202,199,209,,90,,3,6,3,3,house,No,2016,Within 12 hours,100%,"April 22, 2017",house,,,,,Concord,SC
4509847ha,New Modern Guest Suite,,,"Overlook, Portland, OR, USA",0,,67,80,100,,50,11.5%,,2,1,1,guest house,No,2017,Within a few hours,100%,"May 27, 2017",guest house,,,,,Concord,SC
870419,Six downtown Portland condos w/ sweeping views - dogs okay!,45.519391,-122.680999,"Downtown, Portland, OR, USA",0,,,,,,,,2,18,7,7,condo,Yes,2001,Within an hour,,"June 9, 2017",condo,,,18,,Concord,SC
369027,"3 Miles to Downtown Portland, Hot Tub, Kid Friendly, Pets Ok!",45.48786926,-122.70914459,"Hillsdale, Portland, OR, USA",39,,411,285,305,,200,11.5%,2,7,2,2,house,Yes,2010,,,"June 7, 2017",house,,2000,,,Concord,SC
798407,Heart of Alberta Arts District,45.560366,-122.654782,"Vernon, Portland, OR, USA",1,,139,139,,,60,10.0%,1,6,2,1,house,No,2017,Within a few hours,90%,"June 1, 2017",house,,,,,Concord,SC
187460,Enjoy Life to the Fullest at Bridgeview .,45.6005842,-122.5521166,"Old Evergreen Highway, Vancouver, WA, USA",6,4.8,258,280,,,,,2,6,3,2,house,Yes,2008,,0%,"June 3, 2017",house,,,6,,Concord,SC
831183,Chic studio-style condo downtown w/ city views - dogs OK!,45.5194205,-122.6813299,"Downtown, Portland, OR, USA",43,4.7,224,,,,,,1,2,1,1,studio,Yes,2001,Within an hour,,"June 9, 2017",studio,,,2,,Concord,SC
887742,Gorgeous EcoLuxury Portland Oasis,45.5151429,-122.6135347,"Sunnyside, Portland, OR, USA",1,,667,600,700,,,14.0%,,10,5,2,house,Yes,2012,,,"June 9, 2017",house,,3000,10,,Concord,SC
930165,Cozy Laurelhurst awaits you~,,,"Laurelhurst, Portland, OR, USA",0,,129,140,,,80,,6,3,1,1,house,No,2016,Within a day,90%,"May 19, 2017",house,,,,,Concord,SC
4314987ha,"Creekside Cottage in Lake Oswego. 1930's charm, today's amenities. Wi-fi, cable.",,,"Lake Forest, Lake Oswego, OR, USA",1,,85,89,,,150,,5,2,1,1,cottage,No,2016,Within a day,100%,"February 9, 2017",cottage,,,,,Concord,SC
1007553,Oswego Lakeview Loft!,45.4029341,-122.7141672,"Blue Heron, Lake Oswego, OR, USA",2,,150,140,,,79,6.0%,4,2,1,1,apartment,Yes,2017,Within 12 hours,100%,"June 9, 2017",apartment,2,650,2,building,Concord,SC
171890,Urban Oasis on NW Lovejoy - Come and Stay,45.53022883,-122.69010014,"Slabtown, Portland, OR, USA",14,4.9,0,,,,100,,30,3,Studio,1,condo,Yes,2008,Within an hour,90%,"December 15, 2016",condo,5,,3,building,Concord,SC
620677,Camp Heaven All The Fun Of Camping Without All The Work!,45.38601391,-122.91655663,"Sherwood, OR, USA",1,,117,149,,,,,,2,1,1,cabin,Yes,2014,Within a few hours,100%,"June 7, 2017",cabin,,,2,,Concord,SC
3888734ha,"5 Acre Country Estate 4 Bdrms Beautiful Views,  Surrounded by Vineyards & Horses",,,"Far West, Sherwood, OR, USA",4,,490,390,,,,7.0%,4,10,4,3,house,Yes,2010,Within an hour,100%,"June 3, 2017",house,,3000,10,,Concord,SC
824384,"Rocky Butte // 1964 A-Frame House// Northeast Portland, OR",45.539541,-122.56558,"Northeast Portland, Portland, OR, USA",1,,225,225,275,,,12.5%,2,4,2,2,house,Yes,2016,Within an hour,100%,"June 8, 2017",house,,,4,,Concord,SC
911576,Portland Oregon SW Hills Garden Carriage House Retreat,,,"Collins View, Portland, OR, USA",4,4.8,78,70,75,,30,3.0%,2,2,1,1,cottage,Yes,2016,Within an hour,100%,"May 30, 2017",cottage,,450,2,,Concord,SC
4473661ha,Quintessential Portland Apartment on Hawthorne,,,"Sunnyside, Portland, OR, USA",0,,195,179,195,,65,11.5%,,5,3,1,apartment,Yes,2017,Within a few days,100%,"June 8, 2017",apartment,,,5,building,Concord,SC
1020890,Scandinavian Bed & Breakfast In Portland,,,"Bull Mountain, Tigard, OR, USA",0,,95,95,,,10,,2,2,1,1,bed & breakfast,No,2017,Within a day,100%,"June 8, 2017",bed & breakfast,,,,,Concord,SC
1044451,The Nehalem House w/high-speed fiber-optic wifi+Roku! All utilities paid!,45.4658831,-122.6168929,"Woodstock, Portland, OR, USA",0,,219,219,,,250,,7,4,2,1,bungalow,Yes,2017,Within a few hours,100%,"June 3, 2017",bungalow,,736,,,Concord,SC
747150,"Cozy Charming Cottage in Quiet Neighborhood, 15 Minutes to Downtown, 5 to MAX",45.454724,-122.616165,"Southeast Portland, Portland, OR, USA",33,4.9,47,,,,0,,30,4,1,1,cottage,No,2015,Within a few hours,100%,"June 6, 2017",cottage,,450,,,Concord,SC
968569,Beautiful 3+ bed luxury custom home w/all ammenities,45.538526,-122.603922,"Rose City Park, Portland, OR, USA",1,,137,,,,105,,30,2,3,2,house,Yes,2016,Within a few days,70%,"May 3, 2017",house,,1850,2,building,Concord,SC
922322,Located in the Heart of Dunthorpe.,45.441669,-122.649897,"Island Station, Milwaukie, OR, USA",0,,339,325,375,,255,13.3%,4,5,3,3,house,Yes,2013,Within a few hours,90%,"June 7, 2017",house,,3373,5,,Concord,SC
996342,Warm And Spacious In Great Location! 2bd,,,"Richmond, Portland, OR, USA",0,,150,145,,,65,11.5%,2,6,2,1,house,Yes,2015,Within a day,100%,"June 5, 2017",house,,1150,6,,Concord,SC
1006057,Great location Vintage One bedroom,,,"Hosford - Abernethy, Portland, OR, USA",1,,135,135,,,10,,,3,1,1,apartment,Yes,2017,Within 12 hours,100%,"June 7, 2017",apartment,1,600,3,building,Concord,SC
1010042,Skyberry Farm Studio- with all funds supporting our food donation program,,,"Portland, OR, USA",1,,120,90,,,25,,,4,1,1,farmhouse,Yes,2017,Within 12 hours,100%,"June 9, 2017",farmhouse,,500,4,,Concord,SC
1031335,The Tiny Home! Close to Downtown Portland,,,"Multnomah Village (Portland, OR, USA)",1,,106,75,,,50,11.5%,2,3,Studio,1,guest house,Yes,2015,Within 12 hours,100%,"June 2, 2017",guest house,,150,3,,Concord,SC
4496632ha,Located in the heart of a thriving art community,,,"Concordia, Portland, OR, USA",0,,225,250,,,75,11.5%,2,5,2,1,bungalow,Yes,2017,,,"June 9, 2017",bungalow,,800,,,Concord,SC
1090176,Fabulous Modern Portland Craftsman,,,"Arnold Creek, Portland, OR, USA",0,,350,350,,,150,,3,8,4,2,house,No,2017,,,"June 8, 2017",house,,,,,Concord,SC
899006,"Gorgeous, dog-friendly downtown Portland condo w/ city views!",45.519421,-122.68133,"Downtown, Portland, OR, USA",15,4.4,259,,,,,,1,4,1,1,condo,Yes,2001,Within an hour,,"June 9, 2017",condo,,,4,,Concord,SC
943498,Charming Home in NE Portland,,,"King, Portland, OR, USA",3,4.7,145,175,,,60,13.3%,,8,3,1,house,Yes,2016,Within an hour,100%,"May 31, 2017",house,,,8,,Concord,SC
955494,Currently Unavailable,,,"Grant Park (Portland, OR, USA)",0,,,99,,,95,11.5%,180,5,3,1,house,No,2015,Within a few hours,100%,"April 7, 2017",house,,,,,Concord,SC
987358,Mid Century Rustic-Portland West Hills,45.5068997,-122.7442981,"West Hills, Portland, OR, USA",0,,143,125,,,,,,6,2,1,house,Yes,2016,Within an hour,100%,"June 8, 2017",house,,925,6,,Concord,SC
4442795ha,Rose City Getaway - walk or bike to Portland's  The Moda Center!,,,"Eliot, Portland, OR, USA",9,4.9,149,135,185,,85,13.3%,2,5,2,1,house,Yes,2016,Within an hour,100%,"June 9, 2017",house,,1256,5,,Concord,SC
4467909ha,Our Cozy Cabin Is Your Hotel Alternative In This Amazing Portland Neighborhood.,,,"Concordia, Portland, OR, USA",0,,115,115,,,60,11.0%,2,2,1,1,guest house,No,2017,Within a few days,60%,"June 4, 2017",guest house,,,,,Concord,SC
1034346,Most Family Friendly Listing in Portland - Keep the Conveniences of Home!,,,"West Slope, OR, USA",0,,190,190,,,50,4.0%,,12,3,2,house,Yes,2017,Within a few hours,100%,"April 28, 2017",house,,2200,12,,Concord,SC
1074678,Alberta Arts Pied a Terre,,,"King, Portland, OR, USA",0,,103,95,125,,49,11.5%,2,4,1,1,apartment,Yes,2017,Within a few hours,87%,"June 3, 2017",apartment,1,550,,house,Concord,SC
4571970ha,Deluxe Modern Guest Suite Close to Downtown,45.5568527,-122.6826089,"Overlook, Portland, OR, USA",0,,76,76,,,50,13.3%,3,2,1,1,studio,No,2017,,,"June 9, 2017",studio,,,,,Concord,SC
960765,Garden Apartment with all amenities in lovely treed cul de sac,45.40163705,-122.60514737,"Oatfield, OR, USA",0,,100,85,,,,,2,4,1,1,apartment,Yes,2016,Within 12 hours,100%,"May 14, 2017",apartment,1,750,4,house,Concord,SC
4372278ha,1BR Portland Townhome - Close to Downtown!,45.49789,-122.5885,"South Tabor, Portland, OR, USA",7,4.6,117,,,,,,2,2,1,1,townhome,Yes,1999,Within an hour,,"June 9, 2017",townhome,,1000,2,,Concord,SC
4363594ha,Amazing Marshall Street Apartment,45.5304207,-122.683922,"Pearl District, Portland, OR, USA",0,,267,,,,,,1,5,2,2,apartment,No,2011,Within an hour,,"June 9, 2017",apartment,,1000,5,,Concord,SC
4528672ha,Two-Bedroom Guesthouse in Inner-SE Portland,,,"Hawthorne, Portland, OR, USA",0,,197,165,,,50,11.5%,2,4,2,1,guest house,Yes,2017,,,"May 21, 2017",guest house,,,,,Concord,SC
1065753,Ridgefield--10 Minutes from I-5/ I-205 Access!  New ilani Casino Nearby..,,,"Ridgefield, WA, USA",0,,81,90,,,60,,2,2,1,1,apartment,Yes,2017,,,"June 7, 2017",apartment,2,769,,house,Concord,SC
1069706,Relaxing Portland Retreat,,,"Metzger, Metzger, OR, USA",0,,120,120,,,30,10.8%,2,4,1,1,cottage,Yes,2017,Within an hour,100%,"June 9, 2017",cottage,,500,,,Concord,SC
1076317,"Big Living, Small House; A Modern Dwelling Experience",45.500972,-122.6107089,"Richmond, Portland, OR, USA",0,,150,150,,,60,11.0%,2,4,1,1,house,Yes,2017,,,"June 7, 2017",house,,610,,,Concord,SC
1070147,"Excellent SE location! Laurelhurst Park- 3 bedrooms, sleeps 6, family friendly.",,,"Laurelhurst, Portland, OR, USA",0,,300,300,,,125,,3,6,3,1,house,No,2017,,,"June 4, 2017",house,,,,,Concord,SC
880122,Sunny 2BR Mt. Tabor Home With Amazing Mt. Hood View!  (One night stays only),45.5120635,-122.5888199,"Mount Tabor, Portland, OR, USA",1,,422,400,450,,10,11.5%,,2,2,1,house,Yes,2016,Within 12 hours,100%,"April 28, 2017",house,,1500,,,Concord,SC
1021868,Lovely Studio/Guesthouse in Lake Oswego,45.4291227,-122.6550281,"Lake Oswego, OR, USA",1,,128,120,,,40,6.0%,2,3,Studio,1,guest house,Yes,2017,Within a day,100%,"June 4, 2017",guest house,,620,3,,Concord,SC
1050696,Cooper Spur Suite: Inner East Portland Charm,45.5348967,-122.6571987,"Lloyd District, Portland, OR, USA",1,,221,150,,,100,11.5%,,5,2,1,condo,Yes,2017,Within 2 days,100%,"June 9, 2017",condo,2,1600,,building,Concord,SC
971230,"""Best in Portland'! Exclusive Five Star Residence in the Pearl w/Rooftop Deck",45.527744,-122.682534,"Pearl District, Portland, OR, USA",0,,562,,,,,,2,6,2,2,townhome,Yes,2008,Within an hour,,"June 9, 2017",townhome,,2698,6,,Concord,SC
1083165,"First Addition Lake Oswego Quiet Cross Street 3bd 2,800 Sq Ft Built 2012",45.425692,-122.672064,"First Addition, Lake Oswego, OR, USA",0,,429,400,,,150,8.0%,1,8,3,3,house,No,2015,,,"June 9, 2017",house,,2800,,,Concord,SC
1087365,Enchanting poolside retreat nestled near the shores of Oswego Lake,,,"Country Club - North Shore, Lake Oswego, OR, USA",0,,135,135,,,35,13.8%,2,2,1,1,bed & breakfast,Yes,2017,,,"June 7, 2017",bed & breakfast,,,,,Concord,SC
771038,Solar Powered Piedmont Backyard Cottage,,,"Piedmont, Portland, OR, USA",0,,92,99,109,,,13.5%,2,4,1,1,cottage,Yes,2015,Within a few hours,100%,"May 6, 2017",cottage,,440,4,,Concord,SC
860308,Lovely contemporary home with scenic backyard & patio - convenient location!,45.602629,-122.529654,"Old Evergreen Highway, Vancouver, WA, USA",13,4.2,267,,,,,,2,8,4,2,house,Yes,2001,Within an hour,,"June 9, 2017",house,,,8,,Concord,SC
4372977ha,Great Apt in Downtown!,,,"Homestead, Portland, OR, USA",1,,117,117,,,5,,,3,1,1,apartment,No,2016,,,"June 8, 2017",apartment,,,,,Concord,SC
4458394ha,Charming Private Apt! Safe and quiet Neighborhood!  Newly Remodelled!,45.703843,-122.681231,"Starcrest, Vancouver, WA, USA",0,,90,90,,,25,7.8%,,4,1,1,apartment,No,2017,Within a few hours,100%,"May 24, 2017",apartment,,,,,Concord,SC
1043655,Spacious modern home in Laurelhurst w/ easy access to restaurants & more!,45.523898,-122.634498,"Kerns, Portland, OR, USA",0,,201,,,,,,2,4,1,1,house,Yes,2001,Within an hour,,"June 9, 2017",house,,,4,,Concord,SC
663477,Beautiful Downtown Portland Condo. Put the City at Your Fingertips!,45.51573719,-122.68579918,"Goose Hollow, Portland, OR, USA",24,4.9,74,,129,,,,30,4,1,1,condo,Yes,2015,Within a few hours,100%,"June 4, 2017",condo,2,504,4,building,Concord,SC
4563301ha,Patton Park North: Sunny close-in apartment living,,,"Overlook, Portland, OR, USA",0,,100,120,,,30,,,2,1,1,house,Yes,2017,,,"May 23, 2017",house,,,,,Concord,SC
4578069ha,"*On Alberta! Modern Artist Loft w/ Rooftop Views!* - One Bedroom Apartment, Sleeps 3",45.55925,-122.652786,"Alberta, Portland, OR, USA",0,,181,,,,,,1,3,1,1,apartment,Yes,2017,Within a few hours,,"June 9, 2017",apartment,,0,,,Concord,SC
4578154ha,"Bridgetown Penthouse: 2/2 + parking. Walk Score 95 - Two Bedroom Apartment, Sleeps 4",45.522209,-122.650993,"Buckman, Portland, OR, USA",0,,213,,,,,,,4,2,2,apartment,Yes,2017,Within a few hours,,"June 9, 2017",apartment,,0,,,Concord,SC
4472190ha,"Serene, newly-renovated Home in the heart of Wine Country",,,"Hillsboro, OR, USA",0,,125,125,,,150,10.8%,30,6,3,2,townhome,Yes,2017,,,"June 9, 2017",townhome,,1568,,,Concord,SC
29508,'Floating Home' Featured on ~HGTV's~ Living Channel 80 Homes,45.34604645,-122.6267395,"Canemah, Oregon City, OR, USA",54,4.8,400,400,,,,,2,8,3,2,house boat,Yes,2003,Within a few hours,80%,"June 9, 2017",house boat,,2400,,,Concord,SC
182586,Mid-Century Mod with View of Downtown!,45.55327988,-122.64653015,"Sabin, Portland, OR, USA",14,,93,,,,125,,30,4,2,1,house,Yes,2008,Within a few hours,100%,"April 11, 2017",house,,800,4,,Concord,SC
232123,River Front Portland Oregon Condo $7500-$9000 a mo. Less than hotels!,45.50833893,-122.67370605,"Downtown, Portland, OR, USA",3,,300,,,,,,30,4,2,2,condo,Yes,2007,Within a day,100%,"May 29, 2017",condo,,,4,,Concord,SC
241713ha,May Special $500 discount,45.529907,-122.6823762,"Pearl District, Portland, OR, USA",25,,167,,,,,,30,4,1,2,condo,Yes,2009,Within a few hours,100%,"June 3, 2017",condo,,1100,4,,Concord,SC
392214ha,Riverfront:Two Floors w/ Stunning River Views & 200 sf  Private Patio,45.530792,-122.675274,"Old Town Chinatown, Portland, OR, USA",31,,117,,,,75,,30,4,2,2,condo,Yes,2011,Within a few days,80%,"May 30, 2017",condo,2,1060,4,,Concord,SC
363021,Charming Garden Court Just Off Hawthorne!!,,,"Buckman, Portland, OR, USA",23,,93,95,,,,11.5%,6,2,1,1,apartment,Yes,2011,Within a day,90%,"April 17, 2017",apartment,,,2,,Concord,SC
377062,Beautiful Condo on the Columbia RiverNear Dntown Vanc & Port,45.61650467,-122.65288544,"Columbia Way, Vancouver, WA, USA",16,4.8,160,160,,,100,10.4%,7,6,2,2,condo,Yes,2011,Within a day,80%,"June 3, 2017",condo,,1350,6,,Concord,SC
387895,Beautiful Craftsman in the Heart of Hawthorne,45.51077271,-122.61483765,"Richmond, Portland, OR, USA",12,,165,165,,,65,,2,6,2,1,house,No,2011,Within a day,100%,"April 24, 2017",house,,,6,,Concord,SC
328987ha,"Elegant, Comfortable, Newly-renovated  Westside Townhouse",45.539877,-122.78165,"Forest Heights, Portland, OR, USA",11,4.9,89,,,,,,30,5,2,2,townhome,Yes,2007,Within a few hours,100%,"May 30, 2017",townhome,3,1550,5,,Concord,SC
